Post Title,Subreddit,Post ID,Created Time,Upvotes,Upvote Ratio,Comments Count,Post URL,Author,Flair,Post Text
Tired of photoshopped product placement that totally misrepresents the product...,AmazonVine,1i9wzi1,2025-01-25 16:03:19,1,0.67,4,https://i.redd.it/np5mexicf7fe1.png,General_Bug_1292,Discussion,
Is this Coinbase wallet?,BASE,1i9tixr,2025-01-25 13:32:13,1,1.0,1,https://i.redd.it/jh2b5a5jo6fe1.png,Patience-Available,,
Fork question,Yamaha_R1,1i9syqq,2025-01-25 13:07:32,1,1.0,1,https://www.reddit.com/r/Yamaha_R1/comments/1i9syqq/fork_question/,Lopsided-Obligation8,,I have a 2006 R1 one of the forks is taller than the other by like 1inch or so is it safe to ride? 
Balance not showing,BASE,1i9qqlv,2025-01-25 11:31:26,1,1.0,0,https://i.redd.it/704ltmj236fe1.png,cantgowrong123,,"I can see the transactions went into my account but the balance is showing 0. How is this possible, can someone help?
"
Filling in drywall edge to stone wall?,drywall,1i9paoe,2025-01-25 10:27:29,93,0.99,98,https://www.reddit.com/gallery/1i9paoe,Significant-Carpet,,"Hi I was just wondering how you would fill the edge between the drywall and this stone and lime mortar wall? Gaps are between 1/8 to 1inch in some places.

I was thinking caulk, drywall mud or lime mortar. I am leaning towards the lime mortar and priming the drywall edge to help with water resistance."
Interesting cut on these ribs. How should I cook them?,smoking,1i9p8y7,2025-01-25 10:25:12,0,0.5,2,https://i.redd.it/eiklyqn6r5fe1.jpeg,Fizzgig000,,"Family member bought a cow and brought me bbq ribs to cook.im used to short ribs and Dino ribs, but have never seen 1inch cuts. Cook low and slow still, or something different?"
Buy Signal 1inch Network USD - 25 Jan 2025 @ 08:51 -> USD0.308,getagraph,1i9ne9h,2025-01-25 08:54:02,1,1.0,0,https://www.reddit.com/r/getagraph/comments/1i9ne9h/buy_signal_1inch_network_usd_25_jan_2025_0851/,jvc72,Crypto,"Ticker: **1INCHUSD**

Exchange: **CRYPTO**

Time: **25 Jan 2025 @ 08:51**

Price: **USD0.308**

Link: https://getagraph.com/crypto-currencies/1INCHUSD/ENG"
Trouble’s new name is Godzilla,hermitcrabs,1i9l9w3,2025-01-25 06:45:55,5,1.0,0,https://v.redd.it/rccwrqp4o4fe1,CluelessBlonde22,Crab Photo!!,"He’s been in a 1inch opening shell for the better part of a year. Had a really hard time finding appropriate sizes up for him, ordered a 1.6inch opening and was not expecting him to change into it. I should’ve known better 🥲 now I feel I need to upgrade my 70g tank for this monster "
What a beautiful view to wake up to.,TheRaceTo10Million,1i9hxd5,2025-01-25 02:37:52,34,0.9,25,https://i.redd.it/usp5zqjvf3fe1.jpeg,Little-Confidence802,Losses,
"Wish me luck! I would like to thank the wonderful people of this sub for being so helpful and supportive, they reinforced my obsession with this hobby 🫶🏻",freedomisgunpla,1i9ctwu,2025-01-24 21:25:12,143,1.0,39,https://i.redd.it/34vqf8e3w1fe1.jpeg,Inevitable-Ice-5061,Gunpla,
Pottery wheel for my daughter,Pottery,1i995gn,2025-01-24 18:24:21,0,0.42,61,https://www.reddit.com/gallery/1i995gn,Renegadeselite,:snoo_shrug: Question! :snoo_shrug:,I have a 11-year-old daughter that is expressed interest in pottery. I had ordered her the blue one in the picture. I was thinking on getting pink what I need to ask you all is there any other recommendations for pottery wheels for my daughter? I picked the blue one because it was less than $100 but since I don’t know too much about pottery and she knows nothing except for YouTube videos we watch I want to make sure that I’m getting something that at least she’ll be able to learn and grow with.. 
my break up story time ☕️,BreakUp,1i98vvy,2025-01-24 18:12:14,6,0.87,2,https://www.reddit.com/r/BreakUp/comments/1i98vvy/my_break_up_story_time/,PresentationShot1884,,"hi guys, this is my first reddit post because i can’t sleep so i just wanna spill some tea! pls let me know your thoughts, i think we could have a fun discussion here. (please be respectful and open minded tho!)

i met this dude back in 2020, we began dating in 2021, and then broke up in mid 2023. we broke up amicably and agreed to stay friends. we loved each other but had our differences, he struggled with being intimate and we never once had sex. he was anxious on how to approach sex after his diagnosis, but i’ve done my research and have had many ideas on how to approach sex/intimacy in many different ways beyond intercourse, but we still couldn’t overcome that. i’ve expressed that sex & intimacy is important for me to feel connected to my romantic partner (i am kinda demi-romantic; its hard for me to experience romantic feelings for someone but when i do, i require intimacy bc that differentiates my romantic relationships vs my platonic relationships; he began to feel like just a friend that i mislabeled as a lover) i was committed to the relationship that i even considered the possibility of me having a strictly sexual partner to fulfill my needs. we agreed to try, but when i got on the apps i realized i wouldn’t even let anyone touch me unless i had a close connection to them. when we got to that realization that there wasn’t much solutions to attempt and no compromises we could make, we both decided to end things before it got messy, we didnt want our love for each other to become resentment. we planned our last date and did our favorite things, had one last sleepover, and said our goodbyes. he said he wanted to keep in touch, so we would text and send a check in memo weekly for the first few initial months, but i started feeling hurt when things grew inconsistent, i told him we dont need to check in as often, so it became a monthly thing. by 2024, i told myself i wasn’t going to reach out, maybe on his birthday. i hoped that things would die down from here, but he would continue sending memos monthly, sometimes i would respond, sometimes i wouldnt. and his voice memos would consist of minor updates on his life like his gym progress, his work/career, his family & relatives i’ve met, and sometimes some pop culture and similar interests we shared. i found it endearing and sweet, yet difficult and conflicting, because i am a lover girl and its hard for me to let go. and i was trying to figure out how to transform this love into a friendship, bc i still wanted to support him even if we weren’t together. 

for extra context: this was my first healthy relationship and for him, i was his first ever long term romantic relationship. we started as friends than became lovers. and even at the time of our break up, we still were very much were in love and had love for each. so as you could imagine, it’s a difficult thing to let go and overcome for anyone.

so time flies and its the summertime, which marks 1 year since the break up and im still trying to process it. but we are still doing our monthly check ins, and i even begin to send the first memos and initiate the conversations, going back on my 2024 resolution on ‘not’ reaching out. (i know what your thinking, girl ur not getting over him bc yall keep talking….shhhhh i am very self aware, but i was just ms. delulu at the time. my hopeless romantic ass thought he was gonna come back into my life and finally f*ck me…but only one can dream </3)(but chill, lemme cook things will start getting juicy) 
we send our silly little goofy memos, and afterwards i get an inclination to stalk his profile. my body told me something is afoot, and my mind was like “he is talking to someone.” so i do my due diligence, and i stalk his ig profile. (after we broke up, i decided to unfollow each other on social media) a necessary thorough check had to be done bc i am not new to this i am true to this… and lo and behold, i see in his tagged photos a picture of this girl, taking a pic with a mirror, and his @ tag is specifically placed on her ass. and im like AND A OOP! that pic was in a collection of a casual photo dump but it wreaked of a soft launch… so naturally i stalk her profile, and i dont see much interaction besides him liking that ‘one’ post and none of the newer pics. but whats ODD, is he didnt even leave a comment on the ass pic. (bc if i was her man…id be BARKING but i guess thats neither here or there) but because he hasn’t really interacted much on her profile, i just assumed it was accidental or nothing deep. there wasn’t much information to make of this anyways, so i just keep it pushing.

Now its fall time and he sends me his usual memo update on the gym, work, family, and pop culture, short and brief. but interestingly enough, the last few memos from the previous months, he has mentioned certain things like “this made me think of you,” or “i did this thing, and it was very “you” coded.” and i didnt think too deeply about that, bc i believe that can happen and exist when your friends, but its a hard line to tread when that is your ex. but i gave him the benefit of the doubt and tried my best not to internalize it, but it did make me feel warm inside. but this recent memo, he mentioned my upcoming birthday and gave me a really heartfelt birthday wish. i thought it was so sweet that i ended up on his ig profile again. i went straight to his tagged photos and clicked the pic with the girl, this time there were new photos on her page. and the most recent one happened to be a photoshoot/hard launch of them on together, but mind you….he didnt comment on the post, he wasn’t tagged on either, and he didnt even LIKE it?!?! then i looked at her other pics and he is missing in the likes too… mind you i know he has been online bc he post a new story weekly. (how do i know this, i used the watch ig story anonymous websites) and just the icing on the cake, he hasnt even made a post on his profile of them. so as you can imagine the confusion!! with all this new information, a new found motivation was instilled in me that night. i was hysterical and manic past midnight, stalking all of her profiles. by sunrise, i’ve seen all i’ve needed to know. i found out they started talking or atleast going out on dates during feb/march, then officially bf/gf by june/july and been together ever since. so by my deductions, they would’ve been together from atleast 6-10 months at this point. BUT THE BIGGEST GAG IS, WE ARE VERY SIMILAR. she is creative, she likes to sing, she constantly changes her hair, she likes the same anime, she collects cute things, she’s LITERALLY 1inch shorter than me, AND SHE LOOKS LIKE ME. another crazy thing that i discovered through her twitter, she drew him a picture of them together for his birthday gift..2 years ago, i did the same thing but put him into his favorite anime as his own character…i know his ass couldn’t help but recall my gift and draw parallels how similar it all is. 

but when i tell you i was SPIRALING, you better NAURTO BELIEVE IT! so many things were running through my head, like how come you never told me? how come you get to be happy? how come im still stuck on you? how come you get to find love? is she better than me? is she what you wanted but i could never be? how could you get over me so quickly? how come its her and not me? why do i even care? why do you even talk to me? why do you even text me? what do you even want from me? like can you imagine being in a whole relationship, dating a new girl, whilst still being friends with your ex and talking on a monthly basis but not sharing that information…im sorry is your new gf not worth mentioning?? or giving an update on?? i dont need to know all the details, but DUDE PUT SOME RESPECT ON YOUR GIRL…even if it upsets me, that isn’t your problem. if we are FRIENDS like you desire us to be, TREAT ME LIKE ONE. i was initially very EMBARRASSED AND SAD, but then i grew so angry, frustrated and disgusted. there was sooooo many feelings flowing through me all at once. i didnt know how to make sense of it, but all i knew is i didnt like it. i didnt like that he didnt tell me, i didnt like that he is playing the field between me and her, and i didnt like how he was ‘treating’ her. so i simply just blocked him because this was never going to end. and here i was again, making decisions and creating solutions for that man even after our break up. as im writing this its been over 2 months now, and i dont plan on unblocking. 
BUT FUNNY ENOUGH, i started using this dating app and why a few weeks later, i get a LIKE from MY EX’S BEST FRIEND. i thought long and hard about what i wanted to do, if this was a trick, if it was sus, or if men are even dumber than we ever imagined? a part of me wanted to ‘like’ his best friend back but not text him, or text him and expose that i know who he is (we never met in person), or even play dumb too and start a casual conversation. but unfortunately as the noble steed, i took the high ground and declined. but it really made me think tho…were these two in kahoots, was the best friend on a solo mission to catch me slipping, or was it men just being men and swiping on everybody and anybody? 

but ANYWHOS, this concludes my lil story time. if you made it this far, i greatly appreciate you! <3 this was very therapeutic and fun to write. also, please comment something, i wanna get the reddit experience or whatever… ty xoxox
 



"
my break up story time ☕️,BreakUps,1i98vji,2025-01-24 18:11:48,0,0.5,0,https://www.reddit.com/r/BreakUps/comments/1i98vji/my_break_up_story_time/,PresentationShot1884,,"hi guys, this is my first reddit post because i can’t sleep so i just wanna spill some tea! pls let me know your thoughts, i think we could have a fun discussion here. (please be respectful and open minded tho!)

i met this dude back in 2020, we began dating in 2021, and then broke up in mid 2023. we broke up amicably and agreed to stay friends. we loved each other but had our differences, he struggled with being intimate and we never once had sex. he was anxious on how to approach sex after his diagnosis, but i’ve done my research and have had many ideas on how to approach sex/intimacy in many different ways beyond intercourse, but we still couldn’t overcome that. i’ve expressed that sex & intimacy is important for me to feel connected to my romantic partner (i am kinda demi-romantic; its hard for me to experience romantic feelings for someone but when i do, i require intimacy bc that differentiates my romantic relationships vs my platonic relationships; he began to feel like just a friend that i mislabeled as a lover) i was committed to the relationship that i even considered the possibility of me having a strictly sexual partner to fulfill my needs. we agreed to try, but when i got on the apps i realized i wouldn’t even let anyone touch me unless i had a close connection to them. when we got to that realization that there wasn’t much solutions to attempt and no compromises we could make, we both decided to end things before it got messy, we didnt want our love for each other to become resentment. we planned our last date and did our favorite things, had one last sleepover, and said our goodbyes. he said he wanted to keep in touch, so we would text and send a check in memo weekly for the first few initial months, but i started feeling hurt when things grew inconsistent, i told him we dont need to check in as often, so it became a monthly thing. by 2024, i told myself i wasn’t going to reach out, maybe on his birthday. i hoped that things would die down from here, but he would continue sending memos monthly, sometimes i would respond, sometimes i wouldnt. and his voice memos would consist of minor updates on his life like his gym progress, his work/career, his family & relatives i’ve met, and sometimes some pop culture and similar interests we shared. i found it endearing and sweet, yet difficult and conflicting, because i am a lover girl and its hard for me to let go. and i was trying to figure out how to transform this love into a friendship, bc i still wanted to support him even if we weren’t together. 

for extra context: this was my first healthy relationship and for him, i was his first ever long term romantic relationship. we started as friends than became lovers. and even at the time of our break up, we still were very much were in love and had love for each. so as you could imagine, it’s a difficult thing to let go and overcome for anyone.

so time flies and its the summertime, which marks 1 year since the break up and im still trying to process it. but we are still doing our monthly check ins, and i even begin to send the first memos and initiate the conversations, going back on my 2024 resolution on ‘not’ reaching out. (i know what your thinking, girl ur not getting over him bc yall keep talking….shhhhh i am very self aware, but i was just ms. delulu at the time. my hopeless romantic ass thought he was gonna come back into my life and finally f*ck me…but only one can dream </3)(but chill, lemme cook things will start getting juicy) 
we send our silly little goofy memos, and afterwards i get an inclination to stalk his profile. my body told me something is afoot, and my mind was like “he is talking to someone.” so i do my due diligence, and i stalk his ig profile. (after we broke up, i decided to unfollow each other on social media) a necessary thorough check had to be done bc i am not new to this i am true to this… and lo and behold, i see in his tagged photos a picture of this girl, taking a pic with a mirror, and his @ tag is specifically placed on her ass. and im like AND A OOP! that pic was in a collection of a casual photo dump but it wreaked of a soft launch… so naturally i stalk her profile, and i dont see much interaction besides him liking that ‘one’ post and none of the newer pics. but whats ODD, is he didnt even leave a comment on the ass pic. (bc if i was her man…id be BARKING but i guess thats neither here or there) but because he hasn’t really interacted much on her profile, i just assumed it was accidental or nothing deep. there wasn’t much information to make of this anyways, so i just keep it pushing.

Now its fall time and he sends me his usual memo update on the gym, work, family, and pop culture, short and brief. but interestingly enough, the last few memos from the previous months, he has mentioned certain things like “this made me think of you,” or “i did this thing, and it was very “you” coded.” and i didnt think too deeply about that, bc i believe that can happen and exist when your friends, but its a hard line to tread when that is your ex. but i gave him the benefit of the doubt and tried my best not to internalize it, but it did make me feel warm inside. but this recent memo, he mentioned my upcoming birthday and gave me a really heartfelt birthday wish. i thought it was so sweet that i ended up on his ig profile again. i went straight to his tagged photos and clicked the pic with the girl, this time there were new photos on her page. and the most recent one happened to be a photoshoot/hard launch of them on together, but mind you….he didnt comment on the post, he wasn’t tagged on either, and he didnt even LIKE it?!?! then i looked at her other pics and he is missing in the likes too… mind you i know he has been online bc he post a new story weekly. (how do i know this, i used the watch ig story anonymous websites) and just the icing on the cake, he hasnt even made a post on his profile of them. so as you can imagine the confusion!! with all this new information, a new found motivation was instilled in me that night. i was hysterical and manic past midnight, stalking all of her profiles. by sunrise, i’ve seen all i’ve needed to know. i found out they started talking or atleast going out on dates during feb/march, then officially bf/gf by june/july and been together ever since. so by my deductions, they would’ve been together from atleast 6-10 months at this point. BUT THE BIGGEST GAG IS, WE ARE VERY SIMILAR. she is creative, she likes to sing, she constantly changes her hair, she likes the same anime, she collects cute things, she’s LITERALLY 1inch shorter than me, AND SHE LOOKS LIKE ME. another crazy thing that i discovered through her twitter, she drew him a picture of them together for his birthday gift..2 years ago, i did the same thing but put him into his favorite anime as his own character…i know his ass couldn’t help but recall my gift and draw parallels how similar it all is. 

but when i tell you i was SPIRALING, you better NAURTO BELIEVE IT! so many things were running through my head, like how come you never told me? how come you get to be happy? how come im still stuck on you? how come you get to find love? is she better than me? is she what you wanted but i could never be? how could you get over me so quickly? how come its her and not me? why do i even care? why do you even talk to me? why do you even text me? what do you even want from me? like can you imagine being in a whole relationship, dating a new girl, whilst still being friends with your ex and talking on a monthly basis but not sharing that information…im sorry is your new gf not worth mentioning?? or giving an update on?? i dont need to know all the details, but DUDE PUT SOME RESPECT ON YOUR GIRL…even if it upsets me, that isn’t your problem. if we are FRIENDS like you desire us to be, TREAT ME LIKE ONE. i was initially very EMBARRASSED AND SAD, but then i grew so angry, frustrated and disgusted. there was sooooo many feelings flowing through me all at once. i didnt know how to make sense of it, but all i knew is i didnt like it. i didnt like that he didnt tell me, i didnt like that he is playing the field between me and her, and i didnt like how he was ‘treating’ her. so i simply just blocked him because this was never going to end. and here i was again, making decisions and creating solutions for that man even after our break up. as im writing this its been over 2 months now, and i dont plan on unblocking. 
BUT FUNNY ENOUGH, i started using this dating app and why a few weeks later, i get a LIKE from MY EX’S BEST FRIEND. i thought long and hard about what i wanted to do, if this was a trick, if it was sus, or if men are even dumber than we ever imagined? a part of me wanted to ‘like’ his best friend back but not text him, or text him and expose that i know who he is (we never met in person), or even play dumb too and start a casual conversation. but unfortunately as the noble steed, i took the high ground and declined. but it really made me think tho…were these two in kahoots, was the best friend on a solo mission to catch me slipping, or was it men just being men and swiping on everybody and anybody? 

but ANYWHOS, this concludes my lil story time. if you made it this far, i greatly appreciate you! <3 this was very therapeutic and fun to write. also, please comment something, i wanna get the reddit experience or whatever… ty xoxox
 



"
Not sure on sizing... Help please,filson,1i97tam,2025-01-24 17:24:24,2,1.0,7,https://i.redd.it/wazljon4p0fe1.png,Cpipe1005,Discussion,"Looking to buy to the short lined cruiser jacket but not sure on the sizing. I'm a 44"" chest so going by the bodyeasurent chart I should be a L but the garment measurements are saying it's almost 48"" on the chest which surely will be massive! Anyone have any experience with sizing of this jacket?
For reference I'm 6'1, 210lbs."
Suspicious mass on ovary,AskDocs,1i95ga2,2025-01-24 15:42:19,1,1.0,2,https://www.reddit.com/r/AskDocs/comments/1i95ga2/suspicious_mass_on_ovary/,Feisty_Assistant3446,,"My (M23) GF’s (F25) gynaecologist recently discovered a relatively small (2,5cm/1inch) mass on one of her ovaries (during a regular check-up). 
The gynaecologist then did a doppler ultrasound and said that, judging at the blood flow around/of the mass, it doesn’t look like cancer/it’s probably not cancer, but also doesn’t look like a cyst. The weird thing is that she had an appointment just about a year ago and everything was fine - so this thing, whatever it is, grew from 0 to 2,5cm in just a year. The gynaecologist scheduled a check-up in 3 months time, but isn’t that a bit long considering the rate of growth of this thing?

And what else could this thing possibly be ?(considering that benign tumours don’t generally grow this fast) 

Apologies if my post is a bit of a mess, I’m just really worried for my gf and would like to do everything I can to help her. Thank you in advance for you feedback. "
Prototype biplane bikepacking forks are in,xbiking,1i90893,2025-01-24 12:03:54,338,0.98,97,https://www.reddit.com/gallery/1i90893,Bipro1ar,,"I was working on these forks for 100 custom frame sets I had already made. Had a break-in at my warehouse and got cleaned out of everything - they tore off the roll-ups with a truck and even took the sink and doors. I had already ordered these biplane crowns and removeable canti mounts, so I decided to move forward with the forks and try to start my company up again. just got my prototypes in from Taiwan and I love them. I hope you do too. Will need to presell 60 of them at about $160 in order to do a full production run, let me know if your interested. I have 1inch and 1 1/8 inch, a to c of 400mm, and 42mm offset. 3 pack mounts, mid blade barrels, and crown mounts, canti and disc compatible."
