Post Title,Subreddit,Post ID,Created Time,Upvotes,Upvote Ratio,Comments Count,Post URL,Author,Flair,Post Text
TA Guide - Easy wins with campaign staples (+Re'vas),WH40KTacticus,1i9469p,2025-01-24 14:47:35,7,0.89,1,https://www.reddit.com/r/WH40KTacticus/comments/1i9469p/ta_guide_easy_wins_with_campaign_staples_revas/,KarmaVault_,Guide,"I dislike TA - the anxiety of facing off against a live opponent, for me, is way worse than the satisfaction of outplaying them. And as a new player, it feels shitty to lose to teams of legendaries when I don't have a single one (Abaddon doesn't count :P). But the (energy) rewards are so good that I always feel obligated to go for the final chest. And winning always feels better than losing. 

This season, I'm 30-4 in Common with some campaign staples, and since I didn't see a lot of guides on this topic, I thought I'd share my experience with them for anybody still struggling for that final chest:

Re'vas,  Calandis,  Boss G,  Thaddeus,  Aleph-Null,  Forgefiend

I think this is a solid roster that is particularly good in Infested Power-Ups: it can take power-ups, deny them to the enemy, and has decent sustain against the hordes.

**Re'vas**: everyone knows how good her overwatch is at making space, although I think most people agree she's not quite the TA god she used to be. She's still unmatched in area denial, and even when countered, I feel like it usually takes more resources to deal with her (suppression, forgefiend primary, plus 2-3 solid hits). If she isn't countered, she provides a safe shelter for the rest of the squad to position. 

I almost always beelined toward the center on turn 1 and set up her active, either claiming a power-up or 2 spaces away from another power-up, threatening it. Of course, infiltrators (cough Mataneo), Celestine, and suppression (Thaddeus, Azrael, but not very common) make this more tricky, so in those cases I'll be more conservative with positioning my squishier characters, assuming OW will be nullified. I still won an embarrassing number of matches to opponents suiciding their characters into the OW, either on accident or hubris. 

She also helps provide a soft win condition in close matches: in a 2v2, Re'vas and Aleph can fly away and sustain each other while the horde takes small bites out of the opponents. I'll sometimes use her melee to ignite a tile to enable Forgefiend to attack an enemy character; otherwise she usually doesn't do much damage after Turn 2.

**Calandis**: amazing at picking up power-ups on razor wire using her active, and it feels amazing when you manage to snag a damage or hits power-up, shoot, then immediately reposition onto a second power-up. Has synergy if Boss G pops his active right next to her and gives her an extra two hexes of movement. Fragile though, and usually a priority target for opponents, especially if powered up. I never relied on her OW, since the hordes usually pop it. 

**Boss G**: usually MVP of the team, provides reach and damage with active, especially great for punishing overextended characters. Good opponents will position just out of reach (4 hexes). Since Re'vas almost always provides center control Turn 1-2, I park him aggressively up next to her and generally get off a solid active the next turn. Consider parking Aleph adjacent the turn before you plan on popping his active. 

**Thaddeus**: he did some decent work suppressing enemy Re'vas, but I didn't see them all that often. To be honest, I kinda wish I had Sho'syl to use instead, but Thaddeus still did a good job of popping shields and providing consistent long-ranged damage. It was rare for him to survive to Turn 3-4 (and anyways often the game is decided before then) but the charge-up on his active is a decent clock to have, and is tempting to use on clustered groups. Definitely keep him as far from harm's way as possible. 

**Aleph-Null**: decent upfront burst with scarabs, but don't rely on them further than that. Could probably be flexed for another mobile/tanky melee like Godswyl or Mataneo (but I don't have either). But he flies and is a priority recipient for the health power-up, which makes him into a win condition **IF** he survives and both teams are down to 1-2 characters, especially if Re'vas also survives. Can also heal Boss G in a slugfest. I have won quite a few matches which were overrun by tyrannids, fires everywhere from Forgefiend, with Aleph sustaining himself. 

**Forgefiend**: best MoW, period. Shuts down Abraxas, clears Re'vas drones, scarabs, ork boys, etc. Fire area denial can sometimes outright win games by keeping power-up'd enemy melee at bay away from their team. 

The usual flow of games is: turn 1, grab any power-ups within easy reach, overwatch Re'vas. If the opponent can deal with OW (suppress, infiltrate), position everybody else further back; if not, then everybody up front.  Sometimes when going second, you can take down an overextended character on turn 1. Next turn, focus down 1-2 priority targets, usually using Boss G active. I only had a couple of opponents hang back in a ball and wait for me to approach them, most of them rushed in or split their team around the center, both of which are easily dispatched.

I lost to an Exitor-Rho mech team (wasn't even mad, it started with Rho slipping next to my overwatched Re'vas and went downhill from there), a Kharn team, one Ragnar wombo combo, and one other team I forget.

Good luck to you all out there! Would love to other peoples' thoughts about the team and strategy"
Language school/Escuela de lenguas,valencia,1i8tm7t,2025-01-24 06:49:36,5,0.86,4,https://www.reddit.com/r/valencia/comments/1i8tm7t/language_schoolescuela_de_lenguas/,DesperateHistory8115,Discussion,"Hello, I'm a foreigner hoping to eventually study a Master's in Secundary Education. However, if I want to become a teacher here (extremely difficult I know but I intend to stay and have a future in Valencia with my fiancé who is Valencian) then I need a C1 in Valencian and Spanish. So, I was hoping to attend a Spanish language school to build up my skills. I've been looking at schools but does anyone have any personal experience with any language schools here, in particular Route 66, Ele Aleph and El Carmen? I know there's reviews online but I know reviews can be bought and most reviews aren't very detailed. I also can't go to an EOI because I need at least 20 hours a week.

Also if anyone knows where I can study Valencian for a few hours every week please let me know! I live in an area affected by DANA and my Escola d'Adults is no longer running the Valencian class I used to attend. Thank you very much! 

Hola, soy extranjera y quiero estudiar un máster en educación secundaria aquí.  Pero, si quiero ser profesora aquí (ya lo sé que es difícil pero quiero un futuro aquí con mi novio valenciano) necesito un C1 en valenciano y castellano. Así que, ¿alguien tiene experiencia personal con una escuela de lenguas aquí, especialmente Route 66, Ele Aleph y El Carmen? Hay reseñas en línea pero sé que puedes comprarlas y las reseñas son muy similares. También, no puedo ir a la EOI porque necesito estudiar por 20 horas o más. 

También, si alguien sabe dónde puedo estudiar valenciano durante un poco todas las semanas dime por favor. Es que vivo en uno de los pueblos afectados por DANA y mi Escola d’Adults y ya no dan la clase de valenciano a la que asistía. ¡Muchas gracias! "
