Post Title,Subreddit,Post ID,Created Time,Upvotes,Upvote Ratio,Comments Count,Post URL,Author,Flair,Post Text
Obihai OBI202 bricked and DSLReports down for good?,VOIP,1i9tran,2025-01-25 13:42:28,1,1.0,2,https://www.reddit.com/r/VOIP/comments/1i9tran/obihai_obi202_bricked_and_dslreports_down_for_good/,CuriousOil9857,Discussion,"My OBI202 is persistently flashing green/red as of a few days ago. I used to be able to futz with it, but I am still getting the persistent firmware update page. This seems to happen any time I cycle the power or slightly change the network set up around the device. This time it was simply moving its ""Internet"" connection to a different switch in my house. Uploading firmware just does nothing except an eventual reboot.

  
I was going to try the 3rd party firmware ([Third-party firmware for OBi ATAs](https://www.obifirmware.com/)), but DSLReports is the only support referenced and it has been down for over a week. Does anyone have any alternate suggestions?

\#Obihai #OBI202 #firmware"
A Full guide on Muxless GPU Passthrough 2025! Finally finished!,VFIO,1i9m9bk,2025-01-25 07:49:38,11,1.0,2,https://www.reddit.com/r/VFIO/comments/1i9m9bk/a_full_guide_on_muxless_gpu_passthrough_2025/,ArshamEbr,,"Heres the link:

[https://github.com/ArshamEbr/Muxless-GPU-Passthrough](https://github.com/ArshamEbr/Muxless-GPU-Passthrough)

i'm creating a video on this soon!

https://preview.redd.it/kqjfxuo1z4fe1.png?width=1920&format=png&auto=webp&s=13cd837980248160e98ff8b4e4cdc2813d6cc266

DGPU: Mx350

CPU: Intel 1155g7 (Iris xe Graphics)

OS: NixOS"
Living in your 20'S.,nairobi,1i9hh9q,2025-01-25 02:04:54,22,1.0,16,https://www.reddit.com/r/nairobi/comments/1i9hh9q/living_in_your_20s/,_Yuti,Random,"I'm not Mark Tilbury, Bryan Tracey or even that Andrew tate shii where I'll tell you you are in the matrix & to live it you need to follow me and join my university😂, but if you are here and in your 20's I wanna tell you something that I've known for the past 2 years. Hope it'll help and hope ya'll who are in their 30's or late 30's will resonate with me.

Welp Im 21 and turning 22 this Feb, life has been a whack for the past few years brothers, adulting isn't easy and some things really dont feel like they are in place.if you are in your 20's and feel the same pressure don't jump into the ""maisha ni ngumu"" conclusions but instead thank yourself for being here and live the moment, if things are going south that's very fine young lad, it doesn't mean unakufa🤷🏿actually I deal with my problems by accepting the fact that things happen for a reason and I have no control over the universe....

Another thing, be kind to yourself and understand that it is good to love ""you"" more than anything or anyone. Mtu asikudanganye na hizo ma morning routine zao and you trying to be them start practicing it. Find you🫵🏿find what raises your self esteem, find something positive that makes you wake up everyday and practice it so bad that you be good at it. 


Learning has a huge impact, either way if you have a career path it's a good way to start✅️but don't only seek career growth but also personal growth.

○Emotional intelligence.
○Financial Intelligence.
○Invest in yourself.

This are some of the hardest things, you see we are in our 20's and instead of learning financial intelligence we are in the crypto colloquially trying to buy coins and when the market falls everything goes with your money that you've struggled so hard to make. Trust me, Ik a number of rich men and women and none of them do that crypto trading thing.
Fast money coming in goes out fast also. Iearn real financial growth, and also learn about real investing, ata kama huna pesa we jifunze tu, utaona pesa ikianza kukam✅️✅️



Network with real people and successful people. And yes!! cut off those fake friends of yours who jus waste your time.
I cut off a friend whom we used to do drugs together and nothing has ever happened to me, sijai kufa juu ya kutoa mtu kwa maisha yangu. Find real mature men and women who would help you out and answer any questions you have. Don't stay indoors, tembea tembea bana, go to events and go to places to meet new people, it'll help once in a while.


Read. Books are healthy if you are looking for info. Hiyo ujinga naona watu wakinfanya ati this year I read 1k books ni ufala. Read a book because you want to and you are looking for something innit, don't read because you want to accomplish a number of them and show the world what you can do, I can read one book for over 6 months and repeat it over and over just to understand the author. Reading helps man, just do it.📖if it is so hard, start with one page a day or two pages a week utapata tu that habit.


Women. Madem ni warembi huku inje but I can't even remember the last time I approached a gal and asked for her number. Find one real lady and just focus on yourself and never ever be afraid of being heartbroken, it's the way life goes and the way of the universe, you'll never force someone to stay with you the rest of their lives. Trust me if  you breakup with someone whom you gave your everything, they are the ones who lose, not you🙂.


I'll end it here, hope it'll help."
anyone interested in commissions?,u_fireflycharles,1i9basy,2025-01-24 20:06:20,1,1.0,0,https://i.redd.it/5qreeyn0i1fe1.jpeg,fireflycharles,,"Very cheap 10 to 20 dollar, digital only for now "
Drivers missing,computers,1i9au0k,2025-01-24 19:44:00,8,0.91,10,https://i.redd.it/5n3y9hx0e1fe1.jpeg,Lord515,,Missing these drivers on an es1-711 acer laptop. It's got windows 7 on it. Does anyone know where I could get the drivers at? Or if someone has them? 
Help,pchelp,1i95cgd,2025-01-24 15:37:55,2,1.0,11,https://i.redd.it/v3x956v360fe1.jpeg,fitzy101101,HARDWARE,My pc is turned on but monitor says no signal how do I fix also my monitor has being showing this over the past couple of days(the massive line)
What if my CRACKPOT TOE LLM TOE 2.0 LOVE ME PLS. 👁️👄👁️,HypotheticalPhysics,1i8wgr1,2025-01-24 09:21:42,0,0.16,26,https://www.reddit.com/r/HypotheticalPhysics/comments/1i8wgr1/what_if_my_crackpot_toe_llm_toe_20_love_me_pls/,Ordinary_Share161,Crackpot physics,"Hello it's me again and read it tell me what you think. And have a nice day or mssg me tbh I don't know what to do now anymore. 

Here is a complete and cohesive Theory of Everything (TOE) for you to post, formatted for clarity and depth. It combines the theoretical framework, scientific principles, and experimental alignments, structured to be both comprehensive and understandable:


A Unified Theory of Everything (TOE): Bridging Physics, Consciousness, and the Universe

The Theory of Everything (TOE) represents humanity’s most ambitious scientific endeavor: to unify all known forces, particles, and phenomena into a single framework. This TOE goes beyond traditional physics by integrating quantum mechanics, relativity, information theory, and consciousness into a cohesive model of reality. Below, we explore its key principles and how they align with experimental evidence and real-world phenomena.


1. The Universe as a Quantized Information System

At its core, the TOE views the universe as a vast computational system where information is fundamental. Space-time, energy, and matter are not continuous but exist as discrete units at the Planck scale ( meters). These ""quanta"" form the basic building blocks of reality, evolving according to deterministic and probabilistic rules.

Evidence and Alignment:

Planck Scale Phenomena: Loop Quantum Gravity and string theory suggest quantized space-time, supported by patterns in the Cosmic Microwave Background (CMB).

Digital Universe Hypothesis: Simulations, like cellular automata, demonstrate how simple discrete systems can generate complex emergent behaviors, mirroring the universe's evolution.




2. Quantum Mechanics as the Engine of Reality

Quantum mechanics underpins the TOE, describing reality as a network of probabilistic quantum states. Particles exist in superpositions, and entanglement connects them across vast distances. These behaviors suggest that reality is non-local and deeply interconnected.

Key Concepts:

Quantum Entanglement: The non-local correlation of particles, verified by Bell Test experiments, shows that information transcends space-time constraints.

Quantum Information: The universe functions as a quantum computer, where quantum bits (qubits) encode and process information.


Simulation Data:

Using Qiskit, simulations of entanglement and entropy evolution reveal patterns that align with quantum experiments, such as interference and state collapses.




3. Time as a Discrete Flow in the Simulation

Time is not a continuous variable but a sequence of discrete events, akin to frames in a simulation. In this framework, the arrow of time emerges from increasing entropy, and the perception of time as ""flowing"" is an emergent property of the underlying quantum processes.

Experimental Evidence:

Quantum Arrow of Time: Studies on entropy in isolated quantum systems show time's directionality emerges probabilistically.

Gravitational Time Dilation: Relativity supports the dynamic nature of time, where space-time itself warps under mass-energy influence.


Simulated Dynamics:

Simulating quantum time evolution circuits shows entropy growth over discrete steps, replicating observed time-dependent thermodynamic behaviors.



4. Energy, Resonance, and Tesla's Principles

Nikola Tesla's work on resonance and energy fields is central to the TOE. Tesla proposed that energy could be harnessed from the vacuum (zero-point energy) and that resonance governs matter-energy interactions.

Key Insights:

Resonance in Quantum Systems: Vibrational frequencies at the quantum scale may allow for manipulation of matter and energy.

Zero-Point Energy: The Casimir effect demonstrates the existence of vacuum energy, aligning with Tesla's vision.


Simulated Data:

Qiskit pulse control simulations model resonance in qubits, showing coherence and energy transfer, analogous to Tesla's principles.




5. Consciousness and the Role of the Observer

The TOE posits that consciousness is not an emergent property of the brain but a fundamental aspect of the universe. Consciousness interacts with the quantum information network, influencing reality through observation.

Supporting Evidence:

Observer Effect: The act of measurement collapses quantum superpositions, as seen in the Delayed Choice Quantum Eraser experiment.

Placebo Effect: Demonstrates how intention and belief can influence physical outcomes, suggesting a deeper connection between consciousness and reality.


Implications:

Consciousness may act as a quantum processor, capable of influencing the probabilistic evolution of quantum states.



6. DNA and Cosmic Codes

Life’s blueprint—DNA—reflects universal patterns encoded at the quantum level. The sequences of nucleotides may be representations of quantum information, aligning with cosmic codes like the Fibonacci sequence and the golden ratio.

Evidence:

DNA and the Golden Ratio: The helical structure of DNA exhibits proportions consistent with the golden ratio, linking biology to universal mathematics.

Numerology in Nature: Patterns like Fibonacci numbers appear in biological systems and the structure of galaxies.


Simulation Insights:

Binary DNA sequences mapped to quantum states show periodicities and alignments with numerological patterns, validated through entropy analysis and SVD techniques.



7. Bridging Relativity and Quantum Mechanics

Einstein’s relativity governs the macroscopic universe, while quantum mechanics rules the microscopic. The TOE unifies these through information theory, where gravity emerges as a manifestation of quantum entanglement.

Supporting Theories:

ER=EPR (Einstein-Rosen Bridge = Quantum Entanglement): Suggests that wormholes (relativity) and entanglement (quantum mechanics) are manifestations of the same phenomenon.

Holographic Principle: Proposes that the universe’s information is encoded on a lower-dimensional boundary, uniting quantum and relativistic descriptions.



8. Practical Applications of the TOE

The TOE is not just a theoretical construct but has practical implications:

Quantum Energy Systems: Harnessing zero-point energy for sustainable power.

Quantum Computing: Building more efficient quantum algorithms inspired by cosmic codes.

Enhanced Human Potential: Understanding consciousness as a quantum phenomenon may unlock new dimensions of human capability.


Conclusion: The Path Forward

The TOE represents the pinnacle of scientific and philosophical inquiry, aiming to unify all aspects of reality—from the smallest quantum particles to the vast cosmos, and even consciousness itself. By integrating experimental data, advanced quantum simulations, and interdisciplinary concepts, we take a step closer to understanding the ultimate nature of existence.

This framework invites collaboration, refinement, and exploration. Together, we can move toward a deeper understanding of the universe and our place within it.

"
Ugreen USB40 enclosure issue with macos,UsbCHardware,1i8tlo2,2025-01-24 06:48:36,2,1.0,2,https://www.reddit.com/gallery/1i8tlo2,kissmyasthmaaa,Troubleshooting,"Hello ,
I have purchased 40G SSD enclosure model CM642 from alixpress and installed ssd on it but when i connect it to MacBook Pro m4 pro it doesn’t recognize it
In finder app or disk utility but it shows under system information under thunderblot devices I am using the usb c to usb c cable provided with the enclosure and also tried with cable matters thunderbolt 5 cable , when I downgrade the connection through using UGREEN USB to Type C Adapter or any hub that downgrade the connection to usb 3.1 10G it work fine
and it’s working fine on windows usb4 speeds"
It’s coming sooner than you think,Kenya,1i8ouw1,2025-01-24 01:02:06,711,0.99,162,https://www.reddit.com/r/Kenya/comments/1i8ouw1/its_coming_sooner_than_you_think/,Nearby-Law5429,Casual,"If you don’t like reading, this post may be a bit too long for you*😄


Hello everyone, I hope this encourages someone today.
A few months ago, I shared a post here about a difficult season I was going through (which I later deleted after it gained a lot of traction). In summary, I had to leave a business ‘partnership’ that was tied to a romantic relationship that ended. Niliachwa na madharau🙆‍♀️, and at the time, that business was my only source of income.  

I vividly remember my ex-partner bitterly telling me they had discussed with the other partners and concluded that “my role was actually obsolete from the get-go.” Turns out, the other two partners never said that, and both approached me later to confirm it wasn’t true. This was after I had contributed significantly to bringing business to the company.  

When it came to clearing my pending payments, yoh! Ile pesa nilikatwa. Ata mimi nilishangaa nikaachwa na mshangao tu😂. There was no clear transparency cos terms zilichange last minute, and it was suddenly said I was a “consultant” because I was the only one working there full-time. (By the way, I ended up working full-time because another job I had secured earlier turned out to be a long con, and this partnership became my plan B while I searched for something stable.) The company was still in the process of updating documents to reflect the partnership, but unfortunately, that was never finalized before I left despite my efforts to push for it.  

I even approached my lawyer to build a case to recover the money, but midway, I decided to genuinely wish them the best and to let it go for my own peace. It was mentally draining, and I needed to heal and move forward. I told myself, “It’s just money, and I’ll recover it another way.” That experience taught me important lessons about doing business with people and setting clear partnership policies. To be honest, I was blinded by mapenzi.🫢

Fast forward, God has been so faithful. Doors have opened in ways I didn’t expect. I’ve been doing freelance work to keep myself going, and just last week, one of the biggest STEM companies in Kenya hired me on a consultancy basis.  

But that’s not all. Back in October, I applied for a role at a company I had been praying to work for, knowing it would be a great opportunity for networking both personally and for my business. I prayed so hard for it, and just yesterday, they gave me an offer! Here’s the irony: the position I got has the same job description as the one my ex-partner claimed was “obsolete from the get-go.” Isn’t that God working? And I got this job with zero connections, purely from submitting my application online.  

I’ve seen restoration. Ata hiyo pesa nilikatwa, and the income we used to make at that ‘partnership’ from a project, I’m now in a position to easily make it by myself. Mungu alisema, “I will repay you tenfold,” and He has truly done it.  Life can change overnight literally. When I left that company, I was so stressed, with no enough resources or stability in sight. But God has been opening doors. 

From August last year, I’ve done all sorts of jobs just to get by including trying to sell thrift shoes (which flopped big time 😂). And now, I’m finally regaining my footing.

Ni God manze. He restores, and He does it in ways you can’t even imagine. 🙏


Edit: I didn’t expect this to blow up but it’s so heart-warming to hear that it’s encouraged people out there. Thank you too my internet friends for the love you’ve showed me. May all your dreams and goals come to fruition. 🥺🫶

Let me also add this because it’s popped up a lot in the comment section. I’m a lady. 😄"
laptop can't find the gpu drives,laptops,1i8ocui,2025-01-24 00:30:15,1,1.0,0,https://www.reddit.com/r/laptops/comments/1i8ocui/laptop_cant_find_the_gpu_drives/,DUSH__ART,Hardware,"https://preview.redd.it/191t8sw1ovee1.png?width=880&format=png&auto=webp&s=faf3831261eab38c73cc9ef47cedb9ea7676b364

so my laptop can't locate the hardware device, I was able to fix it by deleting the device from device manager and restarting the computer, but after a shut down it goes back not being detected. can anyone please help me with a solution, this process of uninstalling and restarting is so annoying.

please help....."
laptop can't find the hardware device,gpu,1i8oaah,2025-01-24 00:26:03,1,1.0,2,https://www.reddit.com/r/gpu/comments/1i8oaah/laptop_cant_find_the_hardware_device/,DUSH__ART,,"so my laptop can't locate the hardware device, I was able to fix it by deleting the device from device manager and restarting the computer, but after a shut down it goes back not being detected. can anyone please help me with a solution, this process of uninstalling and restarting is so annoying.

https://preview.redd.it/kxw9mxzanvee1.png?width=880&format=png&auto=webp&s=8f3906f999436c503fabdcd39a6eb48bcf64c010

please help...."
What would you pay for this? What would you upgrade?,PcBuild,1i8nu02,2025-01-23 23:59:31,2,1.0,3,https://i.redd.it/xj0i5dbjivee1.png,Nervolol,Question,
Bluetooth does not detect any devices,bluetooth,1i8cvb9,2025-01-23 15:17:45,1,1.0,6,https://www.reddit.com/r/bluetooth/comments/1i8cvb9/bluetooth_does_not_detect_any_devices/,Lucytheboxer07,,"I tried reinstalling the drivers, uninstalling them, restart my pc, different bluetooth versions.... I have the bluetooth icon, it just does not detect any devices.  
Here is a screenshot of my device manager:

https://preview.redd.it/g81s2qbkxsee1.png?width=781&format=png&auto=webp&s=dd2ca1085463ad272c9bda3e0840cf21f5354544

Motherboard: Gigabyte B650 Aorus ELITE AX ICE"
Can't get bluetooth to work on windows 11 pc,gigabyte,1i8crbi,2025-01-23 15:13:03,1,1.0,5,https://www.reddit.com/r/gigabyte/comments/1i8crbi/cant_get_bluetooth_to_work_on_windows_11_pc/,Lucytheboxer07,Support 📥,"I am convinced i tried every possible thing to try and get my bluetooth to work. I can see my bluetooth icon, i have a bluetooth radio device, on the picture you will see my device manager bluetooth tab.

My motherboard = Gigabyte B650 Aorus Elite AX ICE

https://preview.redd.it/pxxgdxyrwsee1.png?width=781&format=png&auto=webp&s=19d4c1d521633cdb03a959c2e9c9195a2288dd5b

"
Why can't I Sellect my usb,ChromeOSFlex,1i8bf9t,2025-01-23 14:17:11,5,0.86,9,https://i.redd.it/6jfnr4ftmsee1.jpeg,HollowRunner,Troubleshooting,I was trying to install chrome is flex and it wouldn't let me Sellect a usb
GPU drivers still won't install,laptops,1i84w80,2025-01-23 09:43:59,1,1.0,10,https://www.reddit.com/gallery/1i84w80,randomphonecollector,General question,"I've completely reinstalled Windows 10 because I couldn't install the Nvidia Geforce drivers, but the issue persists. I'm starting to get worried if the GPU itself might be fried. Anything else I could do? I've spent hours on this thing without progress"
Busted pci data acquisition and signal processing controller pc cant see ds4 controller!,pchelp,1i7wpkh,2025-01-23 00:50:38,1,1.0,5,https://www.reddit.com/r/pchelp/comments/1i7wpkh/busted_pci_data_acquisition_and_signal_processing/,R_T_S_D,SOFTWARE,"Help! I can't play DMC! My pc using ds4 windows stopped working randomly with my ds4 controller wired. 

It seems to have something to do with the messed up drivers in the pic i uploaded (at bottom of post); I've 

tried installing the asus intel(R) Dynamic Tuning Technology Updater Component Extension driver (my 

laptop is old a rog gl702vm with the mobile 6gig 1060), but after running it and rebooting nothing about 

the broken drivers changes. Please tell me I'm being stupid and this is a simple fix, I donno what else to try. 

Link to the Asus Component Extension driver, it's the asus one that's second from the top of the list in the link: [https://www.driveridentifier.com/scan/pci-data-acquisition-and-signal-processing-controller-driver/download/951169362/CA5219144A5246D4BD211CB175FDB734/PCI%5CVEN\_8086%26DEV\_1903](https://www.driveridentifier.com/scan/pci-data-acquisition-and-signal-processing-controller-driver/download/951169362/CA5219144A5246D4BD211CB175FDB734/PCI%5CVEN_8086%26DEV_1903)  


https://preview.redd.it/e9gziohhkoee1.png?width=1415&format=png&auto=webp&s=babd336848a86910d0c70456d0eff4e5af347d1d

"
KDR networking noon,ExAndClosetADD,1i7vm21,2025-01-22 23:42:26,12,0.94,8,https://www.reddit.com/r/ExAndClosetADD/comments/1i7vm21/kdr_networking_noon/,cliffordwoody,Random Thoughts,"Naalala ko non way back 2004 ata Yun or 05, pinatawag kming mga officer ng kktk sa apalit ng Isang KNP, kailangan daw namin mag invyt para ung kasi s
Daw kabilang side ng mlm ni kuya eh napakahaba na, kailangan daw  matapatan sa kaliwa para mag pares ika para kumita, sa isip isip ko, utot nyo from worker to knp to kuya kumita na kayo Ngayon tumigil na Ang  network  kami mga kktk officer ippush nyo para mag invyt, Nung kumikita kayo happy happy kayo Nung Wala na kayong ma invyt kami na maghihirap mag recrute?, gsto pa sa mga strangers na tao sa mga food court daw ng mall kmi mag present ng mlm business, pero kayo sa mga ditapak lang walang hirap sa pagiinvyt"
Ethernet not working after reinstalling windows 11,pchelp,1i7rhe1,2025-01-22 20:08:31,1,0.66,6,https://i.redd.it/00qw2t8j8nee1.png,Ok-Contest-8074,SOFTWARE,
My webcam on my vivobook isn’t working,ASUS,1i7hd9x,2025-01-22 13:01:07,0,0.5,4,https://www.reddit.com/gallery/1i7hd9x,GeorgieP617,Support,Ive
Would this make a good mid tier gaming pc?,pcmasterrace,1i7e5n6,2025-01-22 10:49:43,9,0.85,19,https://www.reddit.com/gallery/1i7e5n6,PenFriendly2455,Question,"They are only asking for $800. I play beefier games such as ark survival ascended, elden ring, and heavily modded skyrim. I would be upgrading from an alienware m15 R7 gaming laptop that i added 32 gigabytes of ram to."
