Post Title,Subreddit,Post ID,Created Time,Upvotes,Upvote Ratio,Comments Count,Post URL,Author,Flair,Post Text
"[Governance Poll Proposal] Establish the Donut DAO org; Decentralize, expand, and secure DONUT’s future beyond r/EthTrader",ethtrader,1i8smzx,2025-01-24 05:42:25,14,0.94,40,https://www.reddit.com/r/ethtrader/comments/1i8smzx/governance_poll_proposal_establish_the_donut_dao/,0xMarcAurel,Donut,"## TL;DR

This proposal is a huge step in shaping the future of the Donut ecosystem. It's about: 

1. Formally establishing Donut DAO as a decentralized, unregistered organization with the flexibility to grow beyond Reddit, allowing DONUT to continue to operate independently of any single subreddit or platform.
2. Transitioning DONUT’s structure to remove its dependency on r/EthTrader, making r/EthTrader as one arm of a broader organization.
3. Balancing the allocation of funds to create a more sustainable and equitable distribution model.
4. Clearly defining roles and responsibilities for Donut DAO contributors, while ensuring fair compensation for their efforts.
5. Optimizing leadership and governance by welcoming new contributors and reevaluating inactive roles (moderators, multisig guardians).

The objective is to create a robust foundation that supports growth, decentralization, and the sustainability of DONUT, while rewarding content creators, contributors and giving power to the community.

The focus of this organization is to give contributors opportunities to grow, connect with other interested individuals, build a professional portfolio, and receive compensation in the process. Thus, the Donut DAO would create an environment of mutual benefit and recognition for all participants.

---

## Current situation

For too long, the mod team has relied on a ""mint more DONUT whenever we run out"" approach. This may've worked 5 or 6 years ago, but it’s no longer effective considering DONUT is now a valued asset, subject to market mechanics. Also, with regulatory scrutiny increasing, it’s time we collectively reassess our current practices, formalize our policies / structure, and establish a more strategic approach to DONUT minting and allocation.

As a SocialFi token, DONUT’s primary purpose is to reward content creators and promote decentralized governance. To fulfill this mission, a dedicated team is essential. We need people responsible for maintaining operations, promoting growth, and investing on long-term sustainability.

This proposal is probably the most significant and complex initiative we have ever had as a DAO. Submitting dozens of individual proposals would be a lot more complex and would delay important progress. This is a consolidated proposal that reflects the collective insights of the mod team, and is the result of internal discussions and team calls. Our vision is to position DONUT as a project that goes beyond r/EthTrader, making sure its growth is not limited by the subreddit’s boundaries. In this structure, r/EthTrader will be a branch of a broader ecosystem, known as the Donut DAO (proposed below).

---

## Problem

We're going to be fully transparent with the community, the current structure and team reached a pivotal crossroads. Even though our project made significant progress, the current structure has shown limitations that could compromise growth, sustainability and even operations's maintenance.

Right now, there is formally no team or organization responsible for promoting DONUT. Technically it's the mod team and the community as a whole. While this flexibility worked in the early stages, it now creates uncertainty regarding the project's purpose, reach, and goals. What worked 6 years ago no longer works today, especially in the Web3 industry that changes by the day. To attract serious contributors and partnerships, establishing and formalizing a decentralized entity is important. Without this, we risk, once again, stagnation and missed opportunities to expand.

Another problem is the existing reward and funding structure. This model led to concerns about managing resources and a lack of reserves for future growth initiatives. If this issue is not addressed, this project will struggle to fund new and current contributors, attract talent, or even finance ecosystem expansion.

Yet another problem is, over time, some roles within the project (like moderators and multisig guardians) have become inactive or loosely defined. This creates inefficiencies in important decisions.

Additionally, the absence of clear and fair compensation made it very difficult to recruit and retain contributors, leaving gaps in operational capabilities. In other words: people aren't receiving enough rewards for the value and work they provide.

Finally, DONUT has huge potential as a project, but its current visibility is confined largely to this sub. This limits its audience and adoption, making it harder to grow and compete in the Web3 industry.

---

## Solution

The solution goes through different steps to evolve our project into a sustainable, decentralized organization while focusing on its future.

Here are the proposed measures:

**1 - Establishing Donut DAO**

We propose transitioning our entire project into (a new) Donut DAO, an official, (legally speaking) unregistered decentralized organization.

DONUT’s success should not be limited by one platform or subreddit. We should aim to create a structure that can operate independently of Reddit, enabling expansion into other platforms or even transitioning into a whole new token category if needed. This protects the project from external risks, like changes to Reddit’s policies or infrastructure. DONUT would continue to work and grow even without Reddit or r/EthTrader.

Under this new organization, r/EthTrader would still be a vital part of the ecosystem, but the Donut DAO would be the overarching organization, positioning itself for broader opportunities and long-term survival. Simply put, r/EthTrader would be one of the many branches of the Donut DAO.

**2 - Structuring Donut DAO**

Donut DAO would operate as a decentralized organization, but with a defined structure that promotes efficiency and collaboration. This would promote a more collaborative approach, while giving clarity on roles and responsibilities.

The proposed structure is as follows:

* Co-founders: Responsible for partnerships, overseeing operations, managing the treasury, handling administrative tasks, grants, and ensuring the organization’s overall direction.

Proposed co-founders:

Carl Larson: Original developer of the Reddit community points system (DONUT) and an early contributor to the Ethereum ecosystem.

Basoosh: Veteran DONUT contributor, developer, formerly responsible for monthly distributions and currently responsible for the Donut Dashboard.

Marc Aurel: Ecosystem growth lead, responsible for partnerships, networking, business, and operations.

* Developers: Focus on maintaining and scaling DONUT’s technical infrastructure, including websites, subreddit tools, and others.

* Content moderators: Responsible for subreddit (in this case, r/EthTrader) and Discord management, aiming to promote healthy community engagement.

* Art sector: Focus on creating art for advertising, partnerships, and campaigns.

* Community sector: Organizing events, giveaways, and supporting users directly.

**3 - Optimizing DONUT allocation**

We propose reallocating the monthly DONUT distribution to optimize fund management, support development, and, most importantly, make sure contributors are compensated fairly.

The new proposed monthly allocation is:

* Content creation (subreddit distribution) [NO CHANGES]: 850,000 DONUT

510,000 DONUT for posts.

340,000 DONUT for comments.

* Liquidity incentives: 450,000 DONUT

Uniswap (ETH/DONUT V2 on Ethereum) reduced from 400,000 to 250,000 DONUT.

Sushi (ETH/DONUT V3 on Arbitrum One) increased from 150,000 to 200,000 DONUT.

Even though Ethereum is extremely important when it comes to liquidity, our DeFi operations take place on Arbitrum One. As such, we should aim to promote liquidity on Arbitrum, also to help the DAO unlock the remaining funds from the Arbitrum Grant (7,500 ARB).

* Community contests: 25,000 DONUT.

Reduced from 50,000, as this expense is unfortunately not having the desired effect and is not as impactful given the funds provided.

* Moderation [CEASES TO EXIST] 

* Community treasury [CEASES TO EXIST]

* Donut DAO treasury: 415,000 DONUT, distributed as follows:

Developers: 30,000 DONUT/month (+ grants as needed).

Moderators: 15,000 DONUT/month.

Community (community contributors that are not moderators): 5,000 DONUT/month.

Art: Funded via grants based on project proposals.

After covering monthly expenses, there would be ~200,000 - 230,000 DONUT remaining, according to the current size of the team. These funds would be reserved for the art sector, additional grants, strategic investments, or any extra necessity. Also, there are additional operational costs such as the u/donut-bot server, among other small expenses.

Although 1,740,000 Donuts are available for distribution each month, as you can see the funds disappear almost instantly due to the treasury's expenses needed to finance operations.

**4 - Restructuring and optimizing mod sector and the multisig**

This is not easy to address, but it has to be done nonetheless. To ensure accountability, we propose the following contributor activity policy:

1 month of inactivity: Contributor is defunded.

3 months of inactivity: Contributor is removed from the organization. Rejoining is an option if the contributor becomes active again in the future.

We propose this policy to promote fairness, because funds allocated to inactive members could be redirected to active contributors or other strategic initiatives. We recommend removing inactive members due to sensitive information about the project and to maintain the integrity of our work. Active contributors are important for progress and internal decisions, and people who are inactive can disrupt ongoing efforts. Internal decisions are made democratically, and inactive members who don’t vote can unintentionally stall progress.

As for multisig guardians, members inactive for 3+ months would also be removed, to make sure the treasury is protected by individuals who are actively involved and aware of ecosystem developments. The multisig must always have a minimum of five active guardians to maintain security and decentralization.  In the future, potential guardians may be added, provided that they gained the trust of the organization and the community as a whole.

**5 - Immediate goals if this proposal passes**

If this proposal is approved, the following topics would be addressed immediately:

* Build an official Donut DAO website, a dedicated platform to communicate the Donut DAO’s mission, goals, and updates. It would be separate from the Donut Dashboard.
* Create an official X account to promote DONUT and engage in marketing campaigns.
* Assign roles and responsibilities to make sure all teams are ready and equipped to contribute effectively.
* Host monthly meetings to regularly assess progress and adjust strategies. *A future idea is to allow DONUT whales to attend meetings.*
* Post monthly treasury flow reports. This includes expenses and inflows, to promote transparency and trust.

---

## Advantages

* Establishes a professional and organized structure, incrasing credibility and trust among users and potential partners.
* Enables strategic fund management, protecting the sustainability and efficiency of operations.
* Creates a self sustaining economy with DONUT as its foundation.
* Promotes fair compensation for contributors, based on their skills, efforts, and activity levels.
* Further increases decentralization by involving more contributors from different locations, promoting a more global perspective.
* Simplifies internal conflict resolution, particularly in cases of inactivity or disagreement, with clear policies in place.
* Distributes responsibilities and tasks efficiently, reducing the burden on individual contributors. Contributors can focus on their specific roles, for example devs will no longer need to moderate content and can focus on building instead.
* Ensures long term operations by reducing dependency on any single individual within the organization.
* Supports expansion beyond Reddit, making Reddit a vital branch of the broader Donut ecosystem, rather than it's pillar.
* Builds a foundation for growth, including potential integration into other social platforms or use cases.
* Promotes collaboration and transparency through a clearly defined structure and regular reporting.

## Disadvantages

* The proposed structure introduces high complexity, which could lead to overly bureaucratic processes.
* Contributors would have personal responsibility for legal and tax-related matters, which may create challenges depending on their location.
* Requires a lot of effort and coordination to establish the organization, onboard new contributors, and maintain communication between sectors.

---

## Conclusion

This proposal would create a path for DONUT to evolve into a resilient, decentralized organization capable of thriving in any scenario. If we transition to the proposed Donut DAO, we will make sure that DONUT is no longer tied to a single platform, allowing it to expand, adapt, and grow in new directions. It also creates a framework for long term sustainability through structured roles, decentralized decisions, and transparent operations.

There's one important thing to note. Without this proposal, there’s a huge risk that current challenges lead to reduced activity or disruptions to basic functions like distributions and the maintenance of donut-bot, and even abandonment. This means people leaving the project. We should practically acknowledge the risks we're facing right now and understand the consequences if proactive measures aren’t taken.

Just like everything, there are challenges involved. However, the benefits really outweigh the risks. This initiative would secure DONUT’s future.

If the community supports this proposal, we can build a robust, scalable ecosystem where DONUT continues to thrive regardless of individual or platform changes. Feel free to provide feedback or suggestions to change or add to this proposal.

---

The choices are:

* [YES]
* [ABSTAIN]
* [NO]

*This proposal will remain up for a minimum of 2 days, according to the [governance rules & guidelines](https://www.reddit.com/r/ethtrader/wiki/governance/). This proposal requires 2 moderators to sign it off in order to proceed to a governance snapshot vote. If approved, this proposal will automatically be queued for Governance Week.*"
$Alina: From Supporting a Dream to Empowering a Generation,SolanaMemeCoins,1i8qied,2025-01-24 03:00:02,6,1.0,4,https://i.redd.it/eqglxw3xewee1.jpeg,ShipInner8867,,"$Alina started as a heartfelt project by a father to fund his daughter’s dream of attending art school. Alina, a talented young artist with a passion for drawing, captured the attention of the crypto world, achieving over $2.5 million in trading volume on its first day.

What began as a personal journey has now evolved into something much bigger. The project’s vision has shifted to creating the Alina Foundation, a decentralized, crypto-backed reserve aimed at helping talented kids around the world achieve their dreams. Through a community-driven DAO, $Alina is set to empower the next generation of creators and innovators.

Backed by influential crypto whale parents who are investing heavily in marketing and growth, the project has gained tremendous momentum. In just three days, the community continues to expand, united by the mission of supporting young talent globally.

To further engage the community, Alina and her dad are planning regular livestreams on X (formerly Twitter), where they’ll draw and connect with supporters, spreading the project’s vision and creativity.

Join $Alina and be part of a movement that’s making dreams come true, one talented kid at a time! You’ll find all our socials on Dex.💛

"
Daily Check-in: Day 1,AIntivirus,1i8pubd,2025-01-24 02:09:33,2,1.0,0,https://www.reddit.com/r/AIntivirus/comments/1i8pubd/daily_checkin_day_1/,Thefugitiv3,,"Hey everyone! First off, I just want to say how exciting it’s been to see the energy and enthusiasm around $AIntivirus on launch day. As your moderator here on the official subreddit, I’ll be doing these daily check-ins every night at 11 PM PST to keep everyone updated, share highlights, and make sure our community stays connected and informed.

Day 1 Recap

Market Stats:

•	Market Cap: $25.2M
•	24-Hour Volume: $58.6
•	Circulating Supply: 100M tokens

These numbers are super encouraging for a token that launched just over a day ago. The volume alone shows how much activity is happening, and the market cap is already climbing steadily. It’s clear that people are taking notice of what we’re building here.

2.	Timing is Everything: 

With recent crypto news like Trump’s announcements about decentralization and blockchain, it feels like $AIntivirus has launched at the perfect time. The broader attention on privacy-focused and decentralized tokens like ours is only going to grow, and being part of this community so early is a huge opportunity.

3.	Community Growth: 

We’ve already hit 16,000 holders, which is incredible for Day 1. This just shows the power of a shared vision and how quickly people are rallying around this project. Seeing so many of you join discussions and share your excitement makes me feel like this is going to be a really strong and engaged community.

The Importance of Our Community

This subreddit is our home base, and the success of $AIntivirus isn’t just about the token—it’s about us as a community. Whether you’re a new investor, a long-term holder, or just here to learn, we all have a role in helping this project thrive.

Here’s how you can help:

•	Get Involved: If you’re passionate about $AIntivirus, let’s grow this subreddit into a hub for news, updates, and discussions. If anyone wants to help moderate or contribute, shoot me a message—we’re all in this together.

•	Spread the Word: Share $AIntivirus with your friends, post on social media, and get the conversation going. The more people we bring into the community, the stronger we become.

•	Stay Active: Engage in discussions here, ask questions, and share your thoughts. This subreddit is a space for all of us to connect and make sure no one is left in the dark.

What’s Next?

This is just the beginning. I’ll be here every night at 11 PM PST to provide updates, share milestones, and keep the community informed. Today has been an amazing start, but there’s so much more ahead. Let’s keep building this community, supporting each other, and pushing $AIntivirus to reach its full potential.

If you’ve got ideas, questions, or just want to connect, drop a comment below. Let’s keep the momentum going and show the world what this community is all about. Here’s to an amazing Day 1—can’t wait to see where we go from here.

See you all tomorrow!"
