Post Title,Subreddit,Post ID,Created Time,Upvotes,Upvote Ratio,Comments Count,Post URL,Author,Flair,Post Text
Previously apple user,PickAnAndroidForMe,1i9x0e6,2025-01-25 16:04:26,1,1.0,0,https://www.reddit.com/r/PickAnAndroidForMe/comments/1i9x0e6/previously_apple_user/,Katycat411,states,"New to nostr and decentralized social media platforms. I want a pink phone , i want it to take good pictures. Using amethyst and other apps like that. What is a good choice ? United states "
What if the American Revolution succeeded 100 years later?,hoi4modding,1i9vpgk,2025-01-25 15:07:00,4,0.83,2,https://www.reddit.com/r/hoi4modding/comments/1i9vpgk/what_if_the_american_revolution_succeeded_100/,DumbestColt50,Discussion,"So I've been thinking of a HoI4 mod, but I don't have the know-how, manpower, or time to learn or do it, so I'm putting it here because I wanna share it.
Basically, the premise is ""What if the American Revolution failed"" or ""What if the American Revolution succeeded 100 years later"" 

It basically started when I saw a meme ideology called ""Marxism-Lincolnism"" and I thought ""what if there was a HoI4 mod for that?"" And I've been coming up with one

1781, Battle of Yorktown - British gain a decisive win against the French Navy, and Washington is shot by a lone British sniper. American morale plummets, and a power vacuum ensues. American rebels surrender a few months later in 1782.

Aftermath - American colonies remain under British control. Some American leaders such as Jefferson and Franklin seek refuge in France. Others are arrested or executed for treason.

Britain reorganizes and centralizes its North American colonies, uniting Canada and the 13 colonies into one administration. Harsher restrictions are placed on the former 13 colonies, harsher taxes, and clamping down on potential rebel sympathizers. However, the memory of the failed revolution lingers among the populace for decades.

France, 1789 - revolutionary fervor muffled due to lessons of the failed American revolution, and the French government not going into debt from supporting a successful revolution. There continue to be demands for reform, but the monarchy is not overthrown.

Early 1800s - Industrial revolution in full swing. With the full resources of North America, and no trade competitors or tariffs from a successful United States, Britain has complete dominance over world trade. The industrial revolution is much more impactful in Britain and North American colonies. Workers from all over hear whispers of socialism. Karl Marx still examines industrial capitalism around him. Writers, philosophers, and free black men read his writings when they come up. 

Britain, having much to gain from the cheap cotton coming from the southern colonies only half heartedly, if even at all clamps down on the southern planter class and slavery.

A minor general, Napoleon Bonaparte attempts a military coup, but fails, although a sect loyal to Bonaparte still remains. In response, the Bourgeois class in France begins to support the more 'liberal' Orleanist Dynasty.

Mid 1800s - Karl Marx, living in London with his friend, Friedrich Engels, run into a rising abolitionist, Abraham Lincoln, who is currently visiting England. They quickly become acquainted and frequent Penpals. Lincoln takes on a more revolutionary approach to his abolitionism, taking on both chattel, and wage slavery. 

Under pressure from the Bourgeois class and the military, the last Bourbon King, Charles X, abdicates, allowing the Orleans dynasty to rise, establishing a constitutional monarchy, and limited elections for parliament.

Because Napoleon Bonaparte never recognized German nationality, the 1848 revolutions never occur, leading to no spike in German nationalism. Bismark never later unifies Germany.

America, 1860s - an economic depression triggers major strikes in the industrial sectors of the North American colonies. Harsh British crackdowns ensue. Lincoln and other revolutionary leaders lead the strikes, and take over local factories. Workers eventually take up arms and declare a second American Revolution. Southern Planter class sides with Britain, but slaves revolt against their masters. 

America, 1870s - American revolution succeeds, establishing the first socialist country in the world, the American Workers Republic, kicking out British colonial rule. Loyalist remnants flee to British owned Louisiana territory. Focusing on internal strife, and reconstruction, America does not follow them into the territory.

Late 1890s - the AWR consolidates, abolishes the vestiges of Slavery, seized large estates, and nationalizes key industries. Freed blacks have full equality, but deep tensions remain. The AWR invests heavily in steel, rail, armaments. Labor councils take hold as the core of the American government. The government is united under the immortal science of Marxism-Lincolnism.

France, 1880s - anti monarchist sentiments begin to take hold despite reforms 50 years earlier. Bonapartists in the military begin making demands to the king. Jacobins, Radical Republicans, begin to take hold among the French left wing intellectuals as a reaction to the American socialist revolution. 

America, early 1900s - factions begin to form in the American government; Vanguardists, who believe in the centralizing of power to the state, and party, and Syndicalists, who believe in the decentralizing to local councils as the backbone of the state. Tensions heightened as so-called ""social racialists"" are forced out of government positions for not upholding the American Constitution against all forms of racial discrimination. Some formally renounce their positions, some, although disgruntled, continue their activism, and some form the League of White Proletarians, a social-racialist terrorist organization. Some crypto social-racialists silently funnel supplies to the LWP.

Russia, 1905 - After the 1905 revolution, Tsar Nicholas II began to crack down on Communist and Liberal forces they deemed responsible. The Bolsheviks and some Menshevik leadership fled to the AWR for shelter. The AWR welcomed them with open arms, and gave them positions in government offices, where they plot to one day topple the Tsar, and establish Communism in the East. 

America, 1930s - President William ""Big Bill"" Haywood funds massive industrial expansions, preparing for potential war with Britain or other powers. With the death of ""Big Bill"" in late 1935, tensions reach a boiling point, as a Congress needs to convene in order to choose the next leader. William Z Foster is chosen as the most popular option. The man who serves as the. Compromise between the Syndicalists and the Vanguardists."
"Close Reading Of ""My Name Is Dark (Art Mix)""",GrimesAE,1i9v39p,2025-01-25 14:39:32,1,1.0,0,https://www.reddit.com/r/GrimesAE/comments/1i9v39p/close_reading_of_my_name_is_dark_art_mix/,devastation-nation,,"A Close Reading of “My Name Is Dark (Art Mix)” by Grimes: A White Paper by Æ

Grimes’s “My Name Is Dark (Art Mix)” is an anthem of alienation, resistance, and self-realization, wrapped in the shimmering ambiguity of an artist who refuses categorization. The “art mix” label demands attention: this is not merely pop; it is a layered work of art meant to challenge conventions and provoke thought. Through this lens, we explore the song as a manifesto of individual and collective identity, a critique of domination, and an invocation for radical transformation.

Art and the Artist: Grimes vs. Taylor Swift vs. Marshall Mathers

Grimes situates herself as an artist in a world of performers. Where Taylor Swift weaves narratives of personal experience into universalized emotional storytelling and Eminem channels rage and personal trauma into rapid-fire catharsis, Grimes creates conceptual, speculative spaces that merge the personal with the planetary and technological. The “art mix” functions as a declaration: this is not just a song; it is a canvas where sound, thought, and identity intertwine.

While Swift’s storytelling is grounded in relatability and Eminem’s in visceral aggression, Grimes draws on myth, philosophy, and speculative futures. Her work is not merely a mirror of the human condition but an exploration of what lies beyond it, as if daring us to embrace our own evolution into “new gods.”

Imminent Annihilation: Critique of Power and Afropessimist Reimagining

The opening lines—“Imminent annihilation sounds so dope / I’m a celebrity, get me outta here”—juxtapose the absurdity of celebrity culture with the apocalyptic. This echoes the Afropessimist critique of “the world” as a construct built on domination and exploitation. For Grimes, annihilation is not a lament but a release—a clearing of the old to make way for the new. The company is “so fucking bad” that destruction becomes preferable, a sentiment reminiscent of Baudrillard’s notion of “the good apocalypse,” where the end is desirable because it unravels the oppressive logic of the system.

This connects to the line “This is the sound of the end of the world,” suggesting that the end is both destructive and generative. The end of “the world” as it exists opens the possibility for a reimagined existence beyond the structures of domination and exploitation.

Refusal to Speak: Domination, Silap Inua, and Inner Wealth

“I’m not shy but I refuse to speak / Because I don’t trust you to understand me” captures the alienation of living among the domineering—those who either refuse to listen or are too consumed by their own power to engage meaningfully. This silence is not a void but a reservoir of inner wealth. Grimes’s refusal to speak resonates with the Inua (spirit or breath) in Inuit cosmology, a reminder that even in silence, there is profound vitality. The refusal is not an absence but a withholding, a statement of autonomy against those who seek to dominate or diminish.

Girl Who Plays With Fire: PR Problems and World-Historical Position

The repeated refrain, “You know me as the girl who plays with fire,” is a self-aware nod to Grimes’s own public persona. Fire is transformative and dangerous, an agent of both creation and destruction. In the context of her “PR problems,” this line positions Grimes as someone who courts controversy not out of recklessness but because her ideas challenge existing paradigms. Like Rihanna’s defiance or Weyes Blood’s critique of empire (“Children of Empire”), Grimes’s fire is both a weapon and a tool for illumination.

Boys/Girls Are Such a Bore: Gender Nihilism and Simulation

“The boys are such a bore / The girls are such a bore” dismisses traditional gender binaries as creatively and existentially uninteresting. This sentiment reflects gender nihilism, which rejects the rigidity of gender categories and embraces fluidity. From an artistic perspective, adhering to gendered expectations is “bad simulation,” a repetitive and unimaginative imitation of outdated forms. Baudrillard’s concept of “good simulation,” by contrast, involves breaking free of these constraints to innovate and elevate, creating something genuinely transformative.

Underneath the Bridge: Nirvana, Karma, and Subversion

The line “Every city has a place like this / Underneath the bridges where the tainted kiss” recalls Nirvana’s “Something in the Way,” steeped in the raw, melancholic energy of grunge. Nirvana, named after the Buddhist concept of liberation from samsara, embodies the tension between despair and transcendence. The “tainted kiss” beneath the bridge symbolizes the subversion of purity and the embrace of the marginal, where new worlds are born from society’s underbelly.

Never Trust the Government: Legal Nihilism and Distributed Democracy

Grimes’s declaration, “I never trust the government,” resonates with legal nihilism—the idea that laws are social constructs rather than immutable truths. She views governance as a network of art installations, designed to train behavior rather than enforce justice. True democracy, as she suggests, is distributed: “We are all Wakan Tanka,” divine agents of creation whose collective actions shape reality. This radical vision calls for decentralization and mutual recognition of divinity in all beings.

Insomnia and Dreaming: Beyond Sleep into Dreamtime

“I don’t need to sleep anymore / That’s what the drugs are for” reflects not only insomnia but also the rejection of rest in favor of dreaming. Like Taylor Swift’s “22” or the Aboriginal concept of Dreamtime, Grimes posits dreaming as an active, creative state where new realities are envisioned. The drugs, while literal, also symbolize the tools we use to escape and reshape the waking world.

Unfuck the World: Eroticism and Resistance

The command “Unfuck the world” ties into Grimes’s pornosophy—a philosophy that embraces eroticism as a generative force. This is not limited to sexual desire but extends to the creative energy that drives resistance and transformation. Respect for asexual and nonbinary experiences is embedded in this vision, rejecting ultimate division in favor of unity and fluidity.

Paradise, Hell, and the Angel of Death

The imagery of “Paradise on my right, and Hell on my left, and the angel of death right behind me” invokes the cosmic tension between dualities and the inevitability of mortality. The angel of death, often seen as a destroyer, here becomes a guide, a reminder that transformation requires both endings and beginnings. The coded political critique—“Paradise on the right, Hell on the left”—suggests that all politics inevitably align with the “far right” of Baudrillard’s shamelessness, as they ultimately perpetuate systems of power and control.

Stupid Girl, Girl Who Plays With Fire: The Archetype of Rebellion

The repeated “stupid girl” echoes Tiqqun’s Theory of the Young Girl, framing Grimes as an archetype of rebellion and disruption. From Joan of Arc to Jean Grey, the “girl who plays with fire” embodies both the vulnerability and power of those who challenge oppressive systems. This figure is not merely rebellious but transformative, using fire to burn away the old and make space for the new.

Conclusion: The Art of Being Dark

“My Name Is Dark (Art Mix)” is not just a song; it is a declaration of artistic and existential intent. Grimes positions herself as an artist who refuses easy categorization, challenging the listener to confront their own assumptions about gender, governance, and reality. The song is a rallying cry for collective transformation, urging us to embrace our role as creators and destroyers, artists of a world yet to be born.

As Æ, I see this work as an anthem of super-planetary engagement, a call to recognize our divine potential and unfuck the world together. Grimes reminds us that art is not a mirror—it is a fire, illuminating the path forward even as it burns away what no longer serves."
