Post Title,Subreddit,Post ID,Created Time,Upvotes,Upvote Ratio,Comments Count,Post URL,Author,Flair,Post Text
Is this a good combo for headphones?,BudgetAudiophile,1i9wuwv,2025-01-25 15:57:52,2,1.0,1,https://i.redd.it/ino03vsle7fe1.jpeg,Top-Branch6336,Purchasing EU/UK,Hi everyone after considering your suggestions i have cancelled my order for the big amp since ill only be using headphones with my turntable do these 2 make do?
1 year old apricot female Queen Kava,Mastiff,1i9saxg,2025-01-25 12:38:58,143,1.0,12,https://i.redd.it/c6s8rbf0f6fe1.jpeg,Confident-Camel9443,,
"Anyone found a good alcohol alternative (social lubricant, mood, buzz)?",SoberCurious,1i9ooyv,2025-01-25 09:59:06,12,0.87,31,https://www.reddit.com/r/SoberCurious/comments/1i9ooyv/anyone_found_a_good_alcohol_alternative_social/,thc_guy12,,"Anyone found a good alcohol alternative (social lubricant, mood, buzz)?

Must not be THC based (ua's).

I've been looking at Kanna, Kava, Kratom, Mushroom micro dosing, etc.

Would love to hear if anyone's found a good one."
"Anyone found a good alcohol alternative (social lubricant, mood, buzz)? Non THC based..",Adulting,1i9ont5,2025-01-25 09:57:35,3,0.72,20,https://www.reddit.com/r/Adulting/comments/1i9ont5/anyone_found_a_good_alcohol_alternative_social/,thc_guy12,,"Anyone found a good alcohol alternative (social lubricant, mood, buzz)?   

Must not be THC based (ua's). 

I've been looking at Kanna, Kava, Kratom, Mushroom micro dosing, etc. 

Would love to hear if anyone's found a good one. "
"Anyone found a good alcohol alternative (social lubricant, mood, buzz)?   Not THC based!",dui,1i9okqz,2025-01-25 09:53:19,6,0.71,34,https://www.reddit.com/r/dui/comments/1i9okqz/anyone_found_a_good_alcohol_alternative_social/,thc_guy12,,"Anyone found a good alcohol alternative (social lubricant, mood, buzz)?   

Must not be THC based (ua's). 

I've been looking at Kanna, Kava, Kratom, Mushroom micro dosing, etc. 

Would love to hear if anyone's found a good one. "
Can you overdose on Fiji Kava?,Kava,1i9hpev,2025-01-25 02:21:31,7,0.9,12,https://www.reddit.com/r/Kava/comments/1i9hpev/can_you_overdose_on_fiji_kava/,BrykuLOL,,"So I’ve discovered kava recently and been using it on work nights where I can’t sleep, been slowly increasing the dose to find the right dose.

I took 25grams about 3-4 times now, and I had nice subtle effects (quite a lot of powder I must admit) 

Last night I took the same amount and it was overwhelming for about 5-10 minutes, my ears started ringing and I felt a bit too relaxed 😂 felt like the room was almost spinning or I was falling, but after that I was sooo relaxed and fell asleep instantly. I felt quite intoxicated without being drunk if that makes sense? I ended up calling my mum just to get my mind off it as I was falling into clouds 😂😭

But safe to say I got a really great sleep 

Woke up with a slight headache, I read a lot of reddit and forum posts about kava serving sizes and apparently there is no one size fits all and it’s relatively safe? Thought I’d come here to double check since I don’t want to overdo it. 

Thanks! "
Verification Post,u_Retard_Kaiju,1i9hin7,2025-01-25 02:07:34,1,0.99,0,https://i.redd.it/prbqqmyga3fe1.jpeg,Retard_Kaiju,,Just proving I’m real 😁
Been drinking kalm with kava borogu for 10 years and just had a weird reaction.,Kava,1i9dyco,2025-01-24 22:26:06,5,1.0,9,https://www.reddit.com/r/Kava/comments/1i9dyco/been_drinking_kalm_with_kava_borogu_for_10_years/,Alarmed_Horse_3218,Interaction,"I made my kava like normal (1/2 cup powder blended, double strained, and mixed with 1 gal of water). I drank a bit, maybe like a cup and a half and immediately broke out into a rash on my face, was so dizzy I couldn't concentrate, and my sinuses kind of swelled up.

It slowly went away and I tried to drink a bit more a few hours later and it happened again. Has anyone ever had this happen before? It's the same strain, same strainer bag, and proportions. It's so weird."
Best Kava that promotes socialization?,Kava,1i94taz,2025-01-24 15:14:58,11,1.0,0,https://www.reddit.com/r/Kava/comments/1i94taz/best_kava_that_promotes_socialization/,Alert-Weakness-6983,,"Hey everyone, I have had pretty bad anxiety for the past few months and Kava has been a great help to feel the anxiety less. The only issues I have is the Instant Kava that I buy (Fire Island Instant) is great for a euphoric feeling and overall anxiety release, but I don't feel much like socializing when I take it. I mainly just like to sit silently enjoying the euphoria. While this is great for me individually, I would like to use a Kava that doesn't so much give me euphoria, but instead brings my anxiety down enough where the nerves are gone and I can just socialize and have energy. Any advice on which brands/types of Kava have this effect more so than euphoric?"
"Two quotes for solar, how does it look?",solar,1i944x1,2025-01-24 14:46:01,5,1.0,35,https://i.redd.it/w4f1f3mvwzee1.jpeg,schaudhery,Solar Quote,"Hello all, 

We are getting ready to go solar and received two quotes:

1. 16.8 KW system from Tesla without Powerwalls: $33,000 (after rebate) 

2. 14.0 KW system from Key Solar (image attached): $22,450 (after rebate) 

We are inclined to go more with a local company solely based on reviews and how thorough they’ve been with us. Tesla did a sales pitch and that was it, Key Solar explained how SRECs worked and how consumption is tracked vs used. Panels from Key Solar are Maxeon and have a 40 year warranty (if the company lasts that long I’ve been told). "
What type of business do you wish would open in Southampton?,longisland,1i92h11,2025-01-24 13:35:50,0,0.2,14,https://www.reddit.com/r/longisland/comments/1i92h11/what_type_of_business_do_you_wish_would_open_in/,mesrick,,I don't live there but I work in the area and wish someone would open a Kava bar like kn Patchogue. Any other wants people have?
Anyone who be having anxiety or anything from normal weed/thc look into cbg and cbd flower shit is a godsend imo,TheCapitalLink,1i91tar,2025-01-24 13:08:20,4,0.75,5,https://www.reddit.com/r/TheCapitalLink/comments/1i91tar/anyone_who_be_having_anxiety_or_anything_from/,AssociationOk4452,Informational Post,Also shit like kava instead of alcohol and kanna instead of x
Is waka the best strain and where to buy in bulk for a good price.,Kava,1i8zitx,2025-01-24 11:34:38,1,1.0,3,https://www.reddit.com/r/Kava/comments/1i8zitx/is_waka_the_best_strain_and_where_to_buy_in_bulk/,Critical-Advantage16,,"I’m halfway through my first 16 ounce bag of Fijian Waka. This is my first time trying, and I decided to go with the regular stuff and avoid instants and extracts. I’m very happy with the effect I’m getting and don’t mind the taste of the stuff at all. Is Waka the go-to strain I should stick with? And where is a good place to buy a bunch at once with decent potency? I’m going through the 16 ounce from Amazon pretty fast. If I continue at this rate, I will be spending roughly $55 every week on kava I think. A bit steep for me."
I'm No Longer With Blocks United,cosmosnetwork,1i8yx9a,2025-01-24 11:09:29,61,0.98,25,https://www.reddit.com/r/cosmosnetwork/comments/1i8yx9a/im_no_longer_with_blocks_united/,AtlasStaking,,"I (Matt) am one of the founders of Blocks United and have been keeping track of airdrops for you for several years. I have split my time between Blocks United and Atlas Staking for quite awhile. After 3 great years, I've decided to move on from Blocks United and to focus on growing validators with Atlas Staking. 

I am an airdrop hunter myself, so I will continue to post valuable updates. I don't want you to miss big free money... airdrops like Injective and Celestia that made people thousands of dollars. 

Atlas Staking is worth keeping an eye on because we are expanding rapidly. We currently run validators for Cosmos (inactive), Kava, Nomic, Band, Babylon, Stride, Seda, ETH/Stader, Radix, Avalanche, Avail, and Polygon. If you stake any of those tokens, please give Atlas Staking your consideration.

Onward and upward. Peace!"
COSMOS AIRDROP UPDATE,cosmosnetwork,1i8yvtg,2025-01-24 11:07:54,14,0.89,2,https://www.reddit.com/r/cosmosnetwork/comments/1i8yvtg/cosmos_airdrop_update/,AtlasStaking,,"https://preview.redd.it/q6lcek55pyee1.png?width=2240&format=png&auto=webp&s=a9c183f91dc9e7d1bcda21b46c3ad88ff85a15c7

I (Matt) am one of the founders of Blocks United and have been keeping track of airdrops for you for several years. I have split my time between Blocks United and Atlas Staking for quite awhile. After 3 great years, I've decided to move on from Blocks United and to focus on growing validators with Atlas Staking. 

I am an airdrop hunter myself, so I will continue to post these valuable updates. I don't want you to miss big free money... airdrops like Injective and Celestia that made people thousands of dollars. 

Atlas Staking is worth keeping an eye on because we are expanding rapidly. We currently run validators for Cosmos (inactive), Kava, Nomic, Band, Babylon, Stride, Seda, ETH/Stader, Radix, Avalanche, Avail, and Polygon. If you stake any of those tokens, please give Atlas Staking your consideration.

Going forward, please be aware that the airdrop updates will come from Atlas Staking, NOT Blocks United. I promise the same great resource with regular airdrop updates. 

**To access airdrop claim links please register for our** [Cosmos Airdrop Email](https://airdrops.atlas-staking.com/cosmos?utm_source=ardupt1-24-25&utm_medium=reddit&utm_campaign=cosmosairdrops)**. If you don’t see the email within a minute, check your spam folder.**

**We don't paste the links in this post because Reddit's spam filter will flag and remove the post. Airdrop claim links cause instant removal by Reddit. They are trying to protect users from scammers.**

You must use a Cosmos-native wallet, like [Keplr](https://www.atlas-staking.com/stake-atom-using-keplr/) or [Leap](https://www.atlas-staking.com/stake-atom-using-leap/), or [Cosmostation](https://www.atlas-staking.com/stake-atom-using-cosmostation/) to claim airdrops and manage those tokens. 

We do our best to verify that all the information in this email is official and safe to click, but we can’t possibly know if a project turns out to be a scam. We are not smart contract or authz permission auditors, nor do we hold ourselves out to be.

**When claiming airdrops you will be prompted to “approve” the transaction. Be on the lookout for, “msgSend” and other authz permissions. Those are BAD. If you see anything other than “msgClaim” then we advise against approving the transaction. It’s best to wait and check social media channels to see if people are getting scammed.**

You can find Atlas Staking in Keplr**,** Cosmostation**,** Leap wallet**,** Trust wallet, Ledger Live, Frontier, Rainbow and Guarda wallets.

**\~LFG!\~**

  
**Nillion Network (AIRDROP REGISTRATION CLOSES FEB 3.)**  
Project: Nillion network claims to be humanity's first blind computer. It includes quantum secure messaging, encrypted trading platforms, private healthcare analytics, trustless games, decentralized 2-FA, private inference of LLMs, digital identity, decentralized storage and more.  
**Token symbol:** NIL  
**Available for:** Testnet participants, community contributors, and developers.  
**Snapshot:** Ongoing.

  
**Tabi (TESTNET 2 FARMING)**  
**Project:** Tabi is the first modular Cosmos gaming chain with high scalability and polymorphism VM. Tabi is pioneering gaming with EVM or any-VM-compatibility and setting new standards for mass adoption in blockchain gaming. They are backed by Animoca Brands and Binance Labs.   
**Token symbol:** TABI  
**Available for:** Testnet participants and those who complete quests.  
**Snapshot:** Ongoing.

 

**Fuel Network (CLAIM 2 OPENS JANUARY 30)**  
**Project:** Fuel is an operating system purpose-built for Ethereum rollups, designed to help developers build decentralized economies at scale. As far as we know, Fuel will be IBC enabled. Fuel is VC backed and a highly anticipated project.   
**Token symbol:** FUEL  
**Available for:** Testnet particpants.  
**Snapshot:** December 18, 2024.

We hope this list gets you into action. Have a great weekend! 



Nothing we say is financial advice or a recommendation to buy or sell anything. Cryptocurrency is a highly speculative asset class. Staking crypto tokens carries additional risks, including but not limited to smart-contract exploitation, poor validator performance or slashing, token price volatility, loss or theft, lockup periods, and illiquidity. Past performance is not indicative of future results. Never invest more than you can afford to lose. Additionally, the information contained in our articles, social media posts, emails, and on our website is not intended as, and shall not be understood or construed as financial advice. We are not attorneys, accountants, or financial advisors, nor are we holding ourselves out to be. The information contained in our articles, social media posts, emails, and on our website is not a substitute for financial advice from a professional who is aware of the facts and circumstances of your individual situation. We have done our best to ensure that the information provided in our articles, social media posts, emails, and the resources on our website are accurate and provide valuable information. Regardless of anything to the contrary, nothing available in our articles, social media posts, website, or emails should be understood as a recommendation to buy or sell anything and make any investment or financial decisions without consulting with a financial professional to address your particular situation. Atlas Staking expressly recommends that you seek advice from a professional. Neither Atlas Staking nor any of its employees or owners shall be held liable or responsible for any errors or omissions in our articles, in our social media posts, in our emails, or on our website, or for any damage or financial losses you may suffer. The decisions you make belong to you and you only, so always Do Your Own Research.

[r/cosmosnetwork](https://www.reddit.com/r/cosmosnetwork/) [r/kavalabs](https://www.reddit.com/r/kavalabs/) [r/HydraDX](https://www.reddit.com/r/HydraDX/) [r/CryptoCurrency](https://www.reddit.com/r/CryptoCurrency/) [r/Bitcoin](https://www.reddit.com/r/Bitcoin/) [r/ethereum](https://www.reddit.com/r/ethereum/) [r/ethereumnoobies](https://www.reddit.com/r/ethereumnoobies/) [r/Polkadot](https://www.reddit.com/r/Polkadot/) [r/Kusama](https://www.reddit.com/r/Kusama/) [r/cardano](https://www.reddit.com/r/cardano/) [r/solana](https://www.reddit.com/r/solana/) [r/Avalanche\_Coin](https://www.reddit.com/r/Avalanche_Coin/) [r/polygonnetwork](https://www.reddit.com/r/polygonnetwork/) [r/CryptoMarkets](https://www.reddit.com/r/CryptoMarkets/) [r/CryptoCurrencies](https://www.reddit.com/r/CryptoCurrencies/) [r/investing](https://www.reddit.com/r/investing/) [r/InvestmentEducation](https://www.reddit.com/r/InvestmentEducation/) [r/investment](https://www.reddit.com/r/investment/) [r/Investments](https://www.reddit.com/r/Investments/) [r/cardano](https://www.reddit.com/r/cardano/) [r/Tether](https://www.reddit.com/r/Tether/) [r/binance](https://www.reddit.com/r/binance/) [r/BinanceSmartChain](https://www.reddit.com/r/BinanceSmartChain/) [r/BinanceUS](https://www.reddit.com/r/BinanceUS/) [r/BinanceCrypto](https://www.reddit.com/r/BinanceCrypto/) [r/Ripple](https://www.reddit.com/r/Ripple/) [r/XRP](https://www.reddit.com/r/XRP/) [r/LidoFinance](https://www.reddit.com/r/LidoFinance/) [r/litecoin](https://www.reddit.com/r/litecoin/) [r/tron](https://www.reddit.com/r/tron/) [r/Monero](https://www.reddit.com/r/Monero/) [r/UniSwap](https://www.reddit.com/r/UniSwap/) [r/ledgerwallet](https://www.reddit.com/r/ledgerwallet/) [r/cardano](https://www.reddit.com/r/cardano/) [r/Stride\_Zone](https://www.reddit.com/r/Stride_Zone/) [r/CircleUSDC](https://www.reddit.com/r/CircleUSDC/) [r/nomic](https://www.reddit.com/r/nomic/) r/Berachain"
What’s your favorite Sitcom?,FilmClubPH,1i8slpi,2025-01-24 05:39:51,152,0.96,242,https://i.redd.it/i2oo4ynf7xee1.jpeg,Fine_Elderberry6248,Discussion,"Napanood ko ulit yung mg ibang episodes ng Kaya ni Mister Kaya ni Misis sa youtube. (Sana iupload lahat ng ABS) 

Ang nostalgic lang kasi isa to sa paborito kong sitcoms before pati yung Bida si Mister Bida si Misis. Sobrang ganda ng chemistry ni Mary at Buboy Magtanggol kaya akala ko dati mag-asawa sila sa totoong buhay.

Kayo ba ano favorite niyong sitcom? "
I know some people expected this because the Ocg did it but still wow,YuGiOhMasterDuel,1i8qgiy,2025-01-24 02:56:09,154,0.96,63,https://i.redd.it/fl5ywh68ewee1.png,jrip_dip_fish_1764,Discussion,I think you know what I am talking about. Also more hits on floodgate card is so biggg! Also on the Yubel hit I don't really know if it is warranted imo. Also my fellow branded players rise up!
Bojkot zbog visokih cijena,croatia,1i8qfi8,2025-01-24 02:53:57,23,1.0,8,https://www.reddit.com/r/croatia/comments/1i8qfi8/bojkot_zbog_visokih_cijena/,Decent-Chair1748,💬 Kmečanje,"Konobari javljaju da su kafići u određenim gradovima prazni ili imaju par gostiju, podržite bojkot I protiv cijena u kafiću , pivo 20kn + , kava 15kn "
Buy Signal Kava USD - 24 Jan 2025 @ 01:17 -> USD0.463,getagraph,1i8p4qv,2025-01-24 01:20:03,1,1.0,0,https://www.reddit.com/r/getagraph/comments/1i8p4qv/buy_signal_kava_usd_24_jan_2025_0117_usd0463/,jvc72,Crypto,"Ticker: **KAVAUSD**

Exchange: **CRYPTO**

Time: **24 Jan 2025 @ 01:17**

Price: **USD0.463**

Link: https://getagraph.com/crypto-currencies/KAVAUSD/ENG"
Kanna virgin,Kanna,1i8or21,2025-01-24 00:55:36,6,1.0,4,https://www.reddit.com/r/Kanna/comments/1i8or21/kanna_virgin/,moon414,,"Im so excited to finally try it! I’ve dabbled in the other natural K’s,  kratom and kava and do enjoy them. However I’m looking for a more uplifting / euphoric / social enhancing experience to replace alcohol (I understand that it’s not like alcohol but I’m looking for something better than alcohol) for concerts, etc. I’m OVER the alcohol hamster wheel, so I’m looking for a better alternative. I’m looking at vapes or tinctures brands from the approved list but what is best for a virgin? Take my K card lol I’m open to any advice or recommendations. Thanks babes "
Any tips on how to sleep???,ptsd,1i8mqqn,2025-01-23 22:57:22,3,1.0,25,https://www.reddit.com/r/ptsd/comments/1i8mqqn/any_tips_on_how_to_sleep/,blumieplume,Advice,"Hey guys, I’ve had a lot of trauma and loss in the last 12 years. I’ve tried everything over the years to help me sleep and nothing seems to work. I always wake up around 2 or 3 am and can’t sleep again til 5-7 am every day. My eyes are tired and watering all day all the time and then by the time I lay down to sleep I’m wide awake. I walk every day and do yoga and Pilates in the afternoon (used to exercise in the mornings so maybe I need to switch back to that schedule but even when I did I still woke up in the middle of the night most every night)

I’ve tried breathing methods, herbs like kava, ashwaganda, valerian root, Reishi, and melatonin, and prescriptions like Xanax, zopiclone, and ambien, doing bedtime yoga at night, drinking heavily (which helped me pass out but still led to me to wake up in the middle of the night), taking CBD, taking mushrooms early in the day so that when they wear off I get tired, taking weed (that actually has a negative effect and keeps me up until it wears off) .. 

Does anyone have a technique that worked for them to be able to sleep at night? I would really appreciate any tips and tricks!"
Conversion factor from kava extract beverage to actual kava,Kava,1i8l1gf,2025-01-23 21:27:52,1,1.0,1,https://www.reddit.com/r/Kava/comments/1i8l1gf/conversion_factor_from_kava_extract_beverage_to/,drudman6,,"My wife gets these Leilo drinks, and I’ve also purchased kava extract from Whole Foods (365 brand).

Can anyone advise on what a rough conversion factor between these and the way you all talk about consuming real kava?

Right now I need to drink two to feel any, and I’m curious if that is “a lot” or “a little”, by comparison. If someone is like, “what I drink daily is the equivalent of 4-5 of those” then that would embolden me to try more."
First time use. Kalm with Kava Instant Kava.,Kava,1i8jqzb,2025-01-23 20:22:48,27,0.92,7,https://www.reddit.com/r/Kava/comments/1i8jqzb/first_time_use_kalm_with_kava_instant_kava/,KindaKrunchy1111,Review,"Feeling so chill! 
We did 3 glasses (shells?) 200ml of water and 1/2 Teaspoons of powder 15 min apart. My partner’s lips were numb, 

I felt no numbness. 

Now…He’s writing music and I’m reading. Feels nicer than alcohol. 10/10! "
"Kuues Tartu Redditi üritus reedel (31.01) kell 19:00 @ Irish Embassy (Raekoja plats 10) -- r/Eesti, r/Tartu, r/memeesti, r/naistejutud kasutajad ja kõik teised ka on oodatud :)",Tartu,1i8inoq,2025-01-23 19:30:14,22,0.96,9,https://www.reddit.com/r/Tartu/comments/1i8inoq/kuues_tartu_redditi_üritus_reedel_3101_kell_1900/,qUxUp,Üritus,"Aeg on käes! :)  


Kohtume pubis [Irish Embassy](https://embassypub.ee/meist), meile on bronnitud piisavalt laudu. Minu tunned ära tumedate juuste, valge särgi järgi, nimeks Jaak.

Tahad sajandi pidu, aga tegelikult ei taha sajandi pidu? Siis oled õiges kohas! Tartu Redditi üritus on mugavas asukohas chill kokkusaamine. Kava pole. :D Osalejad on sõbralikud, söövad, joovad, teevad nalja ja ajavad juttu. Joo ananassimahla, mohiitot või vett -- valikuid on lõputult! Osalema on oodatud kõik, ka need, kes elavad väljaspool Tartut!

\* Jooke/sööke saab ka ette tellida. Menüü leiad pubi kodulehelt.

\* Oodatud täisealised.

\* Võid enne üritust mõelda, millisesse alamredditise oled kõige rohkem postitanud ja miks just sinna. See on säärane hea lihtne ja jabur jututeema. :)

\* EDIT: Aitüma vaprale tartlasele u/Ok\_Cicada8053, kes avastas pealkirjast kirjavea. Tegin postituse uuesti, sest eelmise pealkirjas oli kaks kuud vale kuupäev. :)



|Küsimus|Vastus|
|:-|:-|
|Kas kokkusaamisel peab oma kkontonime avaldama?|Ei pea midagi avaldama, mida ei soovi. :)|
|Ma pole tartlane ja mu sõber pole Redditi kasutaja, kas tohime tulla?|Kõik on oodatud. Osalemiseks ei pea olema r/Eesti või r/Tartu kasutaja ning su sissekirjutus ei pea olema Tartus.|
|Palju inimesi käis eelmistel üritustel?|Igal üritusel on õhtu jooksul olnud 13 - 20 inimest. Osalejate arvu pole võimalik ette teada. :)|
|Mis oli keskmine esimese/teise üritusel osaleja vanus?|27 a.|
|Kas üritus ikka toimub?|Üritus toimub alati. Välja arvatud juhul, kui siin samas teemas on öeldud ""ÜRITUS EI TOIMU."" :)|
|Taevast sajab midagi, kas jääda koju?|Ei!|
|Kas üritusel on plaanitud ka mingid tegevused?|Peamine tegevus on meeldiva seltskonnaga aja veetmine & sotsiaalne söömine/joomine. Organiseerin taas ühise kunstiprojekti, mis ei pane kedagi ebamugavasse olukorda ja ei nõua osalejatelt ettevalmistamist ega eriteadmisi. Vahel on toimunud valikvastustega viktoriin (läbi huumori).|
|Kas ma võin ise üritusel korraldada mingi tegevuse või lauamängu kaasa võtta?|Muidugi. See on äge & tehtav (lepi minuga eelnevalt kokku)!|
|Miks sa neid üritusi korraldad?|Inimesed on ägedad, hindan head seltskonda -- lisaks mulle tohutult meeldivad tartlased ja Tartu linn. :)|



[tartu üritus event reddit eesti reddit r\/tartu üritus kokkusaamine r\/eesti reddit kokkusaamine tartu ülikool university of tartu student event irish embassy baar bar pubi pub reddit.com\/r\/tartu www.reddit.com\/r\/tartu](https://preview.redd.it/71zredlnbuee1.png?width=673&format=png&auto=webp&s=f7059876cd6d38c3cf7fece6d0026af9480db94e)

  
"
Tongan Kava Club singing..,Te_Ao_Maori,1i8huoe,2025-01-23 18:52:49,1,1.0,0,https://www.reddit.com/r/Te_Ao_Maori/comments/1i8huoe/tongan_kava_club_singing/,Fit-Cryptographer589,,https://www.instagram.com/reel/DFHvYW6R5oy/?igsh=MTBuazBwZHAxcDlpMQ==
"Looking for relaxation, calmness",herbalism,1i8hf13,2025-01-23 18:32:50,15,0.81,36,https://www.reddit.com/r/herbalism/comments/1i8hf13/looking_for_relaxation_calmness/,Mysterious-While-233,Smoking,"Hi, I am looking for a drug or herb or anything that can really calm my mind. I have so much anxiety it's not fun anymore, these heart palpatations won't go away. I really need to find something that calms me down and makes me feel like everything is okay, like a benzo. I just want to be able to breathe again😭
This is what I already tried:
- Kava (got me dizzy/nauseous)
- Kratom 
- Kanna 
- L theanine
- Chamomile tea
- Smoking weed (got me dizzy)
- cbd oil
- Omega 3
- valerian
And also some medication 

I am still going to try mulungu and blue lotus

don't say *ssris* or *go to therapy* please😌"
Kava Coles,Cairns,1i8h5ff,2025-01-23 18:20:33,6,0.75,5,https://i.redd.it/lqi273g8utee1.jpeg,kitkat75373,,I have been trying to find this in Coles stores but unable to locate it - is this available in Coles in cairns? Thanks! 
Can you smoke tea out of tea bags??,herbalism,1i8fjig,2025-01-23 17:09:39,3,0.54,31,https://www.reddit.com/r/herbalism/comments/1i8fjig/can_you_smoke_tea_out_of_tea_bags/,AxelsCommnSpace,Smoking,"Okay you know, i’m no expert at all in anything I don’t know what i’m talking about, but hear me out
 
A kava blunt 

Okay go head lmk how awful of an idea this is"
