Post Title,Subreddit,Post ID,Created Time,Upvotes,Upvote Ratio,Comments Count,Post URL,Author,Flair,Post Text
Dear Claudia,Unsent_Unread_Unheard,1i7iei4,2025-01-22 13:42:05,0,0.5,1,https://www.reddit.com/r/Unsent_Unread_Unheard/comments/1i7iei4/dear_claudia/,TotalJelly2442,Love,"We’re getting close to five months now. A lot has changed, a lot of things that I wish I could show you.

I’ve reread your letter several times. You’re correct on all of it. My insecurities, my pushiness, everything. I wish I could say that that wasn’t true, but it was. I look back on that time and I’m a completely different man. I’m sorry it took losing someone who loved me mind, body, and soul to do that.

I’m with someone now. I don’t know how it’s gonna go, but she’s moving in this weekend. She has a kid, Claudia. A five-year-old son who is an absolute little genius. Honestly, I love him. If you and I ever did get back together in the future, which who knows what the future holds, I’d still be fine with not having kids, but I realized how much I like them. He honestly is a pleasure to be around, and teaching him about the world is a magical experience. 

I wish we could talk like adults. I wish we could meet up over coffee or something and just actually have closure. Don’t get me wrong. I understand. The lack of closure is very much my fault. Hell you leaving is to except for the Florida stuff which I understand, believe me, it’s getting unbearable for me too.

It sucks. I love my new girl. However, I can’t stop thinking about you. About how we literally gave ourselves pieces of our souls. Do you remember that? Behind Marcus’s house? I still feel it to this day. I feel like you are missing me honestly.

I wish I could show you. I’m a changed man, but I doubt you’ll ever give me the chance. I’ve grown financially and independently and how I would be able to help share the burden you wouldn’t be holding 90% of it anymore. I am sorry for doing that. I have no excuse. I was a spoiled child and I know that.

I don’t know how things are gonna go with this new girl because things have been rough lately. She’s still moving in, and that still makes logical sense given her business. But I would not lie to you, and say that I’m not worried.

But you know me. Can’t be alone. But I’m not making the same mistakes I made with you. We’re never gonna have a joint bank account. We’re never gonna really join our lives together not unless things get very very serious. She’s OK with that too.

I wish I didn’t miss you. I wish I didn’t say the things that I said to you because you did try. I know you did. I wish I could bear you 6 feet under the ground and walk away, but I just can’t. I wish you’d give me another chance honestly. It’s a fucked up thing to say given my current situation, but it’s so fucking true and I hate that.

I’m curious how you have changed. I noticed you’re no longer living with Fallon. You’re in Greenville now. I hope it’s not with whoever you were dating. I really do. Don’t make the same mistakes I’m making. 

If you see this by chance, please talk to me. Please. I’ve changed so much in such a short period of time and I’m only gonna change more. Losing you taught me so much. I would move to Greenville in a heartbeat to be with you. I would abandon everything here. I feel comfortable saying that because I don’t think it’s actually gonna happen. But if it does, I would.

I know you loved me. I know you still do in many ways. I loved you too. More than the moon loves the Earth, more than the sky loves the stars. In my opinion, we were just meant to be. It just didn’t work out this time around. It could if we just talk, but I don’t think that’s gonna happen is it? Not for years anyway.

I don’t feel safe around you yet. The mere idea of seeing you in person sends me into conniptions to tell you the truth. I doubt you feel safe around me either. I was at a wreck at the end. So were you. 

If you see this and you send this to my current girlfriend, that’s on me. Do what you want. But I’ve always been an honest person when it comes to emotions. That reminds me you’d be proud of me for not lying anymore. I refuse to do it. Even if it makes me come off as lame, even if it makes me not be able to get the things I want, I just can’t anymore. I literally panic if I do. I refuse to be the person who lost you. I’d love to be the person. Who gets you back, years from now when we’re both grown.

Please, maybe five years from now at least talk to me. Just do that at least. I mean, if you wanna try to reconnect our lives, I will always be OK with that. Always. But that’s up to you.

I’ll miss you forever. My soulmate. Goodbye.

Maybe soon we can actually see each other again and kiss one more time. All I want is just a life with you and the Kava bar. I don’t care about anything else. I would sacrifice my very legs, eyes ears, mouth and life for that. For one more shot. "
Introducing Oros: Kava’s first Agent Layer product,kava_platform,1i7hvio,2025-01-22 13:21:17,2,0.67,0,https://kava.io/news/oros-kava-chains-deai-agent,cameron_kavalabs,,
Kava Stone,Kava,1i7fsjn,2025-01-22 11:57:32,2,1.0,2,https://www.reddit.com/r/Kava/comments/1i7fsjn/kava_stone/,Upstairs-Property379,,"I just received my first Kava (Kava stone)
The labeled recipe says 25 grams of kava per 1 quart of water.

Is that one serving? For one person would you add more/less? Is that one serving size?"
Ako si na SK zijeme…,Slovakia,1i7e4sx,2025-01-22 10:48:49,263,1.0,24,https://www.reddit.com/r/Slovakia/comments/1i7e4sx/ako_si_na_sk_zijeme/,MalyToPolny,🕴️ Politics 🕴️,"Znamy sa ma pytal, ako je to teraz na Slovensku, tak som mu povedal: Najlepsie to vystihuje toto - Ked restauracia podava stravu u seba v podniku, tak DPH je 5%, ak ju nesie kurier, tak DPH je 23% a ked ma restika vlastneho kuriera alebo si jedlo vyzdvihnes osobne, tak je dph 19%. To sa tyka len stravy, na nealko napoj, je DPH 19%, ked alko, tak DPH 23%, ked kava v restike, tak 5%, ked kava so sebou, tak 19%. Takze lepsie si je objednat Gin a Tonic a nie GinTonic a uz vobec nie so sebou. Vsetko zjedz a vypi v restike, ale nech ta ani nenapadne povedat, ze to beries so sebou a potom to zjes v restike, lebo to uz registracna pokladna vybuchne…takze takto sa zije momentlane na Slovensku 🙂"
squigly in your bubble bath🧼🛀🧟‍♀️💙💜❤️,Skullgirls,1i7dolp,2025-01-22 10:29:41,47,0.95,4,https://www.reddit.com/gallery/1i7dolp,ka-art,Original Art,
am i making a mistake?,heartbreak,1i7b807,2025-01-22 08:35:00,4,1.0,4,https://www.reddit.com/r/heartbreak/comments/1i7b807/am_i_making_a_mistake/,cyberchoker,,"I just broke up with my ex of 5 years because of his self sabotaging habits and addictions. It hurts so much because he was my first everything, I feel like i’ve been saving myself until i met him. He showed me how to love and be loved genuinely. I’ve never met a softer and kinder man in my life, and i’m scared i’ll never get anything like that again. I was 19 when we first met and now i’m 24. It started with me mentioning that i didn’t really like the fact that he vaped so often, he would go through them in like 2 days and it seemed to be financially taxing but not only that, I just wanted him to be healthy since he has hypothyroidism and was always in pain and i didn’t want him to make anything worse. He told me that he would in the beginning of our relationship, promised me that he would work on quitting and that i did r have to worry about it because he’s not addicted. I took his word for it of course and i dropped it right after we had that talk because i wanted to fully trust in him. It took me 3 years to find out that he never actually did quit, he was just hiding it and going into the bathroom or on drives by himself to smoke. When i found it in the bathroom once, i asked him if it was his and he immediately had the guiltiest look sand apologized, telling me that he never actually did try, and that he knew that if he didn’t that i would leave him, which i didn’t say by the way, but maybe he came to that conclusion after i was speaking about how much i didn’t like it. Anyways though, it wasn’t really the fact that he was doing it that got to me, it was just the way he hid it from me and i felt super naive the entire time. I would always playfully pout whenever he would leave to go to the bathroom because i’m not joking it would be like an hour and a half of him chillin in there lol. Turns out all those times were the times he would smoke. I didn’t really scold him or yell at him or anything like that when i found out though, i just kind of told him how i felt and that i was scared he would hide more things from me in the future. He said this was the only thing and he feels super guilty about it. So i just told him that i still don’t like it, but if he’s going to do it, just please still try and quit but just don’t go hogging up the bathroom anymore, he can be in the room with me. He expressed to me that he wishes he never smoked his very first time because now he’s addicted, and i empathized even though i can’t relate, but i told him that i believe that he can and i’m here to support him while he tries to quit. Let’s skip to about the last two years. I was struggling to find a job after losing my last one, so financially everything was on him. I did little side hustles and tried to support the best i could but i can tell that he needed more than that, and it really put stress on us. No matter what though, it was never something he scolded me for or pushed me to do, he just took care of it the best he could, but i think he could tell how hard i was being on myself and it made him feel bad. Forgot to mention that we’ve been living with his parents by the way. So that’s a whole extra layer that made me super frustrated and anxious about everything. I hated leaving his room without him and being perceived to the point where i just did not leave unless i absolutely needed to or if there was no one home. I wasn’t eating and i wasn’t cleaning up around the house, i was just overall depressed, with the only thing keeping me happy was seeing him come home from work. At that point it felt like my life was just him. I didn’t ask for much but to have little dates with him and maybe if i needed, some clothes and dumb hello kitty squishmallows we saw at the store together or something. But it seemed like everytime i asked for us to do something, he kept saying, “I’m broke right now, i don’t have money.” which of course i understood and didn’t push on, since i could only contribute so much but i was still saving up as much as i could for us to move. Only to find out that he found a new addiction that was much more expensive than his vaping, that i had no idea about, which was kratom. He had been going to the kava bar at least everyday twice a day and drooling about 30 dollars on drinks. He admitted to me that he was giving up date nights for his drinks and that he had a problem and wanted me to help. I was super worried because i don’t know how to help someone with this kind of personality, i mean my father was a steroid abuser and was probably the worst person alive so that is what scared me the most but that was never my ex, he has never abused me or been super aggressive with me ever in our relationship, he genuinely loved me with every fiber of his being i could tell and feel that. However, the way he just never took my help or would just keep doing these things behind my back and then lying to my face about it, or when i would show him that i know that he did go back to the bar, he would blow up on me and run away leaving me alone and anxious, i was starting to feel a very heavy weight on my chest. Kind of like hopelessness and worry. I love this man to death so i told him i wanted to be here for his journey of being clean, he promised me he would try too, there have been so many talks where he would tell me he felt guilty for even being with me because i have so much potential and i’m beautiful and he’s holding me back, but i didn’t want to see it that way. I was focused on building our life together, no matter what struggles came out way, i just wanted to make it with him. I could never see him as a waste of time no matter how much he tried to tell me that he was, so those talks would end with us both crying and promising each other that it would get better. I gave him another year, I wanted to see how much he would improve. He couldn’t though, with the amount of stress we were in, it just got worse if anything, besides, he was very coddled. His mother and him were literally sharing bank accounts and she would look at his transactions and reimburse him whenever he went into the negatives, and i feel like that was enabling him, he would never learn his lessons in life because this was their dynamic. Literally knocking on our door and waking him up for work and crying whenever he took a sick day because she didn’t want him to get fired. I really began to dislike her because of these things, especially with the fact that since he was a little boy he was practically her personal therapist since she hates her husband and would let him know everyday about that whole situation. He just grew to be super anxious and people pleasing like her. It’s like i understand that’s her baby, but he would never grow up to be a man in those circumstances and it really did show. I’m just going to skip to right now, He did kratom about two days ago and i texted him saying something like “cheers bro” to kind of let him know that my heart just dropped when i found out that he gave up on trying again and all he said was “I’m sorry, but i was going to still go even if i told you” and that stuck in my head ever since. I tried to drop it since the next day we had a fun day planned, a movie date and buying things for our cat to spoil our baby and when that day did come, it was super fun. Then at the end of it all, i was super happy and excited to go home with him and spend the rest of his day off together playing games but then he dropped the “You’re going to hate me for this, but i need it” I just felt an overwhelming feeling of dread and i think i realized that we are stuck in this loop and completely stagnant, i cant help someone who won’t help themselves so matter how much we love each other. He was heading home to drop me off, get his tea, then come back to me after but he seemed clearly irritated that i was upset. I just said “I don’t think i’ll be here when you get back, i’m going to text my mom and have her come get me.” He didn’t reply but he seemed kind of stunlocked, whenever we did fight i would say things like this here and there so i assumed he just thought i was pulling that again. I walked inside and he ignored me and went straight to the bathroom while i went into the room snd began to pack my things. I kind of felt out of body at that point, like i was trying to stop myself but i also needed to do this. He came into the room and once it kind of settled in that i was serious he just cried and said that he was sorry, and that he didn’t expect this suddenly. I was explaining to him how i felt about everything, that we just kept falling into the loop of him promising that it would get better, the relapsing after a day, then us getting mad at each other and then making up and doing it all over again. He understood and we hugged each other, basically saying goodbye and we wish each other the best. We held each other for a while and talked about how much it hurts but he wasn’t going to ever hold me back so he was willing to let me go. He then kind of took off after saying that it’s not fully processing to him that i’m leaving so he needed to go think, then i just sat on the floor trembling and crying while i continued to pack. I then got a notif 15 minutes later that he was at the bar and that just confirmed to me that i needed to do this even more. He texted me while he was driving explaining that he’s so sorry and that he hates himself for being like this, that i’m genuinely the best person he’s ever met and that i deserve the best but he can’t watch me leave. He said that he went to the bar not to drink but to go and talk to one of his friends there because he was freaking out and didn’t know how to deal with it. I had texted my mom everything and he immediately came to get me, which was an hour i had to prepare to leave. I told him that I’m sorry too and that we just both didn’t do enough for each other, but that i could never hate him and i couldnt thank him enough for the kind of love that he showed me. But i wasn’t enough to want him to build that life with me, we were engaged man, i stalled so hard doing this. I never thought that i would have to live without him. I always said that when i break up with people i’m not going back, and i do mean that. But the way he’s so kindly texting me and wanting to check up on me while also not overstepping any boundaries just reminds me of how much i love him. He’s telling me that he’s struggling really hard and that he hates the fact that i won’t even allow us to be friends because he can’t imagine a life where i’m not there, i really do feel the same way, like so much, but i cant have him here without being with him you know? I feel like i left him at his lowest and that we are still so fucking lost on how we are going to start planning our lives without each other that i’m really doubting myself, I can’t tell if i made the right decision, maybe i’m being naive because this is my first real relationship but it just feels so unbearable right now. I feel like i’ll never get the other half of me back. He’s everywhere. I went to go play some minecraft to ease my mind and i see a chest full of his items with a sign that says “I don’t wanna ruin the experience for you and (our friends name) so i’m just join this one last time and give you back all of my stuff :) I love you guys” and i legit logged out and threw up.  I really don’t know what to do, i’m such vengeful and spiteful person but i can never see myself truly blocking him and hating him after all this time. I grew a lot and learned a lot from him, and he’s accommodated so much for me even when i was super jealous and unmedicated lmao. I’m scared i will never find a love like that ever again, that i’m letting go of my person. I don’t know what to do. If you read all this thank you, i know my thoughts are all over the place but i just don’t feel real right now. My friend that has been there with us through it all told me that he loves my ex a lot and this is hard but he saw how bad we were after all these years and it was bound to happen until he really changed his ways but i don’t see that happening anytime soon and neither did he. I’m exhausted but i can’t sleep, my eyes are so sore that i feel like i can physically not cry anymore even though i know i need to. I just need advice. "
🚨 Akcijų karai prasideda! Kas šią savaitę siūlo geriausias kainas? 🚨,Pricer_Lietuva,1i79fr5,2025-01-22 06:55:02,1,1.0,0,https://www.reddit.com/r/Pricer_Lietuva/comments/1i79fr5/akcijų_karai_prasideda_kas_šią_savaitę_siūlo/,Pricer_Lietuva,,"🚨 Akcijų karai prasideda! Kas šią savaitę siūlo geriausias kainas? 🚨

Ar jau žinote, kur šią savaitę apsimoka apsipirkti? 🛒 Prekybos tinklai aktyvėja, o mes jau paruošėme detalią akcijų apžvalgą, kad jums nereikėtų ieškoti patiems!

🔹 Maxima, Lidl, IKI, Rimi, Norfa – kas siūlo geriausius pasiūlymus?

🔹 Bananų karas: kur bananai pigiausi? 🍌

🔹 Pietūs: kur rasti skaniausius ir pigiausius patiekalus? 🍽

🔹 Kava „Lavazza“: kur dabar užsisakyti už geriausią kainą? ☕

Viską sužinosite čia:

👉 4-osios savaitės akcijų apžvalga [https://naujienos.pricer.lt/ketvirtosios-savaites-akciju-leidiniai-prekybos-tinklai-aktyveja-2025-01-21/](https://naujienos.pricer.lt/ketvirtosios-savaites-akciju-leidiniai-prekybos-tinklai-aktyveja-2025-01-21/)

[🚨 Akcijų karai prasideda! Kas šią savaitę siūlo geriausias kainas? 🚨](https://preview.redd.it/40ucqb80bjee1.jpg?width=1157&format=pjpg&auto=webp&s=4185d02465d2172444ae0f837f33dc4722abeccd)

Sutaupykite laiko ir pinigų – skaitykite ir rinkitės geriausius pasiūlymus! 💰

\#Akcijos #PricerLt #Sutaupyk #PrekybosTinklai #GerųPirkinių"
🚨 Akcijų karai prasideda! Kas šią savaitę siūlo geriausias kainas? 🚨,u_Pricer_Lietuva,1i79fhk,2025-01-22 06:54:33,1,1.0,0,https://www.reddit.com/r/u_Pricer_Lietuva/comments/1i79fhk/akcijų_karai_prasideda_kas_šią_savaitę_siūlo/,Pricer_Lietuva,,"🚨 Akcijų karai prasideda! Kas šią savaitę siūlo geriausias kainas? 🚨

Ar jau žinote, kur šią savaitę apsimoka apsipirkti? 🛒 Prekybos tinklai aktyvėja, o mes jau paruošėme detalią akcijų apžvalgą, kad jums nereikėtų ieškoti patiems!

🔹 Maxima, Lidl, IKI, Rimi, Norfa – kas siūlo geriausius pasiūlymus?

🔹 Bananų karas: kur bananai pigiausi? 🍌

🔹 Pietūs: kur rasti skaniausius ir pigiausius patiekalus? 🍽

🔹 Kava „Lavazza“: kur dabar užsisakyti už geriausią kainą? ☕

Viską sužinosite čia:

👉 4-osios savaitės akcijų apžvalga [https://naujienos.pricer.lt/ketvirtosios-savaites-akciju-leidiniai-prekybos-tinklai-aktyveja-2025-01-21/](https://naujienos.pricer.lt/ketvirtosios-savaites-akciju-leidiniai-prekybos-tinklai-aktyveja-2025-01-21/)

[🚨 Akcijų karai prasideda! Kas šią savaitę siūlo geriausias kainas? 🚨](https://preview.redd.it/ltghvxmuajee1.jpg?width=1157&format=pjpg&auto=webp&s=c49f10cb319c4f9f6d55fcead0f8cbf4b2437499)

Sutaupykite laiko ir pinigų – skaitykite ir rinkitės geriausius pasiūlymus! 💰

\#Akcijos #PricerLt #Sutaupyk #PrekybosTinklai #GerųPirkinių"
