Post Title,Subreddit,Post ID,Created Time,Upvotes,Upvote Ratio,Comments Count,Post URL,Author,Flair,Post Text
Character rotation in isometric game,Unity3D,1i9xgr5,2025-01-25 16:24:44,1,1.0,0,https://www.reddit.com/r/Unity3D/comments/1i9xgr5/character_rotation_in_isometric_game/,FunHaverStudio,Question,"Been looking for an answer to this question, but haven't found anything so that works, so here goes -

  
In an isometric game, I'm trying to rotate my character in the direction that he's moving. When I implement transform.rotation as shown below, the player does rotate the direction I hold down, but he starts moving in an unexpected way. (I hold down A or D, the player moves in the -x direction, I hold down W or S and the player moves in the +x direction).

Without the transform.rotation portion of the code, the player moves as intended. (W moves the player in the isometric up direction, S moves the player in the isometric down direction, etc.)

My movement code is applied to an empty game object (Player1) with the  modeled player game object and metarig as child objects.

https://preview.redd.it/02ctewaki7fe1.png?width=1267&format=png&auto=webp&s=a9f19a84d3f744ba2dcbb3aefcdf135a8d73486a

https://preview.redd.it/3fxjo5vmi7fe1.png?width=1537&format=png&auto=webp&s=2f847ece751ba4288021a4651fde28c7cf183587

https://preview.redd.it/t3ejhfvoi7fe1.png?width=1555&format=png&auto=webp&s=70711169737ca6ad7178a5d87798dc7e30ea0cda

  
Here's the code:

https://preview.redd.it/82bh7htnh7fe1.png?width=968&format=png&auto=webp&s=d26e09e40fcdeb491d34650c866936b202040d10

"
"Bit early for this, but here's how I'd balance stuff",MyHeroUltraRumble,1i9x4y6,2025-01-25 16:10:13,1,1.0,0,https://www.reddit.com/r/MyHeroUltraRumble/comments/1i9x4y6/bit_early_for_this_but_heres_how_id_balance_stuff/,Perdita-LockedHearts,Game Feedback,"Firstly, these are all opinions. Early opinions too, but we've seen a lot of Kurogiri combos and stuff these last few days, and I think we've got a good grasp on him, no? Maybe not in a 3 stack, since a lot of people play solo queue, but still. Balance is a huge issue, and I plan on copy and pasting this stuff to the official discord's feedback. if I'm not being stupid with these changes, and add more changes based off of what you say about characters I was never skilled in (My aim and mechanics feel terrible now, so no way I'm good at Iida or Ibara all of a sudden). Skill sets will have parenthesis with the skillset's name. If I think a special action should be changed, I will put it under both the OG character and the skill set, labeled (Character's name) Special Action.

Izuku Midoriya: Crouched Alpha at lvl 9 deals 115 damage, and previous levels are adjusted accordingly, and 2nd Gamma is received at level 4.  Gamma now properly pulls targets (bug fix)

Izuku Midoriya (Full Bullet): Alpha has larger spread and deals 1 less damage per pellet (at lvl 9 he does 100 damage), and a fully charged Beta requires more height.

Katsuki Bakugo: Alpha deals 7 more damage across all levels, and Gamma now properly drags opponents for the final hit

Katsuki Bakugo (Machine Gun): Now only has 1 Gamma, and 3rd Beta charge is gained at lvl 7.

Ochako Uraraka: Gamma now comes out faster. Gamma does full knockdown upon ""releasing"" the Gamma. Decrease Alpha reload speed at all levels by 1 second.

Shoto Todoroki: Alpha hitbox is widened at all levels, and damage is increased by 5 across all levels. Beta is slightly further away. Gamma travels faster.

Shoto Todoroki (Ice Fang Wind Flame): Alpha deals 20 less damage across all levels. Now only has 2 Beta charges. 

Tenya Iida: Alpha deals 5 less damage across all levels. Beta deals 20 less damage at lvl 9, and progression is scaled accordingly.

Asui Tsuyu: Alpha now starts with 3 charges, and deals 10 more damage across all levels

Denki Kaminari: Alpha deals 5 less damage across all levels. Beta has stuns on every hit (NOT electrify). Gamma deals 15 less damage across all levels.

Eijiro Kirishima: Alpha now properly carries, even when turning. Beta deals 15 more damage across all levels, and has significantly longer range at lvls 1-3, and slightly longer range at lvls 4-8, and Beta no longer stops at an opponent- Instead, Kirishima has an active hitbox for Beta for the entire duration.

Eijiro Kirishima (Red Drive): Alpha travels slower. Bug fix so that Alpha>Beta movement tech no longer works.

Momo Yaoyorozu: Beta comes out faster and now blocks attacks in a semicircle in front of Momo. Attacks behind Momo still hit. Gamma takes less time to place and start firing.

All Might: Alpha deals 11 less damage across all levels.

All Might (Special Action): It now takes 40 seconds to fully recharge, whether from jump or fully depleting the gauge from carrying someone.

Shoto Aizawa: Alpha now properly pulls targets to you (bug fix). 

Tomura Shigaraki: Both Alpha AND Beta now hit slightly above the ground in a similar manner as Overhaul Gamma, in such a way that Hawks flying at ground level, alongside certain moves performed along the ground after jumping (such as Iida's Alpha- it temporarily stops the damage from what I found). 

Tomura Shigaraki (Catastrophe): Alpha, Beta, and the last hit of Gamma now hit slightly above the ground in a similar manner as Overhaul Gamma and the Strike Shigaraki changes for the same purposes. Alpha now travels faster and knocks down upon 2nd hit. In addition, the direct hit deals 12 more damage, and the indirect hit deals 10 less damage across all levels. The 1st hit of Gamma knocks down faster so that you cannot perform a second Gamma or beta after landing a direct Beta at the same target.

All for One (Special Action): Special Action now has a 5 second cooldown, instead of 20 seconds.

Dabi: HP increased to 400. Alpha travels faster. Beta now deals all damage in a single hit, and does 160 damage at max level, with level one dealing 20 more damage, and the levels inbetween adjusting accordingly. Additionally, you have 1 more charge at levels 1-3.

Dabi (Crazy Torch): HP decreased to 300. Alpha, when not powered by Gamma, charges faster. Beta no longer has tracking, and travels further when not powered by Gamma. Additionally, the final hit of Beta always does a hard knockdown, and the kick, when the grab does not connect, allows for recovery. Finally, the hit registration is now fixed. Gamma has a cooldown similar to Iida's Gamma, and no longer generates flame rings while active. Additionally, upon ending Gamma, it always does the final burst. 

Himiko Toga: Alpha, at levels 1-3, have a cooldown of .75 second per bullet, and at levels 7-9, a cooldown of 0.4 seconds. Beta cooldown increased by 7 seconds. Beta's range for the initial hit is doubled. At max level, the first hit of Beta deals 10 more damage, and the second and third hits now deal 42 more damage, and the following hits deal 50 damage each. (For an explaination, the ""dash"" at the start of Beta comes out in 3 hits. Right now, it deals 10, 33, and 33 damage, respectively. Afterwards, we get the 88 damage per hit. With the changes I made, it deals I think 41 damage more for hitting all hits? However, not hitting it at the start means you deal less damage.) Gamma has better tracking, a cooldown increase of 8 seconds, and deals 7 less damage across all levels per needle. (The following cooldown changes are VERY dependent on the Special Action changes I made)

Himiko Toga (Sting Dance): When using Alpha, there is a .5 second delay instead of the .33(?) delay before you can fire another Alpha, the bullet count is now increased to 10, and the cooldown is increased to 1.75 per bullet. Beta's cooldown is now doubled. Gamma's distance is increased by 1.5 at levels 4-9, alongside the speed of the second part of Gamma, and Gamma now does not gain an additional charge. Additionally, the cooldown for each charge is increased by 3.5 seconds (The following cooldown changes are VERY dependent on the Special Action changes I made)

Himiko Toga (Special Action): Transform now no longer resets your cooldowns. Instead, Alpha, Beta, and Gamma all recharge at the same rate while Transformed. (This effectively requires Toga to use blood effectively for longer periods of time to fully recharge their abilities. Also, Transform effectively has a ""cooldown"" until the next down OR until Gamma recharges- which, for both, is around 12-13 seconds \[per charge\] if I did my math right, meaning she ACTUALLY has to juggle cooldowns.)

Endeavor: Alpha and Beta bug fixes (ofc). Alpha now hits one additional time for each bullet (without changing the duration), and he has 6 bullets at all levels. Beta's first hit deals 40 more damage at level 9, 20 more damage at lvl 1, and all other levels are adjusted accordingly.  Gamma now takes less time to activate.

Endeavor (Special Action): Sustaining Sprint while using special action now costs 75% of the current drain. Using it to jump consumes 35% of the gauge, instead of 50%, and has less startup, and you can't use it if the gauge is under 35%.

Mirio: Increased to 250 HP (Mirio mains before the nerfs- tell me the old combos plz- I'll take it into consideration when posting to the discord)

Nejire Hado: Alpha travel speed is increased. Beta size is decreased, and subsequent hits deal damage every .5 seconds instead of .25 seconds(? Still- the point stands). Additionally, the gauge for Beta goes down faster. 

Overhaul: Alpha deals 5 more damage on the initial hit (so 80 per bullet, as, right now, the first hit is 15, while the other 3 are 20). Gamma deals 30 less damage across all levels, but stuns for twice as long.

Overhaul (Special Action): When healing, instead of fully healing and healing 125 shields while self-healing and fully healing both upon healing an ally, both using up both charges, self-healing heals for 175, prioritizing HP, and uses one charge, and healing an ally heals for 300, prioritizing HP, and uses one charge. (This allows him to be more flexible with his heals but heal for less during a fight most of the time. Also, allows for the second charge to be used to disrupt a combo even if you healed once.)

Twice: Remove Gamma tracking. (From what I know, Twice was fine before they added tracking? Correct me if I'm wrong tho)

Compress: Alpha stun is reduced, and fire rate is SLIGHTLY reduced (Maybe to 1.5 times a second instead of what seems to be 2 times a second?). 

Hawks:  Alpha deals 3 less damage at all levels. The subsequent hits of Beta now deal the same damage as the first hit. The last hit of Melee now causes a full knockdown. 

Itsuka Kendo: Alpha has a tighter spread. Beta insta-break bug fixed (if it wasn't already). Gamma damage increased by 36 damage at lvl 9, and damage for previous levels is adjusted accordingly. 

Mt. Lady: Gamma recharges at 6.5 seconds per bullet at levels 4-6, and at 5 seconds per bullet at levels 7-9. 

Cementoss: Alpha structure is shorter, and the second hit of Alpha deals 20 less damage at all levels. Gamma is thinner at levels 4-9. Beta is now fixed, if they didn't fix the wall bug stuff where it instantly broke sometimes. (People who have fought more Cementoss, and people who play him- tell me if these are bad changes)

Ibara: Alpha finishes faster. Beta now deal their second hit of damage faster, and finishes faster. Gamma hits faster. (I feel like the main reason why she isn't that great compared to the rest of the cast is because of how immobile she is. Hopefully this would help her? I don't play her though. I once again request help from people who main this character.)

Kurogiri: Alpha now properly is perpedicular to the surface it hits, if it hits a wall, floor, or ceiling. Beta damage is reduced by 15 at all levels. Gamma travels faster. (The beta change is mostly because triple Beta into Alpha is a thing, and while I think it's good that they have it, it does need toned down a LITTLE so that most the cast isn't screwed over by it and being flesh.)

Present Mic: Beta, when held down, now deals 5 less damage per hit. Gamma now has 2 charges instead of 3, and deals 20 less damage at all levels. Additionally, the multipliers for 1 and 2 teammates down or dead is now 1.25 and 1.5, respectively. (He should still be a proper strike character with this, but he's definitely overtuned, even if not as overtuned as other characters)

Present Mic (Special Action): Has 2 charges instead of 3.

If you're wondering, the character I changed the MOST was likely both Togas. In third place, it's Strike Dabi thanks to all the Beta and Gamma changes lol. In fairness though, I overhauled how Toga's Transform worked, and made sure to change a bunch of cooldowns, alongside the other changes I made.  Anyway, that's quite literally EVERY character, except for Denki (Lightning), which hasn't released yet, so if these changes are trash, tell me which ones! I'll start copying the list of changes at 3 PM CST to the official discord TOMORROW, so 23 hours and 50 minutes from this post going live (it took me 3 hours to type this all out, thanks to me having to test/find some stuff and find proper damage numbers, as the database only displays 1 of several damage numbers for multi-hit moves). "
Twitching?,POTS,1i9wubb,2025-01-25 15:57:12,1,1.0,2,https://www.reddit.com/r/POTS/comments/1i9wubb/twitching/,TypicalMistake4040,Symptoms,"I'm not diagnosed with anything yet because I haven't been able to really talk much about it, but recently I tried to speak up about it with a family member but they kept saying it was ""anxiety"". I've had problems for YEARS and never said anything because I thought it was normal because people said it was just anxiety but it most definitely is not JUST anxiety  something is seriously wrong and it keeps getting worse everyday. I've talked to many people online trying to get somewhat of an idea of what might be happening, and my suspicion is that is might be POTS and VVS. I started getting ""shaking episodes"" in my hands back in 2021 were my hands would just start shaking so bad sometimes out of nowhere. I noticed a long time ago that my right was always worse then my left, and majority of the time it would happen in stressful situations but not always like I said. But recently I had a pots like ""episode"" and it was my whole body not just my hands(along with so many more symptoms) which is more typical for me. And again I assumed that the shaking was just anxiety again like everyone said but then it got worse. The shaking would get to the point where I couldn't hold things or do anything in general. I couldn't and can't function like everyone else. A while back it would be not just every once in a while, but more then once a day. Lately I've developed a new problem and I wouldnt really classify it as shaking, more like twitching. Probably like 2 months ago I would notice small jolts like movements every once in a while didn't really think much of it but not my hands this time it's my head. But then again it got worse, the moments in general and everything that comes with it. And ever since the last ""episode"" I had, it has gotten so bad that I'm literally constantly twitching. And I kept having spasms in parts of my body like, fingers, legs, and eyes mainly my right. And when I had that ""episode"" my mouth was stuck in place, weird to explain but my lips were puckering well I wasn't making them, in fact I tried to get it to stop but It didn't until a little bit after. This has happened for the second time yesterday when I kept twitching over and over again but not as bad. The twitching makes me even more anxious so it gets even more worse, and at some times I feel a bit out of it and kinda ""dizzy"" like ig? Not so sure to describe it. It makes me so exhausted and I feel so tired of moving but I can't control it and my neck hurts so bad. My eyes kinda move weird I would say that they are rolling back a bit but I feel that may be a bit of an exaggeration again not to sure how to describe it. The twitching also effects my speech a bit which I've always had a bit of a problem with but it makes it worse and I start to stutter, but when it's extremely bad i just can't think at all. Someone has mentioned before that the ""shaking episodes"" that I mentioned may be a result of tremors which may be true but again I'm not a doctor. But if it is, does the twitching relate to it? Or is it something completely different. I heard something about anxiety tics or something maybe that's a possibility but I'm not sure considering I don't think people with that have as long of ""episodes"" as I do but maybe I'm wrong. I honestly don't have a single clue on what's going on. I need to go to the doctors because everything just keeps getting worse and I'm literally going insane because of it, I can't function in general because of everything and I don't even have a choice. But the thing is my family member won't take me in, and on top of that the last time I had that ""episode"" she called for me and they wouldn't even let me come in because I needed to just go to the emergency room because my blood pressure was so high. My family member just said we'll go to the emergency room next time it's that high. Any idea of what might be going on?"
[745] I was told my writing was bad. Any feedback?,DestructiveReaders,1i9wmp8,2025-01-25 15:47:56,0,0.5,2,https://www.reddit.com/r/DestructiveReaders/comments/1i9wmp8/745_i_was_told_my_writing_was_bad_any_feedback/,NanzorMe,Leeching,"A tired and young woman shuffles into the conference room, her gaze sweeping over the men gathered around her. The other participants stare at the woman in curiosity.

The group is only known by its codename, Phoenix. Each individual present has a unique niche, yet their roles are equally important for the war effort and are not to be underestimated. The team captain pulls her arm to make her face him. He scans his notepad with his pen along the names until it stops the more feminine-sounding one.

""Mallorie, you're up. We have identified the whereabouts of a terrorist arms dealer and his small army, and we’re going to take him on.""

""Sir, I-""

The captain cut her off, his voice stern and uncompromising.

""This operation needs someone fast, discreet, and smart enough to get out unnoticed. We believe that's you. Go back to your apartment and meet here tomorrow at 3:00 PM. Don’t be late. Don’t.""

“Please call me May, sir.”

“Sorry, May.”

He forced a smile on his face and walked away from her, choosing another member to focus on. 

May reached home and spent a long time kicking a soccer ball against her wall. Surprisingly, she enjoys doing that since nothing she does can solve her endless yawning. She turns on her television and mindlessly scrolls through the channels, stopping at sitcoms out of habit. 

She lays on the couch, reaching for the TV remote without moving from her position to get it. She slumps her fingers along the keys and starts putting on her favorite show to watch, a habitual choice. Though it doesn’t necessarily spark her interest. As her eyes scan the screen, she gets lost in her thoughts, the bright colors and happy dialogue displaying a distraction, yet she can’t describe this empty feeling while watching this show. She doesn’t know what it is, but the show gave her something to focus on. As she watched her show, she felt no genuine interest and didn’t know why. May didn’t feel like answering all the questions her mind raced upon her. May walked towards the mirror, peeking one last glance at the screen before returning to her reflection. Her eyes focused on her rather tired expression, noticing the circles under her eyes. She paused, sighed, and then free-fell onto her bed. She shut her heavy eyelids before slowly dozing off.

Just as she was having vivid pictures dance through her mind, an unnecessarily loud ringtone woke her up and set her up in that manner, knowing she would have ignored all her calls otherwise.She grabbed the phone and laid her gaze on the screen, and as soon as the contact name read “Big Shot Captain Guy,” she pressed the green answer button.

""I’ll send you the coordinates. I have booked a place for us to meet. There are rooms there, so there is no need to go back to your apartment just to come back after every mission. Pack up.""

“Yes, si-“

The sound of a sudden beep of her phone call met her end.

May looks down at her clothes, her eyes landing on a water stain. Refusing to get out of bed, she rolled around. Her head thumped, and with an internal cry, she finally mustered the strength to get up. May started walking toward her closet to get something new to wear. It was sparse, with only 24 pairs of white wool T-shirts and 25 pairs of regular blue jeans, both in size L. Even though she was 90 pounds and 4'11"", she didn’t care about whatever image people perceived of her because of this. She preferred the feeling of loose clothes to tight ones; they made her feel itchy. Why should she sacrifice her comfort for the amusement of mere mortals? 

May's hands landed on the clothing hanger following a weary sigh, removing it with slow and meticulous movements, making sure not to snap this one. May tried to recall the last time she had broken a hanger, realizing it had been quite some time. She smiled, reminiscing about this fact, but she still frowned at the steps of switching attire. letting out another tired breath and continuing her movements, she removed her previously stained clothes and put on her clean pair. She starts walking to get out of her room, a realization now popping up in her brain like a lightbulb in a cartoon, coming back to her room and grabbing her bags."
Online 5e Dalelands.,lfg,1i9wmh5,2025-01-25 15:47:39,1,1.0,0,https://www.reddit.com/r/lfg/comments/1i9wmh5/online_5e_dalelands/,Captivus3,Player(s) wanted,"I run mainly theater of the mind but I do have pictures for references so no one gets lost.
I prefer voice chat but some use text. What ever and when ever works best for you.

So the campaign is set is the Dalelands of Faerun.
All maps are hand drawn on Grid paper.
You can go off the edge of the map, although ""here be dragons"" is literal. You've been warned.

Every grid square is 1/2 mile.
Movement on the main road, marked on the map is faster than moving through the forest. Dungeons have teleport circles for the same purpose.

You can go anywhere and do anything you want (within reason). There will be quests to complete that will possibly take you through the forest. As you move across the map, I will roll to check if you have an encounter. If you do, I roll on a D100 Random chart. If the outcome is thematic, you'll meet that encounter.
If the encounter isn't thematic enough, you won't meet that encounter. 

So it's not totally random what you encounter, but the dice do the majority of the decision making.

We are currently using the 2014 rules with some homebrew characters for balance purposes.

We use standard array +1, so all stats get a +1. Making the lowest stat a 9 and the highest a 16.

There is currently an TomeLock, a battle master, a divination wizard, a glamor bard, and an occasional Redemption Paladin.

You can play any official class/subclasses you want.

Most players are using dnd beyond for character creation.

Players are currently level 9.I don't run combat unless it makes role play sense. Most encounters can be talked your way out of with the right tools.
You will get exp for successful social encounters."
DEN/ATL/BKN,NBAtradeideas,1i9wm66,2025-01-25 15:47:19,2,1.0,7,https://www.reddit.com/r/NBAtradeideas/comments/1i9wm66/denatlbkn/,Desert_Jokic,,"https://preview.redd.it/hyi9es8mc7fe1.jpg?width=1440&format=pjpg&auto=webp&s=26063dbef5f6e50694e8781aa454abd917a2bbdc

Who says no? "
37w4d and I’m absolutely miserable.,pregnant,1i9wkxu,2025-01-25 15:45:51,1,1.0,3,https://www.reddit.com/r/pregnant/comments/1i9wkxu/37w4d_and_im_absolutely_miserable/,Thisbitchmik,Need Advice,I’ve been in and out the hospital a couple times this week. They send me home each time. I go because I have decreased fetal movement but when I’m there she’s fine and moving and as soon as I leave it’s like she stops. They want me to do a kick count but I told them today she does not kick or move 10 times in 2 hours it’s less than that. I’m just worried. I’m having the worst Braxton hicks and I’m extremely uncomfortable. They send me home every time and the nurse at L&D told me to come back if I felt like I needed to but I’ve been there so many times this week I’m nervous they’ll think I’m annoying (I’m an overthinker) or think I’m lying about it because when I’m hooked up she’s moving. I don’t know what todo. I just need some advice or something. 
