Post Title,Subreddit,Post ID,Created Time,Upvotes,Upvote Ratio,Comments Count,Post URL,Author,Flair,Post Text
Polyswarm NCT preforms best when you doubt it!,PolySwarm,1i7bvbe,2025-01-22 09:07:30,16,0.91,11,https://www.reddit.com/r/PolySwarm/comments/1i7bvbe/polyswarm_nct_preforms_best_when_you_doubt_it/,Only-Discipline-6980,,[https://x.com/i/status/1882052155563270254](https://x.com/i/status/1882052155563270254)
Where we are with Polyswarm NCT....,PolySwarm,1i6na5i,2025-01-21 12:00:53,11,0.87,9,https://www.reddit.com/r/PolySwarm/comments/1i6na5i/where_we_are_with_polyswarm_nct/,Only-Discipline-6980,,"https://preview.redd.it/vzxqki7oodee1.png?width=960&format=png&auto=webp&s=5853d80550c1810bff74e7f0e7a6009f0cc9365e

"
"No flex, what on here should I shed or rotate into something else?",WallStreetBetsCrypto,1i68m94,2025-01-20 21:47:00,6,0.87,40,https://www.reddit.com/gallery/1i68m94,Top-Contact1116,Discussion,Anyone who knows wtf they are talking about have an opinion on some of these coins I should get rid of? Or rotate money out of? 
Should i take profit from solana and invest it to polyswarm nct?,PolySwarm,1i549i6,2025-01-19 12:50:06,8,1.0,13,https://www.reddit.com/r/PolySwarm/comments/1i549i6/should_i_take_profit_from_solana_and_invest_it_to/,GarbagePitiful1093,,"I think it would be a gamble, but polyswarm is dropping since days, so better days should come. What do you guys think?"
Chrome nct rewards,PolySwarm,1i2ysk0,2025-01-16 15:41:34,6,1.0,6,https://www.reddit.com/r/PolySwarm/comments/1i2ysk0/chrome_nct_rewards/,Icy-Copy-6027,,"So I recently installed the google chrome addon that lets polyswarm track you and rewards you for browsing the web.  I set up a rewards wallet, but each time I try to transfer the nct that I have earned to the wallet, it gives me a transfer fee higher than the total earnings i have accumulated.  Does anyone else have this problem?  How many nct do need to have stored before I can transfer anything?"
ESCAPE THE MATRIX 🕶️🐸 $PEPE $HOPPY $FEFE,fefecoincommunity,1i2tb2k,2025-01-16 11:49:53,2,1.0,1,https://i.redd.it/mxw872t5ydde1.jpeg,fefecoin,,"Do you see it? 🐸

I’m trying to save you guys 

From the cope from the cope some of you felt from Hoppy and Pepe 

Here is a third chance the last chance the very last chance  $PEPE $HOPPY $FEFE

On Twitter aka X
@pepecoineth @hoppy @fefecoinerc"
Hope Polyswarm (NCT) is talking about SWFT exchange. ,SWFTcoin_community,1i00eys,2025-01-12 18:38:29,13,0.94,5,https://i.redd.it/z5v3l0wefnce1.jpeg,Mother_Class_529,News,Hoping this mysterious exchange is SWFT that Polyswarm is gonna partner with. Both have coins that are utility coins. 
Quick Market update - CES/Nvidia. Thoughts from me,PolySwarm,1hw70j7,2025-01-07 19:45:07,7,1.0,0,https://www.reddit.com/r/PolySwarm/comments/1hw70j7/quick_market_update_cesnvidia_thoughts_from_me/,squiglemetimbers,,"NCT & CES 

Let’s talk CES and its impact. With groundbreaking technology emerging at the event, the demand for advanced cybersecurity solutions is more critical than ever. PolySwarm ($NCT) has real-world utility in this space, addressing the pressing need for robust threat detection and mitigation in an increasingly digital landscape.

As NVIDIA continues to revolutionize industries with its AI robotics systems, the value of $NCT is poised to rise significantly. We are witnessing the dawn of a transformative era—a new technological frontier. The next five years will shape the trajectory of humanity, and $NCT’s current valuation at $0.11 represents a fraction of its potential.

Securing a loan in one of the most competitive markets is no small feat. It’s a clear testament to the trust and credibility behind PolySwarm. Institutions don’t invest in mediocrity—this is the future of cybersecurity.

Thanks for coming to my TED Talk. See you all at $0.50.
"
Independence ,PolySwarm,1hvv3jb,2025-01-07 11:20:46,10,1.0,15,https://www.reddit.com/r/PolySwarm/comments/1hvv3jb/independence/,thecryofthecarrotz,,Any theories on why cryptos like polyswarm seem to be unaffected by the drop today? Market is down like %5 but nct and some others didn’t bat an eyelash.  
What is NCT?and do I go all in?,PolySwarm,1hvsrug,2025-01-07 09:36:33,3,0.67,34,https://www.reddit.com/r/PolySwarm/comments/1hvsrug/what_is_nctand_do_i_go_all_in/,ExcitementOk1,,I have 500 xrp and I’m not sure if I should sell all and go fully in with polyswarm or go half and half? Can anyone give me any advice pls i dont even know what NCT is I just got lucky and bought at 0.04
We're on the list!,mogcoin,1hv93uw,2025-01-06 15:35:38,34,1.0,1,https://i.redd.it/lg7jcqjbpfbe1.jpeg,No_Major_8329,,We're on the list for most buyers in the last 24hrs on coinbase MOG ON COUSINS! 🫵😹
"O que eles tem, nós tem em dobro Nós tem tanto dinheiro, fico até enjoado De onde ele vem, tu vai morrer se perguntando 🎶 ",investimentos,1hv11y6,2025-01-06 10:05:28,0,0.43,4,https://i.redd.it/wu7v7awe2ebe1.png,Sharp-Difference9230,Humor/Meme,
Another public service,PolySwarm,1hur5ij,2025-01-05 23:49:21,15,0.94,20,https://www.reddit.com/r/PolySwarm/comments/1hur5ij/another_public_service/,theeyesoretemp,,"My posts gotten taken down, but  I figured Ill try again. NCT is under going tests. For the next two or so weeks. Large whale groups are coming to play with this coin. Benefits and such are another thing, (I can provide screen shots of my previous posts.) 

tlsr (too long, short recap), I stumbled upon a few people while gaming, they bragged and claimed about being super rich, and invited me to their discord, told me what they did, and I watched it in real time) 

Polyswarm is being tested, maybe will last another one or two weeks before two big whale groups jump in. Polyswarm is the cheapest right now that it will be for the foreseeable future. 

It is up to you whether you want to trust or not. Always end user is responsible. I'm just sharing what I have learned and just wanted to positively in the world. 


Edit 1: deleted post

https://ibb.co/rmsGVt1"
Pepe top mover 🚀🚀,Pepecryptocurrency,1hqapqn,2024-12-31 03:47:01,20,0.92,1,https://i.redd.it/mtdnouafd5ae1.jpeg,Puzzleheaded_Coat_23,,To the moon! 🚀🚀
What happens if Polyswarm sells?,PolySwarm,1hc2q0j,2024-12-11 15:08:49,9,0.91,13,https://www.reddit.com/r/PolySwarm/comments/1hc2q0j/what_happens_if_polyswarm_sells/,eatinc00kiez,,"The title says it all, however I'm most curious about what happens to NCT tokens / token holders if polyswarm were to get bought by someone like Microsoft...

  
Any ideas?"
🚨 PolySwarm is Now Listed on Upbit! 🚨,PolySwarm,1gvq2gj,2024-11-20 08:57:44,19,1.0,2,https://www.reddit.com/r/PolySwarm/comments/1gvq2gj/polyswarm_is_now_listed_on_upbit/,PolySwarm,,"We’re excited to announce that PolySwarm’s new trading pairs are officially live on Upbit! 🎉 This is a huge milestone for us, and we’re thrilled to see $NCT getting more exposure.

Even better, Coin Market Cap is now tracking these new trading pairs, so you can keep up-to-date with real-time stats and see how $NCT is performing on the exchange.

👉 Check out the latest stats here:  
[PolySwarm on CoinMarketCap](https://coinmarketcap.com/currencies/polyswarm/)

We’re just getting started—stay tuned for more updates as we continue to grow!"
Tech Team Update,PolySwarm,1gls33w,2024-11-07 09:46:08,20,1.0,3,https://www.reddit.com/r/PolySwarm/comments/1gls33w/tech_team_update/,PolySwarm,,"https://preview.redd.it/ef7db3c3shzd1.png?width=2678&format=png&auto=webp&s=39996fb20dd5572430b3c5898553a8c119e5c1e0

At PolySwarm, we’re always working on fresh ways to strengthen our platform, and we’ve got some exciting updates on the way! We’re adding a new feature to support in-depth, manual malware analysis. Soon, our platform will allow vendors to offer specialized malware analysis services, and our customers will be able to hire these experts directly through our platform for thorough manual assessments. We're starting with a small, trusted group of partners, but we’re excited to begin expanding this service over the next year, bringing more choices and flexibility to our community.

We’re also making significant strides to improve NCT accessibility and build more visibility for it within the crypto community. Part of our upcoming development will focus on empowering the PolySwarm community to crowdsource data through our new AI-driven phishing feature for NectarNet. Participating in this feature will not only help strengthen our cybersecurity platform, but users will also gain access to a tool that helps to protect from phishing and other malicious online attacks. This will be a huge benefit for anyone engaged with digital assets.

In addition, we’ve been hard at work with significant infrastructure upgrades to make everything run smoother and more efficiently behind the scenes. We're enhancing our support for private, customizable communities, giving users even more security and control.

And soon, we’ll be improving our notification system, too. While we already provide email alerts for key events, our goal is to make notifications even more effective so users never miss an important update.

These updates are part of our larger vision to deliver a powerful, user-centered experience, add real-world value, and reinforce our commitment to providing high-quality services. We’re excited about what’s ahead for PolySwarm, and we can’t wait to have you with us on this journey!



Thank you,  
The PolySwarm Team

We encourage you to stay connected with us during this period. Regular updates on our progress will be shared through our communication channels."
LCX back to 12 cents time to buy,lcx,1g2z3h2,2024-10-13 16:31:56,10,0.82,8,https://www.reddit.com/r/lcx/comments/1g2z3h2/lcx_back_to_12_cents_time_to_buy/,Optimal_Falcon_6299,,"Anyone else still bullish on LCX? There was a big rugging a few days ago from this guy myc and his twitter followers all dumping LCX and pumping dia. nct polyswarm was also pump n dumped by the same community.  Super good buying opportunity right now imo I hope you boys are smashing the buy button because LCX is about to rip faces off once mica regulations take effect in December. 

Also I wanted to share I’m just a blue collar worker but my hobby has been investing I have a YouTube channel I talk about LCX a lot because I have big bags and stay up to date on everything going on. There’s a pretty good community of LCX holders on there also. Feel free to join the community the link is on my profile. 
"
Navigating the Swarm: A Trend-Follower's Guide to Polyswarm (NCT),jatslo,1fwwu3p,2024-10-05 14:24:18,1,1.0,0,https://www.reddit.com/r/jatslo/comments/1fwwu3p/navigating_the_swarm_a_trendfollowers_guide_to/,jatslo,,"https://preview.redd.it/cbnhp3q3dzsd1.jpg?width=900&format=pjpg&auto=webp&s=73c64312c0035773e0a3e33633c88d9e506720c0

Section IV.M.2.a.ciii: Polyswarm (NCT)  
  
Navigating the Swarm: A Trend-Follower's Guide to Polyswarm (NCT)  
  
Abstract  
  
In this trend analysis expedition, we delve into the cybernetic hive of Polyswarm (NCT), a cryptocurrency token at the forefront of decentralized threat intelligence. By employing a blend of technical indicators and sentimental analysis extracted from the buzzing corridors of social media, this study aims to map the price trends and market sentiment around NCT. We explore its market performance through the lens of moving averages, RSI, and MACD, juxtaposed with real-time X posts sentiment analysis, to dissect the token's behavior in the wild ecosystem of cryptocurrency trading. Despite the inherent unpredictability of markets, akin to forecasting weather in space, our research attempts to offer a navigational chart for trend followers. This abstract encapsulates our endeavor to understand NCT's market dynamics, highlighting the oscillation between technological innovation in cybersecurity and the speculative dance of cryptocurrency investment, all while maintaining a cautious eye on the ever-present hive mind of trader sentiment.  
  
#TrendingNow, #CryptoTech, #CyberSecurity, #NCTAnalysis, #BlockchainFuture, #TechTrends2024, #DigitalSecurity, #CryptoInvestment, #SwarmIntelligence, #TechInnovation, #CyberThreats, #FutureOfCrypto, #InvestSmart, #TechWave, #SecureTech, #CryptoSpace, #NCTCoin, #TechBuzz, #DecentralizedTech, #CyberDefense  
  
[https://algorithm.xiimm.net/phpbb/viewtopic.php?p=6349#p6349](https://algorithm.xiimm.net/phpbb/viewtopic.php?p=6349#p6349)"
Manual Crypto Arbitrage,coinmatics,1dy3id7,2024-07-08 04:10:58,3,1.0,2,https://www.reddit.com/r/coinmatics/comments/1dy3id7/manual_crypto_arbitrage/,coinmatics_io,,"Crypto trading offers many opportunities, and one fascinating method I've discovered is manual crypto arbitrage. This strategy allows traders to take advantage of price differences of crypto assets on different exchanges.

***Understanding manual crypto arbitrage:***

As each exchange has its own price, which is influenced by factors such as trading volume and trading activity, there's an opportunity to profit from the discrepancy between the buy and sell prices of cryptocurrencies. Essentially, you buy a cryptocurrency at a lower rate on one exchange and sell it at a higher rate on another exchange. The price difference can sometimes be as much as 10%.

***Example scenario:***

https://preview.redd.it/x7po3wne49bd1.png?width=547&format=png&auto=webp&s=082332038872ee17fc202952fe91488e2ed677c6

Consider the trading pair NCT - USDT. On Poloniex, the ask price (the lowest price to buy NCT) is 0.00904, while on Huobi, the bid price (the highest price to sell NCT) is 0.009831. The spread here is 8.7500%, which means that you can potentially earn 8.7500% by trading between these exchanges. However, remember to account for any additional fees or commissions involved in transferring funds between exchanges.

***How does Coinmatics improve manual arbitrage:***

It offers a manual arbitrage service that simplifies the process by aggregating currency rates from multiple exchanges. With their arbitrage panel, all the important information is displayed on one page, allowing you to quickly compare rates and decide on your next move. This efficiency is crucial in the fast-paced world of crypto trading.

***Steps to use Coinmatics for arbitrage:***

https://preview.redd.it/79sqcniz49bd1.png?width=1592&format=png&auto=webp&s=d88e7884f060a49d9aef0e86f80e14503bb98f90

**1. Track rates:** Coinmatics monitors and updates the rates across on multiple exchanges in real time, ensuring you have the most up-to-date data.

**2. Analyze spread:** The platform highlights the spread, which is the difference between the buy and sell prices on different exchanges.

With all the necessary information at your fingertips, you can react quickly to market fluctuations and execute profitable trades.

***Important considerations:***

* **Calculate fees:** While Coinmatics provides the rates, it’s essential to factor in any additional fees or commissions for transferring funds between exchanges to accurately determine your net profit.
* **Access requirements:** Note that the manual arbitrage feature is available only on Coinmatics’ Premium and Premium Ref plans.

In summary, manual crypto arbitrage can be a profitable strategy if executed with precision. Coinmatics offers a robust toolset to help traders capitalize on price differences across exchanges, ensuring you stay ahead in the trading game. 

If you would like to maximize your crypto earnings, exploring Coinmatics’ manual arbitrage service could be a game-changer."
Polyswarm (NCT),PolySwarm,1ctfymq,2024-05-16 11:43:17,12,1.0,5,https://www.reddit.com/r/PolySwarm/comments/1ctfymq/polyswarm_nct/,BreakfastElegant6405,,"Thoughts and comments
Would you guys think the project can reach one dollar ?"
"Trade TOP dApp Tokens on HitBTC, including:",HitBTC_Official,1cqgnmt,2024-05-12 16:05:20,1,0.66,0,https://i.redd.it/nudn4rn1y10d1.png,stingadoge,,
Polyswarm Nct Crypto ,WalllStreetBets,1cq75sw,2024-05-12 08:50:42,12,1.0,2,https://www.reddit.com/r/WalllStreetBets/comments/1cq75sw/polyswarm_nct_crypto/,la_spark650,,Biggest cup and handle in the making. In the long chart. Get ready for blast off soon!!
We had a great time at BSidesSF connecting with the #cybersecurity community and sharing insights about PolySwarm $NCT.,PolySwarm,1cls0no,2024-05-06 15:39:32,8,1.0,0,https://twitter.com/PolySwarm/status/1787490209707294833,PolySwarm,,
Tech Team Update,PolySwarm,1bv0hkz,2024-04-03 14:41:17,16,1.0,0,https://www.reddit.com/r/PolySwarm/comments/1bv0hkz/tech_team_update/,PolySwarm,,"&#x200B;

https://preview.redd.it/qu24ur7b7bsc1.jpg?width=1667&format=pjpg&auto=webp&s=797755d44d291f49629e326f9cbc701456c105e3

**March has been a very busy and productive month for the Swarm, with a number of updates deployed over the past month:**

* Our long-anticipated URL sandboxing feature has been deployed.
* We are also pleased to announce the launch of our EU portal. This comprehensive portal integrates private communities, and work on public community initiatives will start soon. This marks a significant step forward in our service offerings.
* We identified and addressed several bugs within our NectarNet extension, and our team was able to rectify the issues.
* Bug fixes for the portal to resolve a small collection of reported bugs have been mostly completed.
* We are now 1 of 11 projects on CoinGecko in the new Top Cybersecurity category. Securing a spot in this category marks a momentous milestone, underscoring our dedication to bolstering global cybersecurity efforts. This recognition validates our commitment and amplifies our visibility, enhancing our standing within the community.

**Over the coming month, the team will be focusing on a number of projects:**

* The further development of our Sandboxing feature with a focus on triage updates and fixes. Starting with downloading reports as HTML and PDF. Following the completion of this phase, our efforts will shift towards integrating QR code scanning capabilities.
* Tooling to allow examination of portal activity tracking for users mentioned in our previous update will be under continued development. 
* OEM private sandboxing features tailored for our partners.
* Account plan updates.
* And revisions based on customer feedback.

We are excited to share our latest progress as we continue our tireless pursuit of excellence across all facets of our platform. Beyond our tech updates and progress, we are deeply committed to fostering a lively global community of users actively participating with our native token, NCT. We understand the importance of meeting our community's needs, and we're actively striving to improve the usefulness and accessibility of the Nectar token.  
We appreciate our community's continued support and feedback, much of which has proved invaluable in our ongoing development efforts. Together, we are building a safer digital future.

Sincerely,

The PolySwarm Team"
"🛡️ PolySwarm 's NCT powers our decentralized threat intelligence marketplace. By leveraging our token, users access top-tier security solutions, fortifying their digital landscape against emerging threats. It's more than Blockchain; it's the future of cybersecurity. 🛡️",PolySwarm,1beqse5,2024-03-14 13:30:16,8,1.0,0,https://twitter.com/PolySwarm/status/1768326342938890304,PolySwarm,,
Highest number of $NCT retweets within the next 48 hours gets their very own PolySwarm Blockchain! Let’s go!,PolySwarm,1bdyb3a,2024-03-13 14:09:02,9,1.0,2,https://twitter.com/Cpt_Cryptastic/status/1767973987995300335,PolySwarm,,
Tech Team Update,PolySwarm,1b36v7z,2024-02-29 13:05:16,28,1.0,0,https://www.reddit.com/r/PolySwarm/comments/1b36v7z/tech_team_update/,PolySwarm,,"We had a busy month of development throughout February.    


**There have been a number of updates deployed over the past month or so:**     


\- We finished a batch of refinements to our portal User Interface (UI) for Sandboxing. - Several bug fixes have been released to enhance overall system stability and performance.   
\- We worked with our partners at ThreatConnect to implement some Performance Improvements in the PolySwarm App.   
\- We finished a major infrastructure migration that has enhanced our system performance and reliability.   
\- We implemented multiple Engine and Arbiter version upgrades    


**Over the coming month, the team will be focusing on a number of projects:**    


\- The new URL sandboxing feature is nearing completion.   
\- A new QR Code Sandboxing feature is next on the list after URL sandboxing has been released on Portal. The process involves scanning QR codes to collect URLs for submission to the sandbox.   
\- Portal Activity Tracking for Users is being expanded to include all actions a user makes. In the Activity tab in portal, we will allow users to see the actions they have performed, such as user management, enabling 2FA, adding/changing roles, usage of each plan feature, etc. This allows enterprises to have enhanced monitoring and security.   
\- Bug fixing for the portal is in progress to resolve a small collection of recently reported bugs. This will resolve any identified issues and ensure a seamless user experience.     


The continuous development efforts at PolySwarm encompass all aspects of the platform, ranging from UI refinements to the implementation of advanced sandboxing features and infrastructure upgrades. With several components completed and others progressing as planned, the portal is poised to offer users improved functionality, performance, and security. Our ongoing efforts are a reflection of our commitment to staying at the forefront of threat detection and mitigation in the evolving cybersecurity landscape. On top of focusing on the technological advancements within PolySwarm, we are also dedicated to fostering a global network of users who utilize our native token, NCT. We understand the importance of meeting the expectations of our community and are actively working towards enhancing the utility and accessibility of Nectar. We aim to ensure that Nectar provides seamless transactions and incentivizes participation in threat intelligence sharing. Our continuous development strengthens the adoption and effectiveness of NCT and further solidifies its position as a key component of the PolySwarm platform.    


Thank you,   
The PolySwarm Team    


We encourage you to stay connected with us during this period. Regular updates on our progress will be shared through our communication channels."
COINBASE DEGRADED PERFORMANCE- this is another Robinhood?,Bitcoin,1b2csib,2024-02-28 13:06:08,5,0.65,12,https://i.redd.it/jmcp1zvb9dlc1.jpeg,carcass101,,
r/PolyswarmNCT New Members Intro,PolyswarmNCT,1accae6,2024-01-27 09:42:51,2,1.0,0,https://www.reddit.com/r/PolyswarmNCT/comments/1accae6/rpolyswarmnct_new_members_intro/,MyOtherUserWasBetter,,"If you’re new to the community, introduce yourself!"
New Community Listing Onboarding!,DeFianceApp,19dubjx,2024-01-23 12:54:28,2,1.0,1,https://www.reddit.com/r/DeFianceApp/comments/19dubjx/new_community_listing_onboarding/,ConsequenceOld7093,Community Listing,"PolySwarm community page is now live on [https://DeFiance.app/project/Polyswarm](https://DeFiance.app/project/Polyswarm).   


$NCT is now listed on #DeFianceSwap.   


PolySwarm is a crowdsourced threat intelligence marketplace that provides a more effective way to detect, analyze and respond to the latest threats, the ones more likely to go undetected by existing solutions.   


Learn more at: [https://users.DeFiance.app](https://users.DeFiance.app).   
\#Polyswarm #CyberSecurity #Web3 #Capture #DeFiants #DeFianceApp   


https://preview.redd.it/50pz6j4da8ec1.png?width=1920&format=png&auto=webp&s=46a13de32300a5cefe00444a8788bc271fe77a47"
Top Cybersecurity Tokens by Market Capitalization 🔥CTK,ShentuChain,19cgg83,2024-01-21 17:57:38,2,1.0,0,https://i.redd.it/7023uy3pivdc1.jpeg,yazanjarrah,,
Unraveling the effectiveness of NCT tokens in PolySwarm's ecosystem in our newest paper. Learn how this #blockchain solution is setting new standards in detecting and combating cyber threats,u_jatslo,18un61w,2023-12-30 14:14:29,1,1.0,0,https://www.reddit.com/r/u_jatslo/comments/18un61w/unraveling_the_effectiveness_of_nct_tokens_in/,jatslo,,"Unraveling the effectiveness of NCT tokens in PolySwarm's ecosystem in our newest paper. Learn how this #blockchain solution is setting new standards in detecting and combating cyber threats. #CyberSecurityInnovation #NCTToken  


https://algorithm.xiimm.net/phpbb/viewtopic.php?p=6349#p6349

https://preview.redd.it/b7kdq4xseh9c1.png?width=848&format=png&auto=webp&s=a4b864b0316a8b4727b51bebbcbaa3535ed5c51c"
