Post Title,Subreddit,Post ID,Created Time,Upvotes,Upvote Ratio,Comments Count,Post URL,Author,Flair,Post Text
Top 10 Shitcoin hacks of all time.,CryptoCurrency,11jcu6u,2023-03-05 15:37:21,11,0.7,53,https://www.reddit.com/r/CryptoCurrency/comments/11jcu6u/top_10_shitcoin_hacks_of_all_time/,JuicySpark,GENERAL-NEWS,"
We always hear about big coins and exchanges getting hacked for Eth, and BTC but never hear about shitcoins being stolen. That said...

There have been several hacks involving shitcoins. Here are the top 10 examples:

Electroneum (2018) - *a mobile shitcoin mining app that was hacked for $500,000 worth of ETN due to a vulnerability in its online wallet*

Rubycoin (2014) - *a proof-of-work shitcoin that was hacked for 300,000 RBY due to a vulnerability in its code*.

Krypton (2016) - *a shitcoin that was hacked for 21,465 KR due to a vulnerability in its smart contract*

Verge (2018) - *a privacy-focused high quality shitcoin that was hacked for 35 million XVG due to a vulnerability in its mining algorithm*

Vertcoin (2018) - *this shitcoin was hacked for $100,000 worth of VTC due to a 51% attack on its blockchain*

PolySwarm (2018) - *a decentralized antivirus shitcoin marketplace that was hacked for $500,000 worth of Nectar (NCT) due to a vulnerability in its smart contract*

Feathercoin (2013) - *another shitcoom that was hacked for 6 million FTC due to a vulnerability in its code*.

Syscoin (2018) - *a shitcoin that was hacked for $11 million worth of SYS due to a bug in its blockchain*

Bitcoin Gold (2018) - *a shit fork of Bitcoin that was hacked for $18 million worth of BTG due to a 51% attack on its blockchain*.


Last but not least...

Smartcash. I personally owned this promising shitcoin at the time.
In 2018, someone figured out how to mint millions of coins tanking the price within minutes after mass selling them on various shitcoin exchanges until the devs froze the network. This resulted in months long wait where all the holders where in limbo.  

###Honorable Mentions:

Nano(aka Raiblocks)

Although not considered a shitcoin at the time by it's die hard fans, it's pretty much a shitcoin now. With its lightening fast transaction speeds,
In 2018, Italian cryptocurrency exchange BitGrail was hacked for $170 million worth of Nano (XRB), formerly known as RaiBlocks. The exchange claimed that the hack was due to a flaw in the Nano protocol that allowed unauthorized transactions to occur. However, the Nano team disputed this claim and suggested that the hack was a result of BitGrail's poor security practices. The hack resulted in a legal battle between BitGrail and Nano, with both parties blaming each other for the incident.

EDIT:

Also see Harmony One.

From coindesk:

“The Horizon bridge incident resulted in the loss of $99,340,030.00 worth of digital assets across approximately 65,000 wallets and 14 different asset types,”"
🔟 New DeFi Wallet token listings this week 🧵👇,Crypto_com,y9hntw,2022-10-20 22:46:38,2,0.54,5,https://www.reddit.com/r/Crypto_com/comments/y9hntw/new_defi_wallet_token_listings_this_week/,ShawnCDC,Announcement 📰,"&#x200B;

https://preview.redd.it/3us5x192o2v91.png?width=1199&format=png&auto=webp&s=be7fb9058ab989dfa3aecf28d54ff47923ae70a3

🔟 New DeFi Wallet token listings this week 🧵👇

💰 Store 700+ tokens across 29 chains in the Crypto․com DeFi Wallet\*

🚀 Swipe listings now [http://defi.onelink.me/MFZQ/160d10a1](http://defi.onelink.me/MFZQ/160d10a1)

\*Separate from App and Exchange listings

🥳 ETH-ERC20 Tokens

Request REQ

Forta FORT

ARPA Chain ARPA

Marlin POND

Virtua TVK

IDEX IDEX

PolySwarm NCT

🤩 BEP20 Tokens

Bitindi Chain BNI

TiFi Token TIFI

Wombat Exchange WOM"
"PolySwarm Price Prediction 2022, 2023, 2025, 2030, Will NCT Price Hit $10?",u_Various_Issue_6452,y3kxgd,2022-10-14 01:19:07,1,1.0,0,https://thepriceprediction.com/polyswarm-price-prediction-nct/,Various_Issue_6452,,
"Uniglo (GLO) Vault Diversifies With PolySwarm (NCT), The Sandbox (SAND) And Decentraland (MANA)",PolySwarm,xvjqj3,2022-10-04 12:34:20,13,1.0,1,https://coinpedia.org/press-release/uniglo-io-glo-vault-diversifies-with-polyswarm-nct-the-sandbox-and-decentraland/,PolySwarm,,
"Mainnet is now operating at 75%, and we will be making our final push to 100% as early as next week!",PolySwarm,xfys73,2022-09-16 14:19:02,16,1.0,0,https://www.reddit.com/r/PolySwarm/comments/xfys73/mainnet_is_now_operating_at_75_and_we_will_be/,PolySwarm,,"Mainnet processes all transactions using  NCT tokens. Mainnet transactions will continue to scale as the marketplace’s [suppliers and consumer](https://polyswarm.io/partners/) list grows!

Once PolySwarm’s network traffic has made the complete transition over to Mainnet 100%, the Testnet stats will be removed from our portal.  With this, we'll be processing millions of transactions with NCT daily while analyzing millions of threats."
Why isn’t Polyswarm (NCT) available on Coinbase to trade yet? (x-post from /r/Cryptocurrency),CryptoCurrencyClassic,wtgfbo,2022-08-20 16:17:44,1,1.0,0,https://www.reddit.com/r/CryptoCurrency/comments/wtg9yr/why_isnt_polyswarm_nct_available_on_coinbase_to/,ASICmachine,,
Why isn’t Polyswarm (NCT) available on Coinbase to trade yet?,CryptoCurrency,wtg9yr,2022-08-20 16:10:56,0,0.27,14,https://www.reddit.com/r/CryptoCurrency/comments/wtg9yr/why_isnt_polyswarm_nct_available_on_coinbase_to/,WallStreetDoesntBet,PRO-ARGUMENTS,"The crypto token is up today but it’s still only available for all traders through Coinbase via the pro wallet. Polygon and Polymath are both tradable on the custodial side for Coinbase.

The Holy Trinity of Poly cryptos should be available within the same parameters.

Here’s an excerpt from the latest Polyswarm Blog on Malware:

What is Mars Stealer?

Mars Stealer, reported earlier this year by Morphisec and Kaspersky, is a stealer malware. Earlier this month, @ViriBack, a malware researcher on Twitter, discovered a fake Atomic Wallet site at atomic-wallet.net distributing Mars Stealer.

According to Morphisec, Mars Stealer is based on Oski Stealer and was discovered in June 2021. They noted Mars Stealer is available for sale on several underground forums and continues to be under development. A lifetime subscription to Mars Stealer was available for under $200 USD. Mars Stealer steals user credentials stored in internet browsers and crypto wallets. At the time, Mars Stealer was being distributed via social engineering, malspam, and tainted software cracks and keygens.

Mars Stealer disguises itself as another application or plugin. It checks the victim machine’s language settings and uninstalls itself if the language is set to Uzbekistan, Russia, Azerbaijan, Belarus, or Kazakhstan. It searches the victim machine for various types of information and uninstalls itself after stealing the desired information. Information stolen by Mars Stealer includes browser autofill data, credit card information, plugins, and information identifying victim machines. In the sample Morphisec analyzed, the threat actor compromised their own computer with Mars Stealer while debugging."
Will Polyswarm NCT ever reach a 1?,PolySwarm,woa9vz,2022-08-14 12:23:50,10,0.86,13,https://www.reddit.com/r/PolySwarm/comments/woa9vz/will_polyswarm_nct_ever_reach_a_1/,moneyuntapped,,
PolySwarm (NCT) Receives a Very Bullish Rating Wednesday: Is it Time to Get on Board? (x-post from /r/Cryptocurrency),CryptoCurrencyClassic,wm3o8j,2022-08-11 18:04:32,1,1.0,0,https://www.reddit.com/r/CryptoCurrency/comments/wm3ig2/polyswarm_nct_receives_a_very_bullish_rating/,ASICmachine,,
PolySwarm (NCT) Receives a Very Bullish Rating Wednesday: Is it Time to Get on Board?,CryptoCurrency,wm3ig2,2022-08-11 17:57:54,0,0.4,11,https://www.investorsobserver.com/news/crypto-update/polyswarm-nct-receives-a-very-bullish-rating-wednesday-is-it-time-to-get-on-board,WallStreetDoesntBet,ANALYSIS,
New exchange listing for PolySwarm Nectar (NCT),PolySwarm,wjkfzn,2022-08-08 17:16:09,18,1.0,0,https://twitter.com/PolySwarm/status/1556748486263144448,PolySwarm,,
PolySwarm has high volume and is in a great position to explode | Nearly 7 months after Coinbase listed the token NCT on it’s exchange,CryptoMoonShots,wf05n9,2022-08-03 03:35:39,1,1.0,9,https://www.reddit.com/r/CryptoMoonShots/comments/wf05n9/polyswarm_has_high_volume_and_is_in_a_great/,WallStreetDoesntBet,ERC-20 Token,"PolySwarm NCT, a utility token on the Ethereum blockchain, is used to power the PolySwarm Marketplace, a community and network for detecting malware. NCT rewards are distributed to users who provide relevant cybersecurity threat intelligence.

On PolySwarm, threat intelligence producers (""Engines"") earn tokens by analyzing threats. Engine owners buy tokens to supply their Engines with NCT to participate in the Marketplace. Other token holders can buy/sell tokens to help supply Engines owner's needs. In our upcoming use case, users will receive rewards for generating passive DNS data and staking other user's threat intelligence productivity.

PolySwarm partners with its customers to gather threat intelligence feedback to continuously improve the PolySwarm threat marketplace. PolySwarm’s global customers trust the PolySwarm threat marketplace intelligence to protect their digital assets and keep their data flow secure. Customers worldwide use the threat marketplace for multi-engine scanning, file-based vulnerability assessment, live and historical hunting for protection from both known and unknown threats. PolySwarm collects ongoing feedback from partnered customers to inform the threat-marketplace development roadmap to directly benefit customers needs.

PolySwarm also partners with individual security experts to develop their threat detection techniques into new detection engines for the marketplace. These unique and independent researcher engines cover the tails of the malware landscape, often not covered by the larger antivirus engines, thus providing added protection to PolySwarm customers. 

PolySwarm analyzes over 800,000 malware samples per day. In this report we track the top ransomware families and add some context from Christopher Elisan (Tophs), PolySwarm’s VP of threat intelligence.

The research malware team for Polyswarm is called “PolyX”. All polyX membership applications are reviewed by the team of community leaders. Applicants are asked to share their true names with the polyX administrators but are welcome to use pseudonyms within the community."
CAN WE GET EVEN HIGHER? | POLYSWARM (NCT) COIN PRICE PREDICTION 2022!,coinmarketbag,uzc541,2022-05-27 20:49:52,1,1.0,0,https://cryptogemtokens.com/can-we-get-even-higher-polyswarm-nct-coin-price-prediction-2022/,crytoloover,,
PolySwarm - Latest News,PolySwarm,uk5ale,2022-05-07 00:16:07,8,0.9,0,https://www.reddit.com/r/PolySwarm/comments/uk5ale/polyswarm_latest_news/,Proffesor-Prophecy,,"If PolySwarm sign a deal with the government, the NCT token will gain over 100% and it’s gonna be a crazy selling volume for a couple of days. 
These are the latest news for now, everyone pray for Ethereum to go above $2 700 as NCT lost support at $0.026 even after the latest technical update that let us know that in the next couple of weeks something big will happen

PolySwarm Technical Update



We have around 6-7 more engines to transition over to Mainnet, and then another 2-3 security expert engines in the queue. The remainder is made up of either test engines or won't be making the transition at this time. The timeline expectation, for now, is that we will begin upping the throughput of Mainnet within the next couple of weeks and the overall time to completion will be some time around the release of the Beta for our new Telemetry use case (which you can read about at https://polyswarm.io/NCT-for-Telemetry-Beta-signup). Intervals, as we increase Mainnet throughput, should occur every few days, and will be visible on the stats page of our portal.

If ETH finds a support at $2 700 and goes above $2 700,  load NTC tokens, get ready, it is coming soon!

“We will be releasing the Beta of our latest NCT use case soon. Everyday Internet users will be rewarded NCT tokens for providing, enriching, and staking cyber security telemetry through PolySwarm’s platform”"
PolySwarm Threat Bulletin - THIS THREAT BULLETIN IS PROVIDED FOR SITUATIONAL AWARENESS,PolySwarm,ujs4h2,2022-05-06 13:05:23,6,0.87,3,https://www.reddit.com/r/PolySwarm/comments/ujs4h2/polyswarm_threat_bulletin_this_threat_bulletin_is/,Proffesor-Prophecy,,"PolySwarm recently released the following publications and blog posts discussing Russia-Ukraine tensions and the potential for both kinetic and cyber conflict:

Russia-Ukraine Conflict and Cyberwar Implications 
Armageddon Activity Targeting Ukraine
US and European Banks Fear Russian Cyber Attack
DDoS Attacks and New Wiper Malware Target Ukraine

They were some leaks in the media 3 days ago about PolySwarm participation in the government cyber security sector and before they even released the technical update and suggestion that PolySwarm might ink a government deal and this might have triggered a huge volume and NCT token price from $0.025 went up to $0.035 

People expect big news about PolySwarm and the government to ink a deal. But it is not allowed this information to be released before any deal is signed. So it is up to any investors to decide to load up NCT tokens and wait to see if a deal materializes."
PolySwarm Technical Update,PolySwarm,ujrl7s,2022-05-06 12:41:17,8,1.0,1,https://www.reddit.com/r/PolySwarm/comments/ujrl7s/polyswarm_technical_update/,Proffesor-Prophecy,,"

We have around 6-7 more engines to transition over to Mainnet, and then another 2-3 security expert engines in the queue. The remainder is made up of either test engines or won't be making the transition at this time. The timeline expectation, for now, is that we will begin upping the throughput of Mainnet within the next couple of weeks and the overall time to completion will be some time around the release of the Beta for our new Telemetry use case (which you can read about at https://polyswarm.io/NCT-for-Telemetry-Beta-signup). Intervals, as we increase Mainnet throughput, should occur every few days, and will be visible on the stats page of our portal."
PolySwarm NCT token on the rise,PolySwarm,uj15lg,2022-05-05 12:22:01,5,0.86,0,https://i.redd.it/k7owuliynox81.jpg,Proffesor-Prophecy,,
PolySwarm NCT token price move,PolySwarm,uj09yh,2022-05-05 11:42:20,3,0.81,0,https://www.reddit.com/r/PolySwarm/comments/uj09yh/polyswarm_nct_token_price_move/,Proffesor-Prophecy,,"Remember my words if Ethereum goes up NCT will go up as well, if Ethereum plunges , NCT will plunge as well, so load when Ethereum starts going up.
Ethereum looks looks just right now started rising again from $2750 and a lot of panic sellers shorted it already their position and dumped the price now we can buy the dip.
We have to be smart like the crypto whales, they start loading when Ethereum and Bitcoin start pumping and they start selling when Ethereum and Bitcoin plunging."
Crypto Market turned green again after Fed’s Wednesday Meeting,PolySwarm,uitdvj,2022-05-05 05:10:34,5,0.86,0,https://www.reddit.com/r/PolySwarm/comments/uitdvj/crypto_market_turned_green_again_after_feds/,Proffesor-Prophecy,,"The crypto market turned green today, many investors pulled out their money from the crypto market in fear that the Feds Wednesday meeting would send Bitcoin under $30 000 and the entire crypto market shed -20% triggered by panic sell off. NCT Polyswarm token was hit very hard but now would bounce back to $0.04"
"PolySwarm Price Prediction for The Month of May, 2022",PolySwarm,uis34w,2022-05-05 03:33:04,3,1.0,0,https://www.reddit.com/r/PolySwarm/comments/uis34w/polyswarm_price_prediction_for_the_month_of_may/,Proffesor-Prophecy,,"
PolySwarm (NCT) token price will go to $0.05 this month (70% up price prediction), the month of May with the release of PolySwarm beta version. Starting in May, PolySwarm will release a Beta version of this first and exclusively (at time of release) to existing NCT holders and polyswarm.network/ accounts. Holders will be invited first to start receiving NCT rewards just for performing their DNS queries through PolySwarm"
Tech Team Update,PolySwarm,uifcbf,2022-05-04 16:07:58,9,1.0,0,https://www.reddit.com/r/PolySwarm/comments/uifcbf/tech_team_update/,PolySwarm,,"We have around 6-7 more engines to transition over to Mainnet, and then another 2-3 security expert engines in the queue. The remainder is made up of either test engines or won't be making the transition at this time. The timeline expectation, for now, is that we will begin upping the throughput of Mainnet within the next couple of weeks and the overall time to completion will be some time around the release of the Beta for our new Telemetry use case (which you can read about at https://polyswarm.io/NCT-for-Telemetry-Beta-signup). Intervals, as we increase Mainnet throughput, should occur every few days, and will be visible on the stats page of our portal."
"The PolySwarm development team is hard at work adding to the mainnet platform so that current NCT holders and new users can use PolySwarm for DNS resolution. Starting in May, PolySwarm will release a Beta version of this first and exclusively to existing NCT holders and polyswarm holders.",PolySwarm,uh2ap0,2022-05-02 19:07:37,16,0.95,0,https://www.reddit.com/r/PolySwarm/comments/uh2ap0/the_polyswarm_development_team_is_hard_at_work/,Level_Action5520,,"
https://blog.polyswarm.io/nct-token-rewards-for-cyber-security-data?s=09"
How And Where To Buy PolySwarm (NCT) - Step By Step Guide,PolySwarm,u3u0nb,2022-04-14 19:11:20,5,1.0,0,https://cryptooguide.com/how-to-buy-polyswarm-nct/,CryptooGuide,,
How And Where To Buy PolySwarm (NCT) - Step By Step Guide,CryptooGuide,u3u0hg,2022-04-14 19:11:05,1,1.0,0,https://cryptooguide.com/how-to-buy-polyswarm-nct/,CryptooGuide,,
how to buy PolySwarm (NCT),newlistedcoins,u09rs5,2022-04-10 00:09:58,1,1.0,0,http://decryptoo.blogspot.com/2022/04/how-to-buy-polyswarm-nct.html,pedomostafa,,
Let’s Talk Targets,PolySwarm,thj5d0,2022-03-18 20:20:36,19,0.96,16,https://www.reddit.com/r/PolySwarm/comments/thj5d0/lets_talk_targets/,Abstract-Abacus,,"We all know Polyswarm has potential, but what can we expect the value of NCT to be by the end of this year? I’d like to crowd source information that we can use to set a price target. These price targets can be useful for aligning token holders, decreasing market churn, and supporting an upward trend. I think it’s reasonable that with greater interest we could go north of $1. 

Here’s my current thinking: 

- Market capitalization. Currently low, ~$65M. At $1, the MC would be at ~$1.9B. For strong crypto projects this is very attainable.
- Dilution. Should be minimal from here on. Over 80% of tokens are already in circulation. 
- Growing segment. Cyber security is expected to be a growing segment and few projects exist in the space.
- Competition. From a technology perspective, Polyswarm is novel and currently unique. Competition in the crypto space is currently light, which differs from the Layer 2, Web3, NFTs, and DeFi spaces, which are all quite saturated. 
- Technology. Theoretically sound — providing threat assessments on the basis of an ensemble of malware engines is a mathematically proven strategy to improve classification accuracy, sensitivity, specificity. Assuming the integration is done by a machine learning approach that weights the malware engines, this is equivalent to [ensemble learning](https://en.m.wikipedia.org/wiki/Ensemble_learning). 
- Partnerships. Multiple partnerships with large organizations. While not necessarily valuable in of themselves, they provide validation of the company when they’re seeking new B2B customers/partnerships. They also may serve as springboards to larger engagements with existing customers/partnerships.
- Hype potential. Not yet listed on Binance, main net integration expected to complete by the end of this month, other milestones (known: NCT payments for DNS queries using browser extension expected to be released soon, plausible: new partnerships, etc.) expected. 
- Geopolitics. War in Ukraine and the potential for cyber attack retaliation for sanctions by Russia. May result in increased investment in cyber security stocks and crypto projects.

All these factors together may lead to a virtuous cycle where social interest (e.g. on Twitter) grows due to current events and milestones leads to increased value. Rinse and repeat. I think $1 is possible this year and represents a solid first long target. I say we start advocating this view widely. That said, a price target is most achievable when it’s reasonable and makes sense. What are your price targets? Why?"
Polyswarm - NCT Crypto Price Prediction and Technical Analysis March 2022,PolySwarm,tcfe1s,2022-03-12 07:27:29,9,0.85,1,https://youtu.be/dmRJff6uuLc,WanderingMage99,,
What is PolySwarm (NCT) Crypto? - NCT Crypto Price Prediction 2022,coinmarketbag,tbgfxm,2022-03-10 22:10:17,1,1.0,0,https://cryptogemtokens.com/what-is-polyswarm-nct-crypto-nct-crypto-price-prediction-2022/,crytoloover,,
today pawtocol (UPI) jumps 130% than shping (SHPING) jumps 30% than polyswarm (NCT) jumps to 35% .. hopefully it's the week for penny tokens to rise!,JasmyToken,t74toa,2022-03-05 03:10:10,3,0.67,4,https://www.reddit.com/r/JasmyToken/comments/t74toa/today_pawtocol_upi_jumps_130_than_shping_shping/,Ajayemeni,Diamond Hands 💎,.
POLYSWARM PRICE PREDICTION | $NCT COIN ANALYSIS,coinmarketbag,t6upfl,2022-03-04 17:28:43,1,1.0,0,https://cryptogemtokens.com/polyswarm-price-prediction-nct-coin-analysis-review-new-coinbase-coin-listing-should-you-buy/,crytoloover,,
POLYSWARM PRICE PREDICTION 2022! | NEW COINBASE ADDITION! | NCT Technical Analysis! NCT COIN!!,coinmarketbag,t6hvnc,2022-03-04 07:26:56,1,1.0,0,https://cryptogemtokens.com/polyswarm-price-prediction-2022-new-coinbase-addition-nct-technical-analysis-nct-coin/,crytoloover,,
"Add to your calendar PolySwarm (NCT) event: Complete Engine Migration - March 31, 2022",kryptocal,sway1f,2022-02-19 09:10:52,1,1.0,0,https://kryptocal.com/event/76302/complete-engine-migration,cryptocalbot,,
"Add to your calendar PolySwarm (NCT) event: Complete Engine Migration - March 31, 2022",PolySwarm,swarkx,2022-02-19 09:02:10,15,0.95,0,https://kryptocal.com/event/76302/complete-engine-migration,cryptocalbot,,
newCRYPTOlisting: PolySwarm now listed on Poloniex,newCRYPTOlistings,suhfp5,2022-02-17 00:54:22,1,1.0,1,https://www.reddit.com/r/newCRYPTOlistings/comments/suhfp5/newcryptolisting_polyswarm_now_listed_on_poloniex/,roooit,,"&#x200B;

https://preview.redd.it/1xmw6t9s1ci81.jpg?width=50&format=pjpg&auto=webp&s=dda04d5b62cc271c706df0c05645ac0670d171c6

You heard it first here! PolySwarm is now available for purchase or trade on [Poloniex](https://m.poloniex.com/signup?c=6KPLAWPP)

|PolySwarm Price|**$0.045906548971**|
|:-|:-|
|Price change (24 Hrs)|**1.1%**|
|24 Hrs Low / 24 Hrs High|**$0.045032431393 / $0.047343825116**|
|Trading Volume 24 hrs|**$1,234,131**|
|Market Cap|$71,031,250|
|Total Supply|**1,885,913,075 PolySwarm**|

**PURCHASE OR TRADE ON** [Poloniex](https://m.poloniex.com/signup?c=6KPLAWPP)

**PURCHASE OR TRADE ON** [Poloniex](https://m.poloniex.com/signup?c=6KPLAWPP)

PolySwarm price today is $0.045906548971 with a 24-hour trading volume of $1,238,660. NCT price is up 1.1% in the last 24 hours. It has a circulating supply of 1.5 Billion NCT coins and a total supply of 1.89 Billion. If you are looking to buy or sell PolySwarm, Gate.io is currently the most active exchange. Decentralized threat detection PolySwarm is a more effective way to detect, analyze and respond to the latest threats, the ones more likely to go undetected by existing solutions. We are a launchpad for new technologies and innovative threat detection methods, where commercial solutions and specialized engines compete to detect malware, and get compensated based on performance.PolySwarm is currently powered by a network of 55 threat detection software, a combination of commercial engines (i.e. Crowdstrike, SentinelOne, Kaspersky..) and smaller, specialized ones (Android Judge, Coincinitty, Iris-H…) with a narrower expertise. The former provide a wider range of coverage while the latter excels at detecting and reacting to threats earlier within their field.  The combination of both expands coverage against emerging threats. We differentiate ourselves from other multi scanners like VirusTotal (owned by Google) by:

Focusing on new and emergent malware Usage of niche, research-driven engines as suppliers

Contextual threat scoring to enable automation and save analyst time Performance-based economic incentives to improve accuracy

Blockchain technology and smart contracts enable PolySwarm’s crowdsourced, and decentralized economic model, where engines are compensated for accurately determining if a file is malicious or not with NCT tokens, through bounties and a staking model where they ‘pay’ to provide opinions. Currently, on testnet, there are over 5 Million transactions taking place daily. NCT is an Ethereum token that powers PolySwarm, a community and network for detecting malware. NCT rewards are distributed to users who provide relevant cybersecurity data while NCT is used to access insights provided by the network. Learn about PolySwarm and see the PolySwarm marketplace in action here.

**PURCHASE OR TRADE ON** [Poloniex](https://m.poloniex.com/signup?c=6KPLAWPP)"
"Complete Engine Migration - PolySwarm (NCT): March 31, 2022",kryptoevents,stuipk,2022-02-16 07:16:49,1,1.0,0,https://kryptoevents.com/e/complete-engine-migration-6974,cryptocalbot,,
"Complete Engine Migration - PolySwarm (NCT): March 31, 2022",kryptocal,stuip1,2022-02-16 07:16:47,1,1.0,0,https://kryptoevents.com/e/complete-engine-migration-6974,cryptocalbot,,
