Post Title,Subreddit,Post ID,Created Time,Upvotes,Upvote Ratio,Comments Count,Post URL,Author,Flair,Post Text
Just became a xcn millionaire !,XCN,1i9i5bm,2025-01-25 02:54:31,48,1.0,13,https://i.redd.it/077tlqjui3fe1.png,Lynackz,,
What would you swap right now to get me to a million? Thoughts?,WallStreetBetsCrypto,1i99r2a,2025-01-24 18:52:30,104,0.86,351,https://www.reddit.com/gallery/1i99r2a,MowMonet,Discussion,Thinking it matic
Advice needed on my portfolio,WallStreetBetsCrypto,1i92leg,2025-01-24 13:40:57,7,0.77,24,https://i.redd.it/jb3okrk9lzee1.jpeg,WillingnessClean,Discussion,"I have invested 10k (all savings) in these coins cause my friend that has been around crypto from 2016 advices these one and told top 5 or 10 coins are not worth for me investing. Please, should i change something or keep it this way? What can i expect in returns from these?"
🚀 10 Altcoins That Could Skyrocket by 2025 🔥,WhiteRhinoM,1i8gtdn,2025-01-23 18:05:23,3,0.8,3,https://www.reddit.com/r/WhiteRhinoM/comments/1i8gtdn/10_altcoins_that_could_skyrocket_by_2025/,MrsSOsbourne,,"**Polkadot (DOT)**

* **2025 Price Prediction:** $100–$150
* **Why Choose DOT?** Known as the leader in blockchain interoperability, Polkadot seamlessly connects diverse blockchains, enabling a unified ecosystem.



# Solana (SOL)

* **2025 Price Prediction:** $200–$300
* **Why Choose SOL?** Solana stands out with its ultra-fast transaction speeds and minimal fees, making it a top choice for DeFi applications and NFTs.



# Chainlink (LINK)

* **2025 Price Prediction:** $50–$75
* **Why Choose LINK?** As the backbone of blockchain oracles, Chainlink integrates real-world data with smart contracts, ensuring broader functionality for decentralized systems.



# Cardano (ADA)

* **2025 Price Prediction:** $10–$20
* **Why Choose ADA?** Built on rigorous research, Cardano focuses on decentralization and sustainability, earning it a reputation for long-term reliability.



# Cosmos (ATOM)

* **2025 Price Prediction:** $20–$30
* **Why Choose ATOM?** Positioned as the interoperability hub, Cosmos connects multiple blockchains, playing a crucial role in the DeFi ecosystem.



# Avalanche (AVAX)

* **2025 Price Prediction:** $150–$200
* **Why Choose AVAX?** With high-speed performance and low fees, Avalanche is a strong competitor to Ethereum in the battle for smart contract dominance.



# VeChain (VET)

* **2025 Price Prediction:** $0.50–$1
* **Why Choose VET?** VeChain focuses on revolutionizing supply chain logistics, making blockchain technology practical for global trade and business.



# Algorand (ALGO)

* **2025 Price Prediction:** $5–$10
* **Why Choose ALGO?** This platform offers scalability, security, and decentralization, catering to a wide range of applications and use cases.



# Elrond (EGLD)

* **2025 Price Prediction:** $300–$400
* **Why Choose EGLD?** With its high transaction speeds and low fees, Elrond has emerged as a powerful player in the blockchain ecosystem.



# Tezos (XTZ)

* **2025 Price Prediction:** $15–$20
* **Why Choose XTZ?** Tezos boasts a self-amending blockchain that evolves over time, ensuring adaptability and continuous innovation.



# How to Optimize Your Crypto Investments

1. **Conduct thorough research:** Understand the fundamentals of each project and its long-term potential.
2. **Diversify your portfolio:** Spread investments across multiple assets to minimize risk.
3. **Set realistic targets:** Plan your entry, exit strategies, and use stop-loss mechanisms to manage downside risk.
4. **Stay informed:** Keep track of market updates and trends that could impact your portfolio.
5. **Adopt a long-term mindset:** Success in crypto often requires patience and a focus on future growth rather than quick wins.

Invest wisely and stay informed — 2025 could be your year!"
I fell down a rabbit hole trying to find out what happened to bareMinerals. Here’s what I found.,MakeupEducation,1i8cpzc,2025-01-23 15:11:27,14,0.89,0,https://www.reddit.com/r/MakeupEducation/comments/1i8cpzc/i_fell_down_a_rabbit_hole_trying_to_find_out_what/,Chunglefutts,,"I’ve always loved bareMinerals. One of the very first makeup products I started using regularly as a teen was the powder foundation, and I’ve been a fan ever since. I use Complexion Rescue and it’s one of the only effective tinted moisturizers with SPF that I can tolerate on my face these days (either texturally or without getting a rash). Suddenly, it’s completely sold out everywhere. WTF? 

I tried to find a thread on the seeming disappearance of beloved bareminerals products, but couldn’t really find anything definitive on what the hell is going on. So, I fell down a bit of a rabbit hole…

Well, turns out bareminerals was bought by a private equity firm back in 2021, along with Laura Mercier and Buxom. Not a whole lot has come out about it, but [one article quoted](https://www.glossy.co/beauty/whats-next-for-bareminerals-laura-mercier-and-buxom-post-shiseido/) the then-CEO of Orveon Global, the affiliate that now owns the three brands: 

*As the “inventor of clean beauty,” according to Houdayer, makeup label BareMinerals is doubling down on the branding it started with in 1995. 
“We basically want to go back to the initial positioning of the brand and move away from a very non-distinctive clean beauty positioning, because everybody and nobody’s clean,” said Houdayer. Orveon plans to do a brand revamp, with a focus on “modernizing, digitalizing and internationalizing” the brand.*

Around the same time, [a class-action lawsuit was filed against bareminerals](https://topclassactions.com/lawsuit-settlements/consumer-products/beauty-products/bareminerals-class-action-claims-makeup-contains-harmful-manmade-chemicals/) which was part of a [slew of lawsuits alleging use/non-disclosure of PFAS in various consumer products](https://www.resilinc.com/blog/pfas-legislation-and-lawsuits/) alleging that their foundation contained PFAS, though [they were dismissed](https://news.bloomberglaw.com/litigation/shiseido-again-defeats-suit-over-pfas-in-bareminerals-products) due to the consumers’ inability to show that their products contained PFAS. It seems that was filed against the previous company, Shiseido, as it pertains to products manufactured prior to the acquisition. Perhaps the acquisition occurred as a result of the allegations? Pure speculation, of course.  

There is also [a lawsuit](https://www.law.com/radar/card/california-orange-552959-bonnie-reyes-vs-orveon-global-us-llc/) claiming this: 

*The action, brought by Pacific Trial Attorneys, accuses the defendant of deceptively selling the product in an oversized container and underfilling the product in an effort to save money and deceive consumers.*

I don’t see an update thus far, and I can’t read the whole article because I’m not a subscriber, buuuuuut it’s also a bit sus that the CEO was[replaced shortly thereafter](https://cdn.prod.website-files.com/61ba6737c564597f54aabe04/65af2450ddd0c85d3aafa2f6_Press%20Release%20-%20CEO%20Neela.pdf) in January 2024. 

In lazy and speculative conclusion, the past 4 years have been a wee bit rocky for the company and its rebranding process. Combined with the state of the world with Covid, supply chain issues, inflation, and political havoc, I’m really not surprised. Hopefully they can get everything sorted and start putting out great products again in the next few years.

Sidenote: I could probably do a better job digging into the lawsuits, but my coffee is getting cold and my cat has a vet appointment. Subscribe to Bloomberg Law to look at the full lawsuits if you’re inclined, unlike myself! 

ETA: I tried posting this on r/makeup but it got removed/blocked from posting, not sure why."
It’s ok ?,portfolios,1i8bfn5,2025-01-23 14:17:38,0,0.33,4,https://i.redd.it/hp109iewmsee1.jpeg,NewD3monKing,,
VeChain (VET),CoinBase,1i86pk1,2025-01-23 11:03:43,0,0.5,1,https://www.reddit.com/r/CoinBase/comments/1i86pk1/vechain_vet/,Same-Set1762,,Just bought 2000 vet and holding. Hope it goes well by 2040. Any thoughts?
VeThor: A Smart Approach to Blockchain Utility,AllCryptoBets,1i7ztxk,2025-01-23 04:43:25,2,1.0,1,https://www.reddit.com/r/AllCryptoBets/comments/1i7ztxk/vethor_a_smart_approach_to_blockchain_utility/,AntonietteK,ALTCOIN,"I recently came across VeThor ($VTHO), the energy token behind the VeChainThor blockchain, and I have to admit, it’s an interesting concept. Unlike most blockchains where transaction costs fluctuate with market volatility, VeChain uses a dual-token system. $VTHO handles transaction fees, while VeChain Token, $VET focuses on market value. This separation makes fees more predictable, which is something enterprises would definitely appreciate. Plus, $VTHO is automatically generated just by holding VET, which I think is a nice passive earning mechanism.

What really caught my attention is how accessible $VTHO has become. It’s even available on Bitget, which is great for anyone looking to trade it. With its burning mechanisms and dynamic supply model, it feels like VeThor has a solid approach to managing scalability issues without compromising on cost efficiency.

If scalability and cost predictability are what businesses are after, $VTHO might actually be onto something. Have any of you looked into it? I’d love to hear your thoughts!"
This Is Why I Invest/Hold Trump and Melania,OfficialTrumpCoin,1i7gj6u,2025-01-22 12:26:43,26,1.0,7,https://www.reddit.com/r/OfficialTrumpCoin/comments/1i7gj6u/this_is_why_i_investhold_trump_and_melania/,Chandler005,General,"I See a Lot of New People in Crypto on This Sub – Here’s My Two Cents and Why I Bought These Two Coins

First off, welcome to the world of crypto! Here’s my advice for those who are new, and my reasoning behind choosing to invest in these two coins.

# Some Basic Ground Rules:

***1. Never invest money you can’t afford to lose.***

***2. This is NOT financial advice.***   

# Why Meme Coins?

These two coins I’m discussing are meme coins. Typically, meme coins don’t have inherent value—what they do have is hype and a strong community.

If you’re looking for secure investments, these are not for you. Instead, consider traditional stocks, ETFs, or cryptos with solid fundamentals like Bitcoin, Ethereum, Solana, Cardano (ADA), or VeChain (VET)... These options may offer lower risk and better stability, but they also come with lower potential returns (e.g., no 2-5x gains).

If you’re chasing high-risk, high-reward opportunities, then you’re in the right place.

My Background:  I started investing in crypto in 2020 during the last bull run. Back then, I avoided meme coins like the plague because everyone warned me against them.

And while it’s true that they’re incredibly risky, the biggest winners (and losers) often come from meme coins.

I had the chance to invest in Dogecoin and Shiba Inu before they skyrocketed, but I didn’t because I listened to the warnings. Now, looking back, I regret missing out on those massive gains.

So this time around, I’ve decided to allocate 10-15% of my crypto portfolio to meme coins—using money I can afford to lose.

# Why Trump and Melania Coins?

Here’s why I chose these two coins over others:

***There’s a recognizable figure behind them.***

Most meme coins have nothing backing them—no purpose, no leadership. But these coins are tied to two high-profile individuals: the President of the United States and the First Lady.

***Accountability.***

If this were a rug pull, the people behind the coins (Trump and Melania) would face enormous backlash—not just from investors but from the media and the public worldwide.

They can’t afford that level of damage to their reputations, especially from their own supporters.

***Unique opportunity.***

These coins are still very new, which means we’re super early. Yes, there will be volatility in the coming days and weeks, but that’s also where opportunities for profit lie.

 

**The Potential:**

Let’s imagine these coins reach the current market caps of some of the biggest meme coins:

Trump Coin at Dogecoin’s current market cap.

[https://marketcapof.com/en/official-trump/dogecoin/](https://marketcapof.com/en/official-trump/dogecoin/)

Melania Coin at Shib current market cap.

[https://marketcapof.com/en/melania-meme/shiba-inu/](https://marketcapof.com/en/melania-meme/shiba-inu/)

The potential returns here could be huge. Of course, this is a gamble, and I could be completely wrong. But I’m willing to take the risk.

**Final Thoughts:**

If you’re considering investing in these coins, remember to:

***Do your own research.***

***Be prepared for fluctuations.***

**Take profits, especially after 2-5x gains.**

What do you think? If you agree with my reasoning, upvote this post. If not, let me know your thoughts in the comments.

 

Good luck, everyone!"
VeChain VET To ERC20 USDT,CryptoPetra,1i7c98k,2025-01-22 09:25:47,1,1.0,0,https://i.redd.it/15b50u3x1kee1.png,Best-Ad-5053,,
VeChain VET To NEAR USDT,CryptoPetra,1i7c91p,2025-01-22 09:25:32,1,1.0,0,https://i.redd.it/qg0dpoev1kee1.png,Best-Ad-5053,,
VeChain VET To C-Chain USDT,CryptoPetra,1i7c8j7,2025-01-22 09:24:52,1,1.0,0,https://i.redd.it/cb7wn45r1kee1.png,Best-Ad-5053,,
VeChain VET To TON USDT,CryptoPetra,1i7c8ar,2025-01-22 09:24:33,1,1.0,0,https://i.redd.it/xp4ix83p1kee1.png,Best-Ad-5053,,
VeChain VET To ARBITRUM USDT,CryptoPetra,1i7c81w,2025-01-22 09:24:14,1,1.0,0,https://i.redd.it/kts4qe2n1kee1.png,Best-Ad-5053,,
VeChain VET To POLYGON USDT,CryptoPetra,1i7c7my,2025-01-22 09:23:42,1,1.0,0,https://i.redd.it/vfyhcfmj1kee1.png,Best-Ad-5053,,
VeChain VET To SOL USDT,CryptoPetra,1i7c7dv,2025-01-22 09:23:22,1,1.0,0,https://i.redd.it/3dl0fsjh1kee1.png,Best-Ad-5053,,
VeChain VET To TRC20 USDT,CryptoPetra,1i7c764,2025-01-22 09:23:05,1,1.0,0,https://i.redd.it/beg3a9jf1kee1.png,Best-Ad-5053,,
Can this portfolio be 2-3x by March end?,WallStreetBetsCrypto,1i71mjm,2025-01-21 22:20:50,0,0.5,30,https://i.redd.it/0nulsw8argee1.jpeg,dont-know-nothing420,Discussion,"This is my current allocation. I am planning to hold it until March end, not trading or shuffling much. I am looking to double my money by then (triple will be gravy) and leave for good. How likely this portfolio can generate 2-3x by the end of March 2025?"
"Incredible milestone for our SolarNFT BR#01 collection on MaaS!

🌞 Total Volume: 4,646,875.85 VET
💼 101 Total Holders

🔥 Powered exclusively on VeChain!

Thank you, VeFam, for being part of this renewable energy revolution! 🌍💡",Vechain,1i6grbn,2025-01-21 06:44:07,59,0.96,0,https://i.redd.it/1r30ppl24cee1.png,SolarWise-RWA,,
An unusual problem,Equestrian,1i6e0ef,2025-01-21 03:19:51,9,0.91,4,https://www.reddit.com/r/Equestrian/comments/1i6e0ef/an_unusual_problem/,LunaKPalara,Education & Training,"TL;DR - looking for things to do with my horse on the ground in unfrequent visits until the war/my service ends.

Hey guys. Hope you’re having a really good day.

I highly doubt anyone here has found themselves in this situation, but I was hoping for some advice either way. My horse and I have a bit of a weird history and a bit weird circumstances. I’ll try to keep it brief.

I got my horse in early 2020 when she had just turned 2. We spent two years building trust from the ground. I taught her the basics of accepting the brush, picking up her feet, leading, backing up, lunging. I started riding her when she was four, but she proved to be a nightmare to fit a saddle to due to her build, and a couple of “chain” health problems also got it in the way, when EMS made her overweight and even harder to fit comfortably and the weight led to some back pain.

It took nearly two years of trial and error to fit her a saddle, get the weight off and get rid of the back pain. So between ages 4-6, I barely rode her. In September of 2023 I had to move her to another yard with a bigger pasture and better food for her EMS, and because I’m just that lucky - we had an accident on our way there with the trailer that only by miracle she made it out of physically unscathed.

So she was at a new place, having gone through a very traumatic experience (especially as a horse who hated the trailer even before), and things weren’t great.

Then a devastating war broke out in my country. I had to enlist. She had a couple scares while I was away in training where missiles had hit close to her yard, and I don’t even know how it may have affected her because I wasn’t there.

In the past year, I’ve only been able to visit her every few months. She’s in 24/7 turnout, with plenty friends and a constant food source, and the yard owner gives her some attention and supervises her farrier and vet visits, so I know she’s okay.

She turned 7 this January. I haven’t trained her in ages and I’m worried that, if I make it out alive to be discharged a couple of years from now, I’ll never be able to get her back under saddle. But that’s the least of my worries now. I’m mainly worried about how to still keep our connection “fresh” during this time. We used to spend hours and hours together every single day and had very strong trust between us. She would follow me around everywhere, nap against me, we’d even run around together in the arena and she would mirror me perfectly. Now we’ve gone from that, to what feels like practically strangers. Which is stupid, she’s a horse, and as long as she’s healthy and happy I don’t really care about anything else - but it’s troubling me, especially when I’m struggling to stay hopeful during these years until we can go back to spending every day together. I see people with their horses online and I feel like my insides are burning with jealousy. I feel like I’m missing entire years out of her life that I’ll never get back.

I’ve found a way to perhaps visit her once a month, but in my last few visits I only really brushed her and cleaned out her feet and udders. There’s no point lunging when I’m not there frequently and consistently enough to make progress in her training, and riding is worlds away from us.

Basically what I want to do is build a groundwork/in-hand activity plan to make the most out of our limited monthly time together. Something that I can do with her for a few hours once a month to stay “fresh” in her mind and give her some positive experience and memories every visit, so that when I come back full-time in a few years I’m not an utter stranger. It’s going to be hard to get her under saddle at 10 years old but I’m trying not to focus on that for now. My main objective is to make the most out of my visits and keep her “handled.”

It’s a bit vague, I know. But I’d love some advice. Or if somehow you’ve ever been in a similar situation, I’d love to hear what you did."
How does my portfolio look?,WallStreetBetsCrypto,1i65176,2025-01-20 18:53:42,2,1.0,7,https://www.reddit.com/gallery/1i65176,Gianleafs,Discussion,Will I be a millionaire
Recovered memory on mushrooms/MDMA.,MSSAbuse,1i5znta,2025-01-20 15:08:50,6,0.81,4,https://www.reddit.com/r/MSSAbuse/comments/1i5znta/recovered_memory_on_mushroomsmdma/,ihopeitreallyhurts,,"TW: child sexual abuse, grooming, incest

TL:DR - I recovered memory of my mother and grandfather molesting me while on a strong dose of psilocybin mushrooms and MDMA.

I (51,M) have recently been grappling with a bunch of COCSA stuff from my distant past, both on my own and in therapy. The pain of it all has been so great that I was living inside a panic attack which I kept hidden for about two months. I started thinking I could have a heart attack at any moment. I needed to figure out how to deal with it or die.

I have a lot of experience with psychedelics (and drugs in general) both for recreational and therapeutic purposes. They’ve helped me in bigger and more material ways than decades of psychotherapy have.

Four days ago, as I was struggling to breathe as I walked down the sidewalk, i decided that I was going to trip and get to the bottom of this when I got home. It was my last day of training at a new job and everyone there was really supportive and kind to me. I saw this as an auspicious sign.

I returned home, put pajamas on, and straightened up my apartment. I put on a long, mid-tempo techno/house DJ mix. I set my intentions to heal my sick, broken heart. I made a tea with 3.5 grams of mushrooms and drank it. In less than 30 minutes I was tripping balls and spirit guides were rushing up to meet me. I told them what was wrong in detail and that I needed help. I told them my heart is sick and I need healing. They said “It’s all good! We’ve got you!” Thirty minutes later I took 125 mg of MDMA. As I was in a dialogue with one of the mushroom spirit guides, the MDMA came on strong and floored me. I felt physically overwhelmed and I moved from my couch to my bed.

By the time I got to my bed, the intensity of my emotions and my somatic responses was ramping up. I was curled up in a tight ball, silently pleading to the spirits for relief; asking them why things are the way they are, why they were the way they were, and what hope there is for me. A gentle, non-threatening voice plainly stated “You were sexually abused.” Deep down, I’d always known this. I started asking who? The spirit voice didn’t seem to want to say it.

I asked, “Was it my parents?” As soon as I asked, something happened inside me. It was mental and physical. I experienced a physical feeling sort of like how I’d imagine it feels when a dislocated joint pops back into its socket. I gasped and immediately I could feel my mind and my body reconnect themselves. The muscles that had been knotted in my neck and back for over a year just released. A space opened up in my consciousness that had never been there before. In that space I saw a glimpse of the abuse. I sat up and was just like, “Holy shit. Holy shit. Holy shit!” In the moment, in that psychic space, it was a relief. I knew for the first time that I am not insane. So many things in my childhood that never made sense suddenly snapped into place. 

I called a couple that I’m close friends with and told them everything I’d just experienced. They were flabbergasted.

The next day, a bunch more memory came back. There was a bunch of stuff about grooming that my mother and aunt did. And there was a longer, more detailed glimpse into the actual sexual abuse. I was in the bathtub. I was maybe 2 years old. It was my mother and my grandfather in the bathroom with me. They touched my penis with their mouths. It felt good and they were laughing. I also realized my mother exploited my father’s (Vietnam vet, PTSD, OCD, codependent, narcissist) violent temper and his penchant for bullying me in order to make herself appear to be the good parent while she was much more directly and consistently abusing me. It’s all disgusting and terrible but it’s still a relief. I am no longer confused and I am not in a trauma loop. I feel liberated from the chains that were in my mind. Also, I’ve been addicted to porn for my whole life (2-5x/day for as long as free internet porn has existed plus decades of magazines and VHS) but I haven’t used any porn or masturbated in 4 days. I think I might just be too shocked right now.

I’ve ordered The Body Keeps The Score. I will continue to work with my current therapist though I think I may need to seek out someone with more specialized skills (not easy with no money).

I know that this is probably just the beginning of me untangling the mess that my life has been. I just wanted to put this out there both to help myself and maybe someone else. This is really fucking hard. I wanna confront them but I’m pretty sure they’ll just gaslight me and never cop to what they’ve done. "
How am I doing?,WallStreetBetsCrypto,1i5u2mr,2025-01-20 11:25:42,5,0.86,14,https://www.reddit.com/gallery/1i5u2mr,Shuler13,YOLO,Did I pick the worst one? Any suggestions/advise?
